11:32:07.3470 [INFO] BeagleV-Dromajo: Machine started.
11:32:07.3631 [WARNING] sysbus: [U74_1: 0x800025F2] (tag: 'SDIO') ReadDoubleWord from non existing peripheral at 0x1000002C, returning 0x0.
11:32:07.3657 [INFO] uart3: [host: 0.61s (+0.61s)|virt: 0.1ms (+0.1ms)] 
11:32:07.3659 [INFO] uart3: [host: 0.61s (+0.23ms)|virt:    0.1ms (+0s)] OpenSBI v0.9
11:32:07.3664 [INFO] uart3: [host: 0.61s (+0.53ms)|virt:    0.1ms (+0s)]    ____                    _____ ____ _____
11:32:07.3682 [INFO] uart3: [host: 0.61s (+1.76ms)|virt:  0.2ms (+96µs)]   / __ \                  / ____|  _ \_   _|
11:32:07.3686 [INFO] uart3: [host: 0.61s (+0.44ms)|virt:    0.2ms (+0s)]  | |  | |_ __   ___ _ __ | (___ | |_) || |
11:32:07.3691 [INFO] uart3: [host: 0.62s (+0.47ms)|virt: 0.3ms (+0.1ms)]  | |  | | '_ \ / _ \ '_ \ \___ \|  _ < | |
11:32:07.3695 [INFO] uart3: [host: 0.62s (+0.43ms)|virt:    0.3ms (+0s)]  | |__| | |_) |  __/ | | |____) | |_) || |_
11:32:07.3699 [INFO] uart3: [host: 0.62s (+0.45ms)|virt: 0.4ms (+0.1ms)]   \____/| .__/ \___|_| |_|_____/|____/_____|
11:32:07.3701 [INFO] uart3: [host: 0.62s (+0.13ms)|virt:    0.4ms (+0s)]         | |
11:32:07.3703 [INFO] uart3: [host:  0.62s (+0.2ms)|virt:    0.4ms (+0s)]         |_|
11:32:07.3703 [INFO] uart3: [host:   0.62s (+46µs)|virt:    0.4ms (+0s)] 
11:32:07.3748 [WARNING] plic: Unhandled write to offset 0x200000, value 0x7.
11:32:07.3771 [INFO] uart3: [host: 0.62s (+6.77ms)|virt: 0.5ms (+0.1ms)] Platform Name             : StarFive VIC7100
11:32:07.3776 [INFO] uart3: [host: 0.62s (+0.48ms)|virt:    0.5ms (+0s)] Platform Features         : timer,mfdeleg
11:32:07.3779 [INFO] uart3: [host: 0.62s (+0.34ms)|virt: 0.6ms (+0.1ms)] Platform HART Count       : 2
11:32:07.3783 [INFO] uart3: [host: 0.62s (+0.38ms)|virt:    0.6ms (+0s)] Firmware Base             : 0x80000000
11:32:07.3787 [INFO] uart3: [host: 0.62s (+0.37ms)|virt: 0.7ms (+0.1ms)] Firmware Size             : 92 KB
11:32:07.3789 [INFO] uart3: [host:  0.62s (+0.3ms)|virt:    0.7ms (+0s)] Runtime SBI Version       : 0.2
11:32:07.3790 [INFO] uart3: [host:   0.63s (+46µs)|virt:    0.7ms (+0s)] 
11:32:07.3793 [INFO] uart3: [host: 0.63s (+0.34ms)|virt:    0.7ms (+0s)] Domain0 Name              : root
11:32:07.3797 [INFO] uart3: [host: 0.63s (+0.34ms)|virt: 0.8ms (+0.1ms)] Domain0 Boot HART         : 0
11:32:07.3800 [INFO] uart3: [host: 0.63s (+0.34ms)|virt:    0.8ms (+0s)] Domain0 HARTs             : 0*,1*
11:32:07.3807 [INFO] uart3: [host:  0.63s (+0.7ms)|virt: 0.9ms (+0.1ms)] Domain0 Region00          : 0x0000000080000000-0x000000008001ffff ()
11:32:07.3815 [INFO] uart3: [host: 0.63s (+0.76ms)|virt:   1ms (+0.1ms)] Domain0 Region01          : 0x0000000000000000-0xffffffffffffffff (R,W,X)
11:32:07.3819 [INFO] uart3: [host: 0.63s (+0.42ms)|virt:      1ms (+0s)] Domain0 Next Address      : 0x0000000080020000
11:32:07.3824 [INFO] uart3: [host:  0.63s (+0.5ms)|virt: 1.1ms (+0.1ms)] Domain0 Next Arg1         : 0x0000000088000000
11:32:07.3827 [INFO] uart3: [host: 0.63s (+0.32ms)|virt:    1.1ms (+0s)] Domain0 Next Mode         : S-mode
11:32:07.3831 [INFO] uart3: [host: 0.63s (+0.35ms)|virt: 1.2ms (+0.1ms)] Domain0 SysReset          : yes
11:32:07.3831 [INFO] uart3: [host:   0.63s (+51µs)|virt:    1.2ms (+0s)] 
11:32:07.3835 [INFO] uart3: [host:  0.63s (+0.4ms)|virt:    1.2ms (+0s)] Boot HART ID              : 0
11:32:07.3839 [INFO] uart3: [host: 0.63s (+0.36ms)|virt: 1.3ms (+0.1ms)] Boot HART Domain          : root
11:32:07.3843 [INFO] uart3: [host: 0.63s (+0.41ms)|virt:    1.3ms (+0s)] Boot HART ISA             : rv64imafdcvsu
11:32:07.3849 [INFO] uart3: [host: 0.63s (+0.57ms)|virt: 1.4ms (+0.1ms)] Boot HART Features        : scounteren,mcounteren,time
11:32:07.3852 [INFO] uart3: [host: 0.63s (+0.29ms)|virt:    1.4ms (+0s)] Boot HART PMP Count       : 16
11:32:07.3855 [INFO] uart3: [host: 0.63s (+0.32ms)|virt:    1.4ms (+0s)] Boot HART PMP Granularity : 4
11:32:07.3858 [INFO] uart3: [host: 0.63s (+0.35ms)|virt: 1.5ms (+0.1ms)] Boot HART PMP Address Bits: 38
11:32:07.3861 [INFO] uart3: [host: 0.63s (+0.28ms)|virt:    1.5ms (+0s)] Boot HART MHPM Count      : 0
11:32:07.3864 [INFO] uart3: [host: 0.63s (+0.31ms)|virt:    1.5ms (+0s)] Boot HART MHPM Count      : 0
11:32:07.3869 [INFO] uart3: [host: 0.63s (+0.47ms)|virt: 1.6ms (+0.1ms)] Boot HART MIDELEG         : 0x0000000000000222
11:32:07.3873 [INFO] uart3: [host: 0.63s (+0.44ms)|virt:    1.6ms (+0s)] Boot HART MEDELEG         : 0x000000000000b109
11:32:07.4805 [WARNING] sysbus: [U74_1: 0x80046502] (tag: 'CLKGEN_CSR') ReadDoubleWord from non existing peripheral at 0x11800248, returning 0x0.
11:32:07.4810 [WARNING] sysbus: [U74_1: 0x8004651A] (tag: 'CLKGEN_CSR') WriteDoubleWord to non existing peripheral at 0x11800248, value 0x80000000.
11:32:07.4811 [WARNING] sysbus: [U74_1: 0x8004651E] (tag: 'CLKGEN_CSR') ReadDoubleWord from non existing peripheral at 0x1180024C, returning 0x0.
11:32:07.4811 [WARNING] sysbus: [U74_1: 0x80046530] (tag: 'CLKGEN_CSR') WriteDoubleWord to non existing peripheral at 0x1180024C, value 0x80000000.
11:32:07.5196 [WARNING] sysbus: [U74_1: 0x8004656C] (tag: 'GPIO') ReadDoubleWord from non existing peripheral at 0x11910358, returning 0x0.
11:32:07.5196 [WARNING] sysbus: [U74_1: 0x80046582] (tag: 'GPIO') WriteDoubleWord to non existing peripheral at 0x11910358, value 0x7.
11:32:07.5197 [WARNING] sysbus: [U74_1: 0x80046586] (tag: 'GPIO') ReadDoubleWord from non existing peripheral at 0x1191007C, returning 0x0.
11:32:07.5197 [WARNING] sysbus: [U74_1: 0x8004659A] (tag: 'GPIO') WriteDoubleWord to non existing peripheral at 0x1191007C, value 0x1.
11:32:07.5197 [WARNING] sysbus: [U74_1: 0x8004659C] (tag: 'GPIO') ReadDoubleWord from non existing peripheral at 0x11910080, returning 0x0.
11:32:07.5198 [WARNING] sysbus: [U74_1: 0x800465AC] (tag: 'GPIO') WriteDoubleWord to non existing peripheral at 0x11910080, value 0x7F.
11:32:07.5198 [WARNING] sysbus: [U74_1: 0x800465B0] (tag: 'GPIO') ReadDoubleWord from non existing peripheral at 0x11910084, returning 0x0.
11:32:07.5198 [WARNING] sysbus: [U74_1: 0x800465BE] (tag: 'GPIO') WriteDoubleWord to non existing peripheral at 0x11910084, value 0x0.
11:32:07.5198 [WARNING] sysbus: [U74_1: 0x800465C2] (tag: 'CLKGEN_CSR') ReadDoubleWord from non existing peripheral at 0x11800250, returning 0x0.
11:32:07.5199 [WARNING] sysbus: [U74_1: 0x800465D2] (tag: 'CLKGEN_CSR') WriteDoubleWord to non existing peripheral at 0x11800250, value 0x80000000.
11:32:07.5199 [WARNING] sysbus: [U74_1: 0x800465D6] (tag: 'CLKGEN_CSR') ReadDoubleWord from non existing peripheral at 0x11800254, returning 0x0.
11:32:07.5199 [WARNING] sysbus: [U74_1: 0x800465EA] (tag: 'CLKGEN_CSR') WriteDoubleWord to non existing peripheral at 0x11800254, value 0x80000000.
11:32:07.5200 [WARNING] sysbus: [U74_1: 0x80046620] (tag: 'GPIO') ReadDoubleWord from non existing peripheral at 0x119100A0, returning 0x0.
11:32:07.5200 [WARNING] sysbus: [U74_1: 0x8004662E] (tag: 'GPIO') WriteDoubleWord to non existing peripheral at 0x119100A0, value 0x80.
11:32:07.5201 [WARNING] sysbus: [U74_1: 0x80046632] (tag: 'GPIO') ReadDoubleWord from non existing peripheral at 0x1191035C, returning 0x0.
11:32:07.5201 [WARNING] sysbus: [U74_1: 0x80046640] (tag: 'GPIO') WriteDoubleWord to non existing peripheral at 0x1191035C, value 0xB.
11:32:07.5201 [WARNING] sysbus: [U74_1: 0x80046644] (tag: 'GPIO') ReadDoubleWord from non existing peripheral at 0x1191009C, returning 0x0.
11:32:07.5202 [WARNING] sysbus: [U74_1: 0x80046652] (tag: 'GPIO') WriteDoubleWord to non existing peripheral at 0x1191009C, value 0x1.
11:32:07.5202 [WARNING] sysbus: [U74_1: 0x80046656] (tag: 'GPIO') ReadDoubleWord from non existing peripheral at 0x119100A4, returning 0x0.
11:32:07.5203 [WARNING] sysbus: [U74_1: 0x80046660] (tag: 'GPIO') WriteDoubleWord to non existing peripheral at 0x119100A4, value 0x0.
11:32:07.5205 [INFO] uart3: [host:  0.77s (+0.13s)|virt: 32.6ms (+31ms)] 
11:32:07.5205 [INFO] uart3: [host:   0.77s (+45µs)|virt:   32.6ms (+0s)] 
11:32:07.5208 [INFO] uart3: [host: 0.77s (+0.31ms)|virt:   32.6ms (+0s)] U-Boot 2021.01-g7dac1a6e-dirty (Apr 26 2021 - 09:57:51 +0000)
11:32:07.5209 [INFO] uart3: [host:   0.77s (+34µs)|virt:   32.6ms (+0s)] 
11:32:07.5219 [INFO] uart3: [host: 0.77s (+0.98ms)|virt: 32.8ms (+0.2ms)] ofnode_read_prop: riscv,isa: rv64imafdc
11:32:07.5220 [INFO] uart3: [host: 0.77s (+0.14ms)|virt:    32.8ms (+0s)] CPU:   rv64imafdc
11:32:07.5224 [INFO] uart3: [host: 0.77s (+0.41ms)|virt: 32.9ms (+0.1ms)] Model: sifive,freedom-u74-arty
11:32:07.5429 [INFO] uart3: [host: 0.79s (+20.45ms)|virt: 39.6ms (+6.7ms)] DRAM:  8 GiB
11:32:07.5429 [WARNING] sysbus: [U74_1: 0x800219A0] (tag: 'SYSCTRL') ReadDoubleWord from non existing peripheral at 0x118581A0, returning 0x0.
11:32:07.5430 [WARNING] sysbus: [U74_1: 0x800219D8] (tag: 'CLKGEN_CSR') ReadDoubleWord from non existing peripheral at 0x118000AC, returning 0x0.
11:32:07.5430 [WARNING] sysbus: [U74_1: 0x800219F2] (tag: 'CLKGEN_CSR') WriteDoubleWord to non existing peripheral at 0x118000AC, value 0x80000000.
11:32:07.5430 [WARNING] sysbus: [U74_1: 0x800219F6] (tag: 'CLKGEN_CSR') ReadDoubleWord from non existing peripheral at 0x118000B0, returning 0x0.
11:32:07.5431 [WARNING] sysbus: [U74_1: 0x80021A08] (tag: 'CLKGEN_CSR') WriteDoubleWord to non existing peripheral at 0x118000B0, value 0x80000000.
11:32:07.5431 [WARNING] sysbus: [U74_1: 0x80021A0C] (tag: 'CLKGEN_CSR') ReadDoubleWord from non existing peripheral at 0x118000B4, returning 0x0.
11:32:07.5431 [WARNING] sysbus: [U74_1: 0x80021A1E] (tag: 'CLKGEN_CSR') WriteDoubleWord to non existing peripheral at 0x118000B4, value 0x80000000.
11:32:07.5431 [WARNING] sysbus: [U74_1: 0x80021A22] (tag: 'CLKGEN_CSR') ReadDoubleWord from non existing peripheral at 0x118000B8, returning 0x0.
11:32:07.5432 [WARNING] sysbus: [U74_1: 0x80021A32] (tag: 'CLKGEN_CSR') WriteDoubleWord to non existing peripheral at 0x118000B8, value 0x80000000.
11:32:07.5433 [WARNING] sysbus: [U74_1: 0x80021A36] (tag: 'CLKGEN_CSR') ReadDoubleWord from non existing peripheral at 0x118000BC, returning 0x0.
11:32:07.5433 [WARNING] sysbus: [U74_1: 0x80021A44] (tag: 'CLKGEN_CSR') WriteDoubleWord to non existing peripheral at 0x118000BC, value 0x80000000.
11:32:07.5435 [WARNING] sysbus: [U74_1: 0x80021AD8] (tag: 'SYSCTRL') ReadDoubleWord from non existing peripheral at 0x11850050, returning 0x0.
11:32:07.5435 [WARNING] sysbus: [U74_1: 0x80021AE8] (tag: 'SYSCTRL') WriteDoubleWord to non existing peripheral at 0x11850050, value 0x1.
11:32:07.5436 [WARNING] sysbus: [U74_1: 0x80021AEA] (tag: 'CLKGEN_CSR') ReadDoubleWord from non existing peripheral at 0x118000C0, returning 0x0.
11:32:07.5436 [WARNING] sysbus: [U74_1: 0x80021B02] (tag: 'CLKGEN_CSR') WriteDoubleWord to non existing peripheral at 0x118000C0, value 0x80000000.
11:32:07.5436 [WARNING] sysbus: [U74_1: 0x80021B06] (tag: 'CLKGEN_CSR') ReadDoubleWord from non existing peripheral at 0x118000DC, returning 0x0.
11:32:07.5437 [WARNING] sysbus: [U74_1: 0x80021B1A] (tag: 'CLKGEN_CSR') WriteDoubleWord to non existing peripheral at 0x118000DC, value 0x80000000.
11:32:07.5437 [WARNING] sysbus: [U74_1: 0x80021B1E] (tag: 'CLKGEN_CSR') ReadDoubleWord from non existing peripheral at 0x118000B0, returning 0x0.
11:32:07.5437 [WARNING] sysbus: [U74_1: 0x80021B2E] (tag: 'CLKGEN_CSR') WriteDoubleWord to non existing peripheral at 0x118000B0, value 0x80000000.
11:32:07.5465 [INFO] uart3: [host:  0.79s (+3.52ms)|virt: 40.3ms (+0.7ms)] ofnode_read_prop: tick-timer: <not found>
11:32:07.5750 [WARNING] sysbus: [U74_1: 0x80021B36] (tag: 'CLKGEN_CSR') ReadDoubleWord from non existing peripheral at 0x118000CC, returning 0x0.
11:32:07.5750 [WARNING] sysbus: [U74_1: 0x80021B4A] (tag: 'CLKGEN_CSR') WriteDoubleWord to non existing peripheral at 0x118000CC, value 0x80000000.
11:32:07.5750 [WARNING] sysbus: [U74_1: 0x80021B4E] (tag: 'CLKGEN_CSR') ReadDoubleWord from non existing peripheral at 0x118000D0, returning 0x0.
11:32:07.5751 [WARNING] sysbus: [U74_1: 0x80021B62] (tag: 'CLKGEN_CSR') WriteDoubleWord to non existing peripheral at 0x118000D0, value 0x80000000.
11:32:07.5751 [WARNING] sysbus: [U74_1: 0x80021B66] (tag: 'CLKGEN_CSR') ReadDoubleWord from non existing peripheral at 0x118000D8, returning 0x0.
11:32:07.5751 [WARNING] sysbus: [U74_1: 0x80021B7C] (tag: 'CLKGEN_CSR') WriteDoubleWord to non existing peripheral at 0x118000D8, value 0x80000000.
11:32:07.6092 [WARNING] sysbus: [U74_1: 0x80021C3A] (tag: 'CLKGEN_CSR') ReadDoubleWord from non existing peripheral at 0x118000C0, returning 0x0.
11:32:07.6093 [WARNING] sysbus: [U74_1: 0x80021C54] (tag: 'CLKGEN_CSR') WriteDoubleWord to non existing peripheral at 0x118000C0, value 0x80000000.
11:32:07.6093 [WARNING] sysbus: [U74_1: 0x80021C58] (tag: 'CLKGEN_CSR') ReadDoubleWord from non existing peripheral at 0x118000C4, returning 0x0.
11:32:07.6094 [WARNING] sysbus: [U74_1: 0x80021C6A] (tag: 'CLKGEN_CSR') WriteDoubleWord to non existing peripheral at 0x118000C4, value 0x80000000.
11:32:07.6094 [WARNING] sysbus: [U74_1: 0x80021C6E] (tag: 'CLKGEN_CSR') ReadDoubleWord from non existing peripheral at 0x118000C8, returning 0x0.
11:32:07.6094 [WARNING] sysbus: [U74_1: 0x80021C80] (tag: 'CLKGEN_CSR') WriteDoubleWord to non existing peripheral at 0x118000C8, value 0x80000000.
11:32:07.6096 [WARNING] sysbus: [U74_1: 0x80021CE0] (tag: 'SYSCTRL') ReadDoubleWord from non existing peripheral at 0x11850040, returning 0x0.
11:32:07.6096 [WARNING] sysbus: [U74_1: 0x80021CF0] (tag: 'SYSCTRL') WriteDoubleWord to non existing peripheral at 0x11850040, value 0x8.
11:32:07.6096 [WARNING] sysbus: [U74_1: 0x80021CF2] (tag: 'CLKGEN_CSR') ReadDoubleWord from non existing peripheral at 0x1180008C, returning 0x0.
11:32:07.6097 [WARNING] sysbus: [U74_1: 0x80021D08] (tag: 'CLKGEN_CSR') WriteDoubleWord to non existing peripheral at 0x1180008C, value 0x80000000.
11:32:07.6097 [WARNING] sysbus: [U74_1: 0x80021D0C] (tag: 'CLKGEN_CSR') ReadDoubleWord from non existing peripheral at 0x11800090, returning 0x0.
11:32:07.6097 [WARNING] sysbus: [U74_1: 0x80021D1E] (tag: 'CLKGEN_CSR') WriteDoubleWord to non existing peripheral at 0x11800090, value 0x80000000.
11:32:07.6097 [WARNING] sysbus: [U74_1: 0x80021D22] (tag: 'CLKGEN_CSR') ReadDoubleWord from non existing peripheral at 0x11800094, returning 0x0.
11:32:07.6098 [WARNING] sysbus: [U74_1: 0x80021D30] (tag: 'CLKGEN_CSR') WriteDoubleWord to non existing peripheral at 0x11800094, value 0x80000000.
11:32:07.6098 [WARNING] sysbus: [U74_1: 0x80021D34] (tag: 'CLKGEN_CSR') ReadDoubleWord from non existing peripheral at 0x1180012C, returning 0x0.
11:32:07.6098 [WARNING] sysbus: [U74_1: 0x80021D42] (tag: 'CLKGEN_CSR') WriteDoubleWord to non existing peripheral at 0x1180012C, value 0x80000000.
11:32:07.6099 [WARNING] sysbus: [U74_1: 0x80021D46] (tag: 'CLKGEN_CSR') ReadDoubleWord from non existing peripheral at 0x11800130, returning 0x0.
11:32:07.6099 [WARNING] sysbus: [U74_1: 0x80021D54] (tag: 'CLKGEN_CSR') WriteDoubleWord to non existing peripheral at 0x11800130, value 0x80000000.
11:32:07.6101 [WARNING] sysbus: [U74_1: 0x80021DD2] (tag: 'CLKGEN_CSR') ReadDoubleWord from non existing peripheral at 0x118000E4, returning 0x0.
11:32:07.6101 [WARNING] sysbus: [U74_1: 0x80021DEE] (tag: 'CLKGEN_CSR') WriteDoubleWord to non existing peripheral at 0x118000E4, value 0x80000000.
11:32:07.6102 [WARNING] sysbus: [U74_1: 0x80021DF2] (tag: 'CLKGEN_CSR') ReadDoubleWord from non existing peripheral at 0x118000E8, returning 0x0.
11:32:07.6102 [WARNING] sysbus: [U74_1: 0x80021E06] (tag: 'CLKGEN_CSR') WriteDoubleWord to non existing peripheral at 0x118000E8, value 0x80000000.
11:32:07.6103 [WARNING] sysbus: [U74_1: 0x80021E0A] (tag: 'CLKGEN_CSR') ReadDoubleWord from non existing peripheral at 0x118000EC, returning 0x0.
11:32:07.6103 [WARNING] sysbus: [U74_1: 0x80021E1E] (tag: 'CLKGEN_CSR') WriteDoubleWord to non existing peripheral at 0x118000EC, value 0x80000000.
11:32:07.6103 [WARNING] sysbus: [U74_1: 0x80021E22] (tag: 'CLKGEN_CSR') ReadDoubleWord from non existing peripheral at 0x118000F0, returning 0x0.
11:32:07.6103 [WARNING] sysbus: [U74_1: 0x80021E32] (tag: 'CLKGEN_CSR') WriteDoubleWord to non existing peripheral at 0x118000F0, value 0x80000000.
11:32:07.6104 [WARNING] sysbus: [U74_1: 0x80021E36] (tag: 'CLKGEN_CSR') ReadDoubleWord from non existing peripheral at 0x118000F4, returning 0x0.
11:32:07.6104 [WARNING] sysbus: [U74_1: 0x80021E46] (tag: 'CLKGEN_CSR') WriteDoubleWord to non existing peripheral at 0x118000F4, value 0x80000000.
11:32:07.6105 [WARNING] sysbus: [U74_1: 0x80021EE6] (tag: 'CLKGEN_CSR') ReadDoubleWord from non existing peripheral at 0x118001E0, returning 0x0.
11:32:07.6106 [WARNING] sysbus: [U74_1: 0x80021EFE] (tag: 'CLKGEN_CSR') WriteDoubleWord to non existing peripheral at 0x118001E0, value 0x80000000.
11:32:07.6106 [WARNING] sysbus: [U74_1: 0x80021F02] (tag: 'CLKGEN_CSR') ReadDoubleWord from non existing peripheral at 0x118001E8, returning 0x0.
11:32:07.6107 [WARNING] sysbus: [U74_1: 0x80021F0E] (tag: 'CLKGEN_CSR') WriteDoubleWord to non existing peripheral at 0x118001E8, value 0x80000000.
11:32:07.6107 [WARNING] sysbus: [U74_1: 0x80021F12] (tag: 'CLKGEN_CSR') ReadDoubleWord from non existing peripheral at 0x118001EC, returning 0x0.
11:32:07.6107 [WARNING] sysbus: [U74_1: 0x80021F22] (tag: 'CLKGEN_CSR') WriteDoubleWord to non existing peripheral at 0x118001EC, value 0x80000000.
11:32:07.6108 [WARNING] sysbus: [U74_1: 0x80021F6C] (tag: 'SYSCTRL') ReadDoubleWord from non existing peripheral at 0x11858164, returning 0x0.
11:32:07.6108 [WARNING] sysbus: [U74_1: 0x80021F7C] (tag: 'SYSCTRL') WriteDoubleWord to non existing peripheral at 0x11858164, value 0xC30080.
11:32:07.6109 [WARNING] sysbus: [U74_1: 0x80021F84] (tag: 'SYSCTRL') ReadDoubleWord from non existing peripheral at 0x11858168, returning 0x0.
11:32:07.6109 [WARNING] sysbus: [U74_1: 0x80021F8A] (tag: 'SYSCTRL') WriteDoubleWord to non existing peripheral at 0x11858168, value 0x30080.
11:32:07.6109 [WARNING] sysbus: [U74_1: 0x80021F8E] (tag: 'SYSCTRL') ReadDoubleWord from non existing peripheral at 0x1185816C, returning 0x0.
11:32:07.6110 [WARNING] sysbus: [U74_1: 0x80021F92] (tag: 'SYSCTRL') WriteDoubleWord to non existing peripheral at 0x1185816C, value 0x30003.
11:32:07.6110 [WARNING] sysbus: [U74_1: 0x80021F96] (tag: 'SYSCTRL') ReadDoubleWord from non existing peripheral at 0x11858170, returning 0x0.
11:32:07.6110 [WARNING] sysbus: [U74_1: 0x80021F9A] (tag: 'SYSCTRL') WriteDoubleWord to non existing peripheral at 0x11858170, value 0x30003.
11:32:07.6111 [WARNING] sysbus: [U74_1: 0x80021F9E] (tag: 'SYSCTRL') ReadDoubleWord from non existing peripheral at 0x11858174, returning 0x0.
11:32:07.6111 [WARNING] sysbus: [U74_1: 0x80021FA2] (tag: 'SYSCTRL') WriteDoubleWord to non existing peripheral at 0x11858174, value 0x30003.
11:32:07.6111 [WARNING] sysbus: [U74_1: 0x80021FA6] (tag: 'SYSCTRL') ReadDoubleWord from non existing peripheral at 0x11858178, returning 0x0.
11:32:07.6112 [WARNING] sysbus: [U74_1: 0x80021FAA] (tag: 'SYSCTRL') WriteDoubleWord to non existing peripheral at 0x11858178, value 0x30003.
11:32:07.6112 [WARNING] sysbus: [U74_1: 0x80021FAE] (tag: 'SYSCTRL') ReadDoubleWord from non existing peripheral at 0x1185817C, returning 0x0.
11:32:07.6112 [WARNING] sysbus: [U74_1: 0x80021FBC] (tag: 'SYSCTRL') WriteDoubleWord to non existing peripheral at 0x1185817C, value 0xC800003.
11:32:07.6113 [WARNING] sysbus: [U74_1: 0x80021FC0] (tag: 'SYSCTRL') ReadDoubleWord from non existing peripheral at 0x11858180, returning 0x0.
11:32:07.6113 [WARNING] sysbus: [U74_1: 0x80021FCC] (tag: 'SYSCTRL') WriteDoubleWord to non existing peripheral at 0x11858180, value 0x8000C0.
11:32:07.6113 [WARNING] sysbus: [U74_1: 0x80021FD4] (tag: 'SYSCTRL') ReadDoubleWord from non existing peripheral at 0x11858184, returning 0x0.
11:32:07.6114 [WARNING] sysbus: [U74_1: 0x80021FD8] (tag: 'SYSCTRL') WriteDoubleWord to non existing peripheral at 0x11858184, value 0xC000C0.
11:32:07.6114 [WARNING] sysbus: [U74_1: 0x80021FDC] (tag: 'SYSCTRL') ReadDoubleWord from non existing peripheral at 0x11858188, returning 0x0.
11:32:07.6114 [WARNING] sysbus: [U74_1: 0x80021FE0] (tag: 'SYSCTRL') WriteDoubleWord to non existing peripheral at 0x11858188, value 0xC000C0.
11:32:07.6130 [WARNING] sysbus: [U74_1: 0x80021FE4] (tag: 'SYSCTRL') ReadDoubleWord from non existing peripheral at 0x1185818C, returning 0x0.
11:32:07.6130 [WARNING] sysbus: [U74_1: 0x80021FE8] (tag: 'SYSCTRL') WriteDoubleWord to non existing peripheral at 0x1185818C, value 0xC000C0.
11:32:07.6131 [WARNING] sysbus: [U74_1: 0x80021FEC] (tag: 'SYSCTRL') ReadDoubleWord from non existing peripheral at 0x11858190, returning 0x0.
11:32:07.6131 [WARNING] sysbus: [U74_1: 0x80021FF0] (tag: 'SYSCTRL') WriteDoubleWord to non existing peripheral at 0x11858190, value 0xC000C0.
11:32:07.6131 [WARNING] sysbus: [U74_1: 0x80021FF4] (tag: 'SYSCTRL') ReadDoubleWord from non existing peripheral at 0x11858194, returning 0x0.
11:32:07.6132 [WARNING] sysbus: [U74_1: 0x80021FF8] (tag: 'SYSCTRL') WriteDoubleWord to non existing peripheral at 0x11858194, value 0xC000C0.
11:32:07.6132 [WARNING] sysbus: [U74_1: 0x80021FFC] (tag: 'SYSCTRL') ReadDoubleWord from non existing peripheral at 0x11858198, returning 0x0.
11:32:07.6132 [WARNING] sysbus: [U74_1: 0x80022004] (tag: 'SYSCTRL') WriteDoubleWord to non existing peripheral at 0x11858198, value 0xC000C0.
11:32:07.6133 [WARNING] sysbus: [U74_1: 0x80022008] (tag: 'GPIO') ReadDoubleWord from non existing peripheral at 0x119101BC, returning 0x0.
11:32:07.6133 [WARNING] sysbus: [U74_1: 0x80022016] (tag: 'GPIO') WriteDoubleWord to non existing peripheral at 0x119101BC, value 0x0.
11:32:07.6133 [WARNING] sysbus: [U74_1: 0x8002201A] (tag: 'GPIO') ReadDoubleWord from non existing peripheral at 0x119101B8, returning 0x0.
11:32:07.6133 [WARNING] sysbus: [U74_1: 0x80022028] (tag: 'GPIO') WriteDoubleWord to non existing peripheral at 0x119101B8, value 0x1.
11:32:07.6257 [WARNING] sysbus: [U74_1: 0x80022030] (tag: 'GPIO') ReadDoubleWord from non existing peripheral at 0x119101B8, returning 0x0.
11:32:07.6257 [WARNING] sysbus: [U74_1: 0x8002203E] (tag: 'GPIO') WriteDoubleWord to non existing peripheral at 0x119101B8, value 0x0.
11:32:07.6387 [WARNING] sysbus: [U74_1: 0x80022046] (tag: 'GPIO') ReadDoubleWord from non existing peripheral at 0x119101B8, returning 0x0.
11:32:07.6388 [WARNING] sysbus: [U74_1: 0x8002205C] (tag: 'GPIO') WriteDoubleWord to non existing peripheral at 0x119101B8, value 0x1.
11:32:07.6388 [WARNING] sysbus: [U74_1: 0x80022060] (tag: 'SYSCTRL') ReadDoubleWord from non existing peripheral at 0x11850070, returning 0x0.
11:32:07.6388 [WARNING] sysbus: [U74_1: 0x8002206E] (tag: 'SYSCTRL') WriteDoubleWord to non existing peripheral at 0x11850070, value 0x1.
11:32:07.6389 [WARNING] sysbus: [U74_1: 0x80022070] (tag: 'CLKGEN_CSR') ReadDoubleWord from non existing peripheral at 0x118001EC, returning 0x0.
11:32:07.6389 [WARNING] sysbus: [U74_1: 0x8002207E] (tag: 'CLKGEN_CSR') WriteDoubleWord to non existing peripheral at 0x118001EC, value 0x4.
11:32:07.6389 [WARNING] sysbus: [U74_1: 0x80022082] (tag: 'SYSCTRL') ReadDoubleWord from non existing peripheral at 0x118500C8, returning 0x0.
11:32:07.6389 [WARNING] sysbus: [U74_1: 0x80022088] (tag: 'SYSCTRL') WriteDoubleWord to non existing peripheral at 0x118500C8, value 0x4.
11:32:07.6390 [WARNING] sysbus: [U74_1: 0x8002208C] (tag: 'CLKGEN_CSR') ReadDoubleWord from non existing peripheral at 0x11800124, returning 0x0.
11:32:07.6390 [WARNING] sysbus: [U74_1: 0x800220A2] (tag: 'CLKGEN_CSR') WriteDoubleWord to non existing peripheral at 0x11800124, value 0x0.
11:32:07.6390 [WARNING] sysbus: [U74_1: 0x800220A6] (tag: 'CLKGEN_CSR') ReadDoubleWord from non existing peripheral at 0x1180011C, returning 0x0.
11:32:07.6391 [WARNING] sysbus: [U74_1: 0x800220B6] (tag: 'CLKGEN_CSR') WriteDoubleWord to non existing peripheral at 0x1180011C, value 0x80000000.
11:32:07.6391 [WARNING] sysbus: [U74_1: 0x800220BA] (tag: 'CLKGEN_CSR') ReadDoubleWord from non existing peripheral at 0x11800128, returning 0x0.
11:32:07.6391 [WARNING] sysbus: [U74_1: 0x800220C6] (tag: 'CLKGEN_CSR') WriteDoubleWord to non existing peripheral at 0x11800128, value 0x80000000.
11:32:07.6392 [WARNING] sysbus: [U74_1: 0x800220CA] (tag: 'CLKGEN_CSR') ReadDoubleWord from non existing peripheral at 0x1180012C, returning 0x0.
11:32:07.6392 [WARNING] sysbus: [U74_1: 0x800220D6] (tag: 'CLKGEN_CSR') WriteDoubleWord to non existing peripheral at 0x1180012C, value 0x80000000.
11:32:07.6393 [WARNING] sysbus: [U74_1: 0x80022164] (tag: 'CLKGEN_CSR') ReadDoubleWord from non existing peripheral at 0x11800098, returning 0x0.
11:32:07.6394 [WARNING] sysbus: [U74_1: 0x8002217E] (tag: 'CLKGEN_CSR') WriteDoubleWord to non existing peripheral at 0x11800098, value 0x80000000.
11:32:07.6394 [WARNING] sysbus: [U74_1: 0x80022182] (tag: 'CLKGEN_CSR') ReadDoubleWord from non existing peripheral at 0x118000A0, returning 0x0.
11:32:07.6394 [WARNING] sysbus: [U74_1: 0x80022198] (tag: 'CLKGEN_CSR') WriteDoubleWord to non existing peripheral at 0x118000A0, value 0x80000000.
11:32:07.6395 [WARNING] sysbus: [U74_1: 0x8002219C] (tag: 'CLKGEN_CSR') ReadDoubleWord from non existing peripheral at 0x11800020, returning 0x0.
11:32:07.6395 [WARNING] sysbus: [U74_1: 0x800221AC] (tag: 'CLKGEN_CSR') WriteDoubleWord to non existing peripheral at 0x11800020, value 0x80000000.
11:32:07.6395 [WARNING] sysbus: [U74_1: 0x800221AE] (tag: 'CLKGEN_CSR') ReadDoubleWord from non existing peripheral at 0x11800184, returning 0x0.
11:32:07.6395 [WARNING] sysbus: [U74_1: 0x800221BC] (tag: 'CLKGEN_CSR') WriteDoubleWord to non existing peripheral at 0x11800184, value 0x80000000.
11:32:07.6396 [WARNING] sysbus: [U74_1: 0x800221C0] (tag: 'CLKGEN_CSR') ReadDoubleWord from non existing peripheral at 0x11800180, returning 0x0.
11:32:07.6396 [WARNING] sysbus: [U74_1: 0x800221CE] (tag: 'CLKGEN_CSR') WriteDoubleWord to non existing peripheral at 0x11800180, value 0x80000000.
11:32:07.6396 [WARNING] sysbus: [U74_1: 0x800221D2] (tag: 'CLKGEN_CSR') ReadDoubleWord from non existing peripheral at 0x11800184, returning 0x0.
11:32:07.6397 [WARNING] sysbus: [U74_1: 0x800221E0] (tag: 'CLKGEN_CSR') WriteDoubleWord to non existing peripheral at 0x11800184, value 0x80000000.
11:32:07.6397 [WARNING] sysbus: [U74_1: 0x800221E4] (tag: 'DOM_AUDIO') ReadDoubleWord from non existing peripheral at 0x1048005C, returning 0x0.
11:32:07.6397 [WARNING] sysbus: [U74_1: 0x800221F0] (tag: 'DOM_AUDIO') WriteDoubleWord to non existing peripheral at 0x1048005C, value 0x80000000.
11:32:07.6425 [WARNING] sysbus: [U74_1: 0x80022220] (tag: 'DOM_AUDIO') ReadDoubleWord from non existing peripheral at 0x10480000, returning 0x0.
11:32:07.6425 [WARNING] sysbus: [U74_1: 0x80022236] (tag: 'DOM_AUDIO') WriteDoubleWord to non existing peripheral at 0x10480000, value 0x80000000.
11:32:07.6425 [WARNING] sysbus: [U74_1: 0x80022238] (tag: 'DOM_AUDIO') ReadDoubleWord from non existing peripheral at 0x10480008, returning 0x0.
11:32:07.6426 [WARNING] sysbus: [U74_1: 0x80022246] (tag: 'DOM_AUDIO') WriteDoubleWord to non existing peripheral at 0x10480008, value 0x80000000.
11:32:07.6427 [WARNING] sysbus: [U74_1: 0x8002226C] (tag: 'DOM_AUDIO') ReadDoubleWord from non existing peripheral at 0x10480018, returning 0x0.
11:32:07.6427 [WARNING] sysbus: [U74_1: 0x80022282] (tag: 'DOM_AUDIO') WriteDoubleWord to non existing peripheral at 0x10480018, value 0x80000000.
11:32:07.6427 [WARNING] sysbus: [U74_1: 0x80022284] (tag: 'DOM_AUDIO') ReadDoubleWord from non existing peripheral at 0x1048001C, returning 0x0.
11:32:07.6427 [WARNING] sysbus: [U74_1: 0x80022292] (tag: 'DOM_AUDIO') WriteDoubleWord to non existing peripheral at 0x1048001C, value 0x80000000.
11:32:07.6428 [WARNING] sysbus: [U74_1: 0x800222A6] (tag: 'DOM_AUDIO') ReadDoubleWord from non existing peripheral at 0x10480020, returning 0x0.
11:32:07.6428 [WARNING] sysbus: [U74_1: 0x800222B2] (tag: 'DOM_AUDIO') WriteDoubleWord to non existing peripheral at 0x10480020, value 0x80000000.
11:32:07.6429 [WARNING] sysbus: [U74_1: 0x800222DC] (tag: 'DOM_AUDIO') ReadDoubleWord from non existing peripheral at 0x10480024, returning 0x0.
11:32:07.6429 [WARNING] sysbus: [U74_1: 0x800222F2] (tag: 'DOM_AUDIO') WriteDoubleWord to non existing peripheral at 0x10480024, value 0x80000000.
11:32:07.6430 [WARNING] sysbus: [U74_1: 0x800222F4] (tag: 'DOM_AUDIO') ReadDoubleWord from non existing peripheral at 0x10480028, returning 0x0.
11:32:07.6430 [WARNING] sysbus: [U74_1: 0x80022302] (tag: 'DOM_AUDIO') WriteDoubleWord to non existing peripheral at 0x10480028, value 0x80000000.
11:32:07.6431 [WARNING] sysbus: [U74_1: 0x8002231A] (tag: 'DOM_AUDIO') ReadDoubleWord from non existing peripheral at 0x1048002C, returning 0x0.
11:32:07.6431 [WARNING] sysbus: [U74_1: 0x80022326] (tag: 'DOM_AUDIO') WriteDoubleWord to non existing peripheral at 0x1048002C, value 0x80000000.
11:32:07.6431 [WARNING] sysbus: [U74_1: 0x8002233E] (tag: 'DOM_AUDIO') ReadDoubleWord from non existing peripheral at 0x10480030, returning 0x0.
11:32:07.6432 [WARNING] sysbus: [U74_1: 0x80022354] (tag: 'DOM_AUDIO') WriteDoubleWord to non existing peripheral at 0x10480030, value 0x80000000.
11:32:07.6432 [WARNING] sysbus: [U74_1: 0x80022356] (tag: 'DOM_AUDIO') ReadDoubleWord from non existing peripheral at 0x10480034, returning 0x0.
11:32:07.6432 [WARNING] sysbus: [U74_1: 0x80022364] (tag: 'DOM_AUDIO') WriteDoubleWord to non existing peripheral at 0x10480034, value 0x80000000.
11:32:07.6433 [WARNING] sysbus: [U74_1: 0x80022392] (tag: 'DOM_AUDIO') ReadDoubleWord from non existing peripheral at 0x10480004, returning 0x0.
11:32:07.6434 [WARNING] sysbus: [U74_1: 0x800223A8] (tag: 'DOM_AUDIO') WriteDoubleWord to non existing peripheral at 0x10480004, value 0x80000000.
11:32:07.6434 [WARNING] sysbus: [U74_1: 0x800223AA] (tag: 'DOM_AUDIO') ReadDoubleWord from non existing peripheral at 0x10480044, returning 0x0.
11:32:07.6434 [WARNING] sysbus: [U74_1: 0x800223B8] (tag: 'DOM_AUDIO') WriteDoubleWord to non existing peripheral at 0x10480044, value 0x80000000.
11:32:07.6435 [WARNING] sysbus: [U74_1: 0x800223F0] (tag: 'DOM_AUDIO') ReadDoubleWord from non existing peripheral at 0x10480054, returning 0x0.
11:32:07.6436 [WARNING] sysbus: [U74_1: 0x800223F8] (tag: 'DOM_AUDIO') WriteDoubleWord to non existing peripheral at 0x10480054, value 0x80000000.
11:32:07.6436 [WARNING] sysbus: [U74_1: 0x80022436] (tag: 'CLKGEN_CSR') ReadDoubleWord from non existing peripheral at 0x11800164, returning 0x0.
11:32:07.6437 [WARNING] sysbus: [U74_1: 0x80022450] (tag: 'CLKGEN_CSR') WriteDoubleWord to non existing peripheral at 0x11800164, value 0x80000000.
11:32:07.6437 [WARNING] sysbus: [U74_1: 0x80022454] (tag: 'CLKGEN_CSR') ReadDoubleWord from non existing peripheral at 0x11800170, returning 0x0.
11:32:07.6437 [WARNING] sysbus: [U74_1: 0x8002246A] (tag: 'CLKGEN_CSR') WriteDoubleWord to non existing peripheral at 0x11800170, value 0x80000000.
11:32:07.6438 [WARNING] sysbus: [U74_1: 0x8002246E] (tag: 'DOM_AUDIO') ReadDoubleWord from non existing peripheral at 0x10480064, returning 0x0.
11:32:07.6438 [WARNING] sysbus: [U74_1: 0x8002247E] (tag: 'DOM_AUDIO') WriteDoubleWord to non existing peripheral at 0x10480064, value 0x80000000.
11:32:07.6438 [WARNING] sysbus: [U74_1: 0x80022480] (tag: 'DOM_AUDIO') ReadDoubleWord from non existing peripheral at 0x10480068, returning 0x0.
11:32:07.6439 [WARNING] sysbus: [U74_1: 0x8002248C] (tag: 'DOM_AUDIO') WriteDoubleWord to non existing peripheral at 0x10480068, value 0x80000000.
11:32:07.6439 [WARNING] sysbus: [U74_1: 0x8002248E] (tag: 'DOM_AUDIO') ReadDoubleWord from non existing peripheral at 0x10480060, returning 0x0.
11:32:07.6439 [WARNING] sysbus: [U74_1: 0x8002249A] (tag: 'DOM_AUDIO') WriteDoubleWord to non existing peripheral at 0x10480060, value 0x80000000.
11:32:07.6441 [WARNING] sysbus: [U74_1: 0x8002252C] (tag: 'GPIO') ReadDoubleWord from non existing peripheral at 0x11910378, returning 0x0.
11:32:07.6442 [WARNING] sysbus: [U74_1: 0x8002253E] (tag: 'GPIO') WriteDoubleWord to non existing peripheral at 0x11910378, value 0x1.
11:32:07.6442 [WARNING] sysbus: [U74_1: 0x80022542] (tag: 'DOM_AUDIO') ReadDoubleWord from non existing peripheral at 0x104A0020, returning 0x0.
11:32:07.6443 [WARNING] sysbus: [U74_1: 0x80022552] (tag: 'DOM_AUDIO') WriteDoubleWord to non existing peripheral at 0x104A0020, value 0x2.
11:32:07.6443 [WARNING] sysbus: [U74_1: 0x80022554] (tag: 'DOM_AUDIO') ReadDoubleWord from non existing peripheral at 0x104A003C, returning 0x0.
11:32:07.6443 [WARNING] sysbus: [U74_1: 0x80022560] (tag: 'DOM_AUDIO') WriteDoubleWord to non existing peripheral at 0x104A003C, value 0x800000.
11:32:07.6444 [WARNING] sysbus: [U74_1: 0x80022562] (tag: 'DOM_AUDIO') ReadDoubleWord from non existing peripheral at 0x104A003C, returning 0x0.
11:32:07.6444 [WARNING] sysbus: [U74_1: 0x80022574] (tag: 'DOM_AUDIO') WriteDoubleWord to non existing peripheral at 0x104A003C, value 0x2000000.
11:32:07.6444 [WARNING] sysbus: [U74_1: 0x80022576] (tag: 'DOM_AUDIO') ReadDoubleWord from non existing peripheral at 0x104A003C, returning 0x0.
11:32:07.6445 [WARNING] sysbus: [U74_1: 0x80022586] (tag: 'DOM_AUDIO') WriteDoubleWord to non existing peripheral at 0x104A003C, value 0x40000.
11:32:07.6445 [WARNING] sysbus: [U74_1: 0x80022588] (tag: 'DOM_AUDIO') ReadDoubleWord from non existing peripheral at 0x104A003C, returning 0x0.
11:32:07.6445 [WARNING] sysbus: [U74_1: 0x8002259A] (tag: 'DOM_AUDIO') WriteDoubleWord to non existing peripheral at 0x104A003C, value 0x80000.
11:32:07.6446 [WARNING] sysbus: [U74_1: 0x8002259C] (tag: 'DOM_AUDIO') ReadDoubleWord from non existing peripheral at 0x104A002C, returning 0x0.
11:32:07.6446 [WARNING] sysbus: [U74_1: 0x800225AE] (tag: 'DOM_AUDIO') WriteDoubleWord to non existing peripheral at 0x104A002C, value 0x200000.
11:32:07.6446 [WARNING] sysbus: [U74_1: 0x800225B4] (tag: 'CLKGEN_CSR') ReadDoubleWord from non existing peripheral at 0x11800154, returning 0x0.
11:32:07.6447 [WARNING] sysbus: [U74_1: 0x800225C2] (tag: 'CLKGEN_CSR') WriteDoubleWord to non existing peripheral at 0x11800154, value 0x80000000.
11:32:07.6448 [WARNING] sysbus: [U74_1: 0x800225E0] (tag: 'CLKGEN_CSR') ReadDoubleWord from non existing peripheral at 0x11800080, returning 0x0.
11:32:07.6448 [WARNING] sysbus: [U74_1: 0x800225FA] (tag: 'CLKGEN_CSR') WriteDoubleWord to non existing peripheral at 0x11800080, value 0x80000000.
11:32:07.6448 [WARNING] sysbus: [U74_1: 0x800225FE] (tag: 'CLKGEN_CSR') ReadDoubleWord from non existing peripheral at 0x1180007C, returning 0x0.
11:32:07.6449 [WARNING] sysbus: [U74_1: 0x8002260E] (tag: 'CLKGEN_CSR') WriteDoubleWord to non existing peripheral at 0x1180007C, value 0x80000000.
11:32:07.6449 [WARNING] sysbus: [U74_1: 0x80022610] (tag: 'CLKGEN_CSR') ReadDoubleWord from non existing peripheral at 0x11800084, returning 0x0.
11:32:07.6449 [WARNING] sysbus: [U74_1: 0x8002261E] (tag: 'CLKGEN_CSR') WriteDoubleWord to non existing peripheral at 0x11800084, value 0x80000000.
11:32:07.6450 [WARNING] sysbus: [U74_1: 0x80022660] (tag: 'CLKGEN_CSR') ReadDoubleWord from non existing peripheral at 0x118001C8, returning 0x0.
11:32:07.6451 [WARNING] sysbus: [U74_1: 0x80022678] (tag: 'CLKGEN_CSR') WriteDoubleWord to non existing peripheral at 0x118001C8, value 0x80000000.
11:32:07.6451 [WARNING] sysbus: [U74_1: 0x8002267C] (tag: 'CLKGEN_CSR') ReadDoubleWord from non existing peripheral at 0x118001CC, returning 0x0.
11:32:07.6451 [WARNING] sysbus: [U74_1: 0x8002268C] (tag: 'CLKGEN_CSR') WriteDoubleWord to non existing peripheral at 0x118001CC, value 0x80000000.
11:32:07.6452 [WARNING] sysbus: [U74_1: 0x800226B0] (tag: 'GPIO') ReadDoubleWord from non existing peripheral at 0x119102B4, returning 0x0.
11:32:07.6453 [WARNING] sysbus: [U74_1: 0x800226C6] (tag: 'GPIO') WriteDoubleWord to non existing peripheral at 0x119102B4, value 0x39.
11:32:07.6453 [WARNING] sysbus: [U74_1: 0x800226CA] (tag: 'GPIO') ReadDoubleWord from non existing peripheral at 0x1191020C, returning 0x0.
11:32:07.6453 [WARNING] sysbus: [U74_1: 0x800226E0] (tag: 'GPIO') WriteDoubleWord to non existing peripheral at 0x1191020C, value 0x1.
11:32:07.6454 [WARNING] sysbus: [U74_1: 0x800226E4] (tag: 'GPIO') ReadDoubleWord from non existing peripheral at 0x11910200, returning 0x0.
11:32:07.6454 [WARNING] sysbus: [U74_1: 0x800226FA] (tag: 'GPIO') WriteDoubleWord to non existing peripheral at 0x11910200, value 0x36.
11:32:07.6454 [WARNING] sysbus: [U74_1: 0x800226FE] (tag: 'GPIO') ReadDoubleWord from non existing peripheral at 0x11910204, returning 0x0.
11:32:07.6455 [WARNING] sysbus: [U74_1: 0x8002270C] (tag: 'GPIO') WriteDoubleWord to non existing peripheral at 0x11910204, value 0x0.
11:32:07.6455 [WARNING] sysbus: [U74_1: 0x80022710] (tag: 'GPIO') ReadDoubleWord from non existing peripheral at 0x119101FC, returning 0x0.
11:32:07.6455 [WARNING] sysbus: [U74_1: 0x80022722] (tag: 'GPIO') WriteDoubleWord to non existing peripheral at 0x119101FC, value 0x80000000.
11:32:07.6456 [WARNING] sysbus: [U74_1: 0x80022726] (tag: 'GPIO') ReadDoubleWord from non existing peripheral at 0x119101FC, returning 0x0.
11:32:07.6456 [WARNING] sysbus: [U74_1: 0x80022738] (tag: 'GPIO') WriteDoubleWord to non existing peripheral at 0x119101FC, value 0x37.
11:32:07.6456 [WARNING] sysbus: [U74_1: 0x8002273C] (tag: 'GPIO') ReadDoubleWord from non existing peripheral at 0x119101F8, returning 0x0.
11:32:07.6457 [WARNING] sysbus: [U74_1: 0x8002274A] (tag: 'GPIO') WriteDoubleWord to non existing peripheral at 0x119101F8, value 0x38.
11:32:07.6457 [WARNING] sysbus: [U74_1: 0x8002274E] (tag: 'GPIO') ReadDoubleWord from non existing peripheral at 0x119102BC, returning 0x0.
11:32:07.6457 [WARNING] sysbus: [U74_1: 0x8002275C] (tag: 'GPIO') WriteDoubleWord to non existing peripheral at 0x119102BC, value 0x37.
11:32:07.6457 [WARNING] sysbus: [U74_1: 0x80022760] (tag: 'SYSCTRL') ReadDoubleWord from non existing peripheral at 0x118580E8, returning 0x0.
11:32:07.6458 [WARNING] sysbus: [U74_1: 0x80022764] (tag: 'SYSCTRL') WriteDoubleWord to non existing peripheral at 0x118580E8, value 0xC000C0.
11:32:07.6458 [WARNING] sysbus: [U74_1: 0x80022768] (tag: 'GPIO') ReadDoubleWord from non existing peripheral at 0x119101DC, returning 0x0.
11:32:07.6458 [WARNING] sysbus: [U74_1: 0x80022776] (tag: 'GPIO') WriteDoubleWord to non existing peripheral at 0x119101DC, value 0x80000000.
11:32:07.6459 [WARNING] sysbus: [U74_1: 0x8002277A] (tag: 'GPIO') ReadDoubleWord from non existing peripheral at 0x119101E4, returning 0x0.
11:32:07.6459 [WARNING] sysbus: [U74_1: 0x80022788] (tag: 'GPIO') WriteDoubleWord to non existing peripheral at 0x119101E4, value 0x80000000.
11:32:07.6459 [WARNING] sysbus: [U74_1: 0x8002278C] (tag: 'GPIO') ReadDoubleWord from non existing peripheral at 0x119101EC, returning 0x0.
11:32:07.6460 [WARNING] sysbus: [U74_1: 0x8002279A] (tag: 'GPIO') WriteDoubleWord to non existing peripheral at 0x119101EC, value 0x80000000.
11:32:07.6460 [WARNING] sysbus: [U74_1: 0x8002279E] (tag: 'GPIO') ReadDoubleWord from non existing peripheral at 0x119101F4, returning 0x0.
11:32:07.6460 [WARNING] sysbus: [U74_1: 0x800227AC] (tag: 'GPIO') WriteDoubleWord to non existing peripheral at 0x119101F4, value 0x80000000.
11:32:07.6461 [WARNING] sysbus: [U74_1: 0x800227B0] (tag: 'GPIO') ReadDoubleWord from non existing peripheral at 0x119101DC, returning 0x0.
11:32:07.6461 [WARNING] sysbus: [U74_1: 0x800227BE] (tag: 'GPIO') WriteDoubleWord to non existing peripheral at 0x119101DC, value 0x39.
11:32:07.6461 [WARNING] sysbus: [U74_1: 0x800227C2] (tag: 'GPIO') ReadDoubleWord from non existing peripheral at 0x119101D8, returning 0x0.
11:32:07.6462 [WARNING] sysbus: [U74_1: 0x800227D0] (tag: 'GPIO') WriteDoubleWord to non existing peripheral at 0x119101D8, value 0x41.
11:32:07.6462 [WARNING] sysbus: [U74_1: 0x800227D4] (tag: 'GPIO') ReadDoubleWord from non existing peripheral at 0x119102C0, returning 0x0.
11:32:07.6463 [WARNING] sysbus: [U74_1: 0x800227E2] (tag: 'GPIO') WriteDoubleWord to non existing peripheral at 0x119102C0, value 0x33.
11:32:07.6463 [WARNING] sysbus: [U74_1: 0x800227E6] (tag: 'SYSCTRL') ReadDoubleWord from non existing peripheral at 0x118580E0, returning 0x0.
11:32:07.6463 [WARNING] sysbus: [U74_1: 0x800227EA] (tag: 'SYSCTRL') WriteDoubleWord to non existing peripheral at 0x118580E0, value 0xC000C0.
11:32:07.6464 [WARNING] sysbus: [U74_1: 0x800227EE] (tag: 'GPIO') ReadDoubleWord from non existing peripheral at 0x119101E4, returning 0x0.
11:32:07.6464 [WARNING] sysbus: [U74_1: 0x800227FC] (tag: 'GPIO') WriteDoubleWord to non existing peripheral at 0x119101E4, value 0x3A.
11:32:07.6464 [WARNING] sysbus: [U74_1: 0x80022800] (tag: 'GPIO') ReadDoubleWord from non existing peripheral at 0x119101E0, returning 0x0.
11:32:07.6465 [WARNING] sysbus: [U74_1: 0x8002280E] (tag: 'GPIO') WriteDoubleWord to non existing peripheral at 0x119101E0, value 0x42.
11:32:07.6465 [WARNING] sysbus: [U74_1: 0x80022812] (tag: 'GPIO') ReadDoubleWord from non existing peripheral at 0x119102C4, returning 0x0.
11:32:07.6465 [WARNING] sysbus: [U74_1: 0x80022820] (tag: 'GPIO') WriteDoubleWord to non existing peripheral at 0x119102C4, value 0x34.
11:32:07.6465 [WARNING] sysbus: [U74_1: 0x80022824] (tag: 'GPIO') ReadDoubleWord from non existing peripheral at 0x119101EC, returning 0x0.
11:32:07.6466 [WARNING] sysbus: [U74_1: 0x80022832] (tag: 'GPIO') WriteDoubleWord to non existing peripheral at 0x119101EC, value 0x3B.
11:32:07.6466 [WARNING] sysbus: [U74_1: 0x80022836] (tag: 'GPIO') ReadDoubleWord from non existing peripheral at 0x119101E8, returning 0x0.
11:32:07.6466 [WARNING] sysbus: [U74_1: 0x80022844] (tag: 'GPIO') WriteDoubleWord to non existing peripheral at 0x119101E8, value 0x43.
11:32:07.6467 [WARNING] sysbus: [U74_1: 0x80022848] (tag: 'GPIO') ReadDoubleWord from non existing peripheral at 0x119102C8, returning 0x0.
11:32:07.6467 [WARNING] sysbus: [U74_1: 0x80022856] (tag: 'GPIO') WriteDoubleWord to non existing peripheral at 0x119102C8, value 0x35.
11:32:07.6467 [WARNING] sysbus: [U74_1: 0x8002285A] (tag: 'SYSCTRL') ReadDoubleWord from non existing peripheral at 0x118580E4, returning 0x0.
11:32:07.6467 [WARNING] sysbus: [U74_1: 0x8002285E] (tag: 'SYSCTRL') WriteDoubleWord to non existing peripheral at 0x118580E4, value 0xC000C0.
11:32:07.6468 [WARNING] sysbus: [U74_1: 0x80022862] (tag: 'GPIO') ReadDoubleWord from non existing peripheral at 0x119101F4, returning 0x0.
11:32:07.6468 [WARNING] sysbus: [U74_1: 0x80022870] (tag: 'GPIO') WriteDoubleWord to non existing peripheral at 0x119101F4, value 0x3C.
11:32:07.6468 [WARNING] sysbus: [U74_1: 0x80022874] (tag: 'GPIO') ReadDoubleWord from non existing peripheral at 0x119101F0, returning 0x0.
11:32:07.6469 [WARNING] sysbus: [U74_1: 0x80022882] (tag: 'GPIO') WriteDoubleWord to non existing peripheral at 0x119101F0, value 0x44.
11:32:07.6469 [WARNING] sysbus: [U74_1: 0x80022886] (tag: 'GPIO') ReadDoubleWord from non existing peripheral at 0x119102CC, returning 0x0.
11:32:07.6469 [WARNING] sysbus: [U74_1: 0x80022894] (tag: 'GPIO') WriteDoubleWord to non existing peripheral at 0x119102CC, value 0x36.
11:32:07.6470 [WARNING] sysbus: [U74_1: 0x80022898] (tag: 'SYSCTRL') ReadDoubleWord from non existing peripheral at 0x118580E8, returning 0x0.
11:32:07.6470 [WARNING] sysbus: [U74_1: 0x8002289C] (tag: 'SYSCTRL') WriteDoubleWord to non existing peripheral at 0x118580E8, value 0xC000C0.
11:32:07.6470 [WARNING] sysbus: [U74_1: 0x800228A0] (tag: 'CLKGEN_CSR') ReadDoubleWord from non existing peripheral at 0x118001D4, returning 0x0.
11:32:07.6470 [WARNING] sysbus: [U74_1: 0x800228AE] (tag: 'CLKGEN_CSR') WriteDoubleWord to non existing peripheral at 0x118001D4, value 0x80000000.
11:32:07.6471 [WARNING] sysbus: [U74_1: 0x800228B2] (tag: 'CLKGEN_CSR') ReadDoubleWord from non existing peripheral at 0x118001D8, returning 0x0.
11:32:07.6471 [WARNING] sysbus: [U74_1: 0x800228C0] (tag: 'CLKGEN_CSR') WriteDoubleWord to non existing peripheral at 0x118001D8, value 0x80000000.
11:32:07.6472 [WARNING] sysbus: [U74_1: 0x800228E0] (tag: 'GPIO') ReadDoubleWord from non existing peripheral at 0x11910158, returning 0x0.
11:32:07.6472 [WARNING] sysbus: [U74_1: 0x800228F6] (tag: 'GPIO') WriteDoubleWord to non existing peripheral at 0x11910158, value 0x4B.
11:32:07.6472 [WARNING] sysbus: [U74_1: 0x800228FA] (tag: 'GPIO') ReadDoubleWord from non existing peripheral at 0x1191015C, returning 0x0.
11:32:07.6473 [WARNING] sysbus: [U74_1: 0x8002290C] (tag: 'GPIO') WriteDoubleWord to non existing peripheral at 0x1191015C, value 0x0.
11:32:07.6473 [WARNING] sysbus: [U74_1: 0x80022910] (tag: 'GPIO') ReadDoubleWord from non existing peripheral at 0x1191013C, returning 0x0.
11:32:07.6473 [WARNING] sysbus: [U74_1: 0x80022922] (tag: 'GPIO') WriteDoubleWord to non existing peripheral at 0x1191013C, value 0x80000000.
11:32:07.6474 [WARNING] sysbus: [U74_1: 0x80022926] (tag: 'GPIO') ReadDoubleWord from non existing peripheral at 0x1191013C, returning 0x0.
11:32:07.6474 [WARNING] sysbus: [U74_1: 0x80022938] (tag: 'GPIO') WriteDoubleWord to non existing peripheral at 0x1191013C, value 0x4C.
11:32:07.6474 [WARNING] sysbus: [U74_1: 0x8002293C] (tag: 'GPIO') ReadDoubleWord from non existing peripheral at 0x11910138, returning 0x0.
11:32:07.6475 [WARNING] sysbus: [U74_1: 0x8002294A] (tag: 'GPIO') WriteDoubleWord to non existing peripheral at 0x11910138, value 0x4D.
11:32:07.6475 [WARNING] sysbus: [U74_1: 0x8002294E] (tag: 'GPIO') ReadDoubleWord from non existing peripheral at 0x119102E8, returning 0x0.
11:32:07.6475 [WARNING] sysbus: [U74_1: 0x8002295C] (tag: 'GPIO') WriteDoubleWord to non existing peripheral at 0x119102E8, value 0x1F.
11:32:07.6475 [WARNING] sysbus: [U74_1: 0x80022960] (tag: 'GPIO') ReadDoubleWord from non existing peripheral at 0x11910174, returning 0x0.
11:32:07.6476 [WARNING] sysbus: [U74_1: 0x8002296E] (tag: 'GPIO') WriteDoubleWord to non existing peripheral at 0x11910174, value 0x80000000.
11:32:07.6476 [WARNING] sysbus: [U74_1: 0x80022972] (tag: 'GPIO') ReadDoubleWord from non existing peripheral at 0x11910144, returning 0x0.
11:32:07.6476 [WARNING] sysbus: [U74_1: 0x80022980] (tag: 'GPIO') WriteDoubleWord to non existing peripheral at 0x11910144, value 0x80000000.
11:32:07.6477 [WARNING] sysbus: [U74_1: 0x80022984] (tag: 'GPIO') ReadDoubleWord from non existing peripheral at 0x11910164, returning 0x0.
11:32:07.6477 [WARNING] sysbus: [U74_1: 0x80022992] (tag: 'GPIO') WriteDoubleWord to non existing peripheral at 0x11910164, value 0x80000000.
11:32:07.6477 [WARNING] sysbus: [U74_1: 0x80022996] (tag: 'GPIO') ReadDoubleWord from non existing peripheral at 0x1191014C, returning 0x0.
11:32:07.6477 [WARNING] sysbus: [U74_1: 0x800229A4] (tag: 'GPIO') WriteDoubleWord to non existing peripheral at 0x1191014C, value 0x80000000.
11:32:07.6478 [WARNING] sysbus: [U74_1: 0x800229A8] (tag: 'GPIO') ReadDoubleWord from non existing peripheral at 0x11910174, returning 0x0.
11:32:07.6487 [WARNING] sysbus: [U74_1: 0x800229B6] (tag: 'GPIO') WriteDoubleWord to non existing peripheral at 0x11910174, value 0x4E.
11:32:07.6488 [WARNING] sysbus: [U74_1: 0x800229BA] (tag: 'GPIO') ReadDoubleWord from non existing peripheral at 0x11910170, returning 0x0.
11:32:07.6488 [WARNING] sysbus: [U74_1: 0x800229C8] (tag: 'GPIO') WriteDoubleWord to non existing peripheral at 0x11910170, value 0x56.
11:32:07.6488 [WARNING] sysbus: [U74_1: 0x800229CC] (tag: 'GPIO') ReadDoubleWord from non existing peripheral at 0x119102EC, returning 0x0.
11:32:07.6489 [WARNING] sysbus: [U74_1: 0x800229DA] (tag: 'GPIO') WriteDoubleWord to non existing peripheral at 0x119102EC, value 0x26.
11:32:07.6489 [WARNING] sysbus: [U74_1: 0x800229DE] (tag: 'GPIO') ReadDoubleWord from non existing peripheral at 0x11910144, returning 0x0.
11:32:07.6489 [WARNING] sysbus: [U74_1: 0x800229EC] (tag: 'GPIO') WriteDoubleWord to non existing peripheral at 0x11910144, value 0x4F.
11:32:07.6489 [WARNING] sysbus: [U74_1: 0x800229F0] (tag: 'GPIO') ReadDoubleWord from non existing peripheral at 0x11910140, returning 0x0.
11:32:07.6490 [WARNING] sysbus: [U74_1: 0x800229FE] (tag: 'GPIO') WriteDoubleWord to non existing peripheral at 0x11910140, value 0x57.
11:32:07.6490 [WARNING] sysbus: [U74_1: 0x80022A02] (tag: 'GPIO') ReadDoubleWord from non existing peripheral at 0x119102F0, returning 0x0.
11:32:07.6490 [WARNING] sysbus: [U74_1: 0x80022A10] (tag: 'GPIO') WriteDoubleWord to non existing peripheral at 0x119102F0, value 0x20.
11:32:07.6491 [WARNING] sysbus: [U74_1: 0x80022A14] (tag: 'GPIO') ReadDoubleWord from non existing peripheral at 0x11910164, returning 0x0.
11:32:07.6491 [WARNING] sysbus: [U74_1: 0x80022A22] (tag: 'GPIO') WriteDoubleWord to non existing peripheral at 0x11910164, value 0x50.
11:32:07.6491 [WARNING] sysbus: [U74_1: 0x80022A26] (tag: 'GPIO') ReadDoubleWord from non existing peripheral at 0x11910160, returning 0x0.
11:32:07.6491 [WARNING] sysbus: [U74_1: 0x80022A34] (tag: 'GPIO') WriteDoubleWord to non existing peripheral at 0x11910160, value 0x58.
11:32:07.6492 [WARNING] sysbus: [U74_1: 0x80022A38] (tag: 'GPIO') ReadDoubleWord from non existing peripheral at 0x119102F4, returning 0x0.
11:32:07.6492 [WARNING] sysbus: [U74_1: 0x80022A46] (tag: 'GPIO') WriteDoubleWord to non existing peripheral at 0x119102F4, value 0x24.
11:32:07.6492 [WARNING] sysbus: [U74_1: 0x80022A4A] (tag: 'GPIO') ReadDoubleWord from non existing peripheral at 0x1191014C, returning 0x0.
11:32:07.6493 [WARNING] sysbus: [U74_1: 0x80022A58] (tag: 'GPIO') WriteDoubleWord to non existing peripheral at 0x1191014C, value 0x51.
11:32:07.6493 [WARNING] sysbus: [U74_1: 0x80022A5C] (tag: 'GPIO') ReadDoubleWord from non existing peripheral at 0x11910148, returning 0x0.
11:32:07.6493 [WARNING] sysbus: [U74_1: 0x80022A6A] (tag: 'GPIO') WriteDoubleWord to non existing peripheral at 0x11910148, value 0x59.
11:32:07.6493 [WARNING] sysbus: [U74_1: 0x80022A6E] (tag: 'GPIO') ReadDoubleWord from non existing peripheral at 0x119102F8, returning 0x0.
11:32:07.6494 [WARNING] sysbus: [U74_1: 0x80022A7C] (tag: 'GPIO') WriteDoubleWord to non existing peripheral at 0x119102F8, value 0x21.
11:32:07.6494 [WARNING] sysbus: [U74_1: 0x80022A80] (tag: 'CLKGEN_CSR') ReadDoubleWord from non existing peripheral at 0x11800210, returning 0x0.
11:32:07.6494 [WARNING] sysbus: [U74_1: 0x80022A8E] (tag: 'CLKGEN_CSR') WriteDoubleWord to non existing peripheral at 0x11800210, value 0x80000000.
11:32:07.6495 [WARNING] sysbus: [U74_1: 0x80022A92] (tag: 'CLKGEN_CSR') ReadDoubleWord from non existing peripheral at 0x11800214, returning 0x0.
11:32:07.6495 [WARNING] sysbus: [U74_1: 0x80022AA0] (tag: 'CLKGEN_CSR') WriteDoubleWord to non existing peripheral at 0x11800214, value 0x80000000.
11:32:07.6496 [WARNING] sysbus: [U74_1: 0x80022AE0] (tag: 'CLKGEN_CSR') ReadDoubleWord from non existing peripheral at 0x11800218, returning 0x0.
11:32:07.6496 [WARNING] sysbus: [U74_1: 0x80022AF6] (tag: 'CLKGEN_CSR') WriteDoubleWord to non existing peripheral at 0x11800218, value 0x80000000.
11:32:07.6497 [WARNING] sysbus: [U74_1: 0x80022B16] (tag: 'CLKGEN_CSR') ReadDoubleWord from non existing peripheral at 0x11800230, returning 0x0.
11:32:07.6497 [WARNING] sysbus: [U74_1: 0x80022B30] (tag: 'CLKGEN_CSR') WriteDoubleWord to non existing peripheral at 0x11800230, value 0x80000000.
11:32:07.6497 [WARNING] sysbus: [U74_1: 0x80022B34] (tag: 'CLKGEN_CSR') ReadDoubleWord from non existing peripheral at 0x11800234, returning 0x0.
11:32:07.6497 [WARNING] sysbus: [U74_1: 0x80022B46] (tag: 'CLKGEN_CSR') WriteDoubleWord to non existing peripheral at 0x11800234, value 0x80000000.
11:32:07.6498 [WARNING] sysbus: [U74_1: 0x80022B4A] (tag: 'CLKGEN_CSR') ReadDoubleWord from non existing peripheral at 0x11800238, returning 0x0.
11:32:07.6498 [WARNING] sysbus: [U74_1: 0x80022B58] (tag: 'CLKGEN_CSR') WriteDoubleWord to non existing peripheral at 0x11800238, value 0x80000000.
11:32:07.6498 [WARNING] sysbus: [U74_1: 0x80022B5C] (tag: 'CLKGEN_CSR') ReadDoubleWord from non existing peripheral at 0x1180023C, returning 0x0.
11:32:07.6499 [WARNING] sysbus: [U74_1: 0x80022B6A] (tag: 'CLKGEN_CSR') WriteDoubleWord to non existing peripheral at 0x1180023C, value 0x80000000.
11:32:07.6500 [WARNING] sysbus: [U74_1: 0x80022BC2] (tag: 'CLKGEN_CSR') ReadDoubleWord from non existing peripheral at 0x11800248, returning 0x0.
11:32:07.6500 [WARNING] sysbus: [U74_1: 0x80022BDA] (tag: 'CLKGEN_CSR') WriteDoubleWord to non existing peripheral at 0x11800248, value 0x80000000.
11:32:07.6500 [WARNING] sysbus: [U74_1: 0x80022BDE] (tag: 'CLKGEN_CSR') ReadDoubleWord from non existing peripheral at 0x1180024C, returning 0x0.
11:32:07.6501 [WARNING] sysbus: [U74_1: 0x80022BEE] (tag: 'CLKGEN_CSR') WriteDoubleWord to non existing peripheral at 0x1180024C, value 0x80000000.
11:32:07.6501 [WARNING] sysbus: [U74_1: 0x80022C28] (tag: 'GPIO') ReadDoubleWord from non existing peripheral at 0x11910358, returning 0x0.
11:32:07.6502 [WARNING] sysbus: [U74_1: 0x80022C3E] (tag: 'GPIO') WriteDoubleWord to non existing peripheral at 0x11910358, value 0x2A.
11:32:07.6502 [WARNING] sysbus: [U74_1: 0x80022C42] (tag: 'GPIO') ReadDoubleWord from non existing peripheral at 0x11910194, returning 0x0.
11:32:07.6502 [WARNING] sysbus: [U74_1: 0x80022C58] (tag: 'GPIO') WriteDoubleWord to non existing peripheral at 0x11910194, value 0x1.
11:32:07.6503 [WARNING] sysbus: [U74_1: 0x80022C5C] (tag: 'GPIO') ReadDoubleWord from non existing peripheral at 0x11910198, returning 0x0.
11:32:07.6503 [WARNING] sysbus: [U74_1: 0x80022C6C] (tag: 'GPIO') WriteDoubleWord to non existing peripheral at 0x11910198, value 0x7F.
11:32:07.6503 [WARNING] sysbus: [U74_1: 0x80022C70] (tag: 'GPIO') ReadDoubleWord from non existing peripheral at 0x1191019C, returning 0x0.
11:32:07.6503 [WARNING] sysbus: [U74_1: 0x80022C7E] (tag: 'GPIO') WriteDoubleWord to non existing peripheral at 0x1191019C, value 0x0.
11:32:07.6504 [WARNING] sysbus: [U74_1: 0x80022C82] (tag: 'GPIO') ReadDoubleWord from non existing peripheral at 0x119101A0, returning 0x0.
11:32:07.6504 [WARNING] sysbus: [U74_1: 0x80022C90] (tag: 'GPIO') WriteDoubleWord to non existing peripheral at 0x119101A0, value 0x7E.
11:32:07.6504 [WARNING] sysbus: [U74_1: 0x80022C94] (tag: 'GPIO') ReadDoubleWord from non existing peripheral at 0x119101A4, returning 0x0.
11:32:07.6505 [WARNING] sysbus: [U74_1: 0x80022C9E] (tag: 'GPIO') WriteDoubleWord to non existing peripheral at 0x119101A4, value 0x0.
11:32:07.6505 [WARNING] sysbus: [U74_1: 0x80022CA2] (tag: 'GPIO') ReadDoubleWord from non existing peripheral at 0x11910348, returning 0x0.
11:32:07.6505 [WARNING] sysbus: [U74_1: 0x80022CB0] (tag: 'GPIO') WriteDoubleWord to non existing peripheral at 0x11910348, value 0x29.
11:32:07.6505 [WARNING] sysbus: [U74_1: 0x80022CB4] (tag: 'GPIO') ReadDoubleWord from non existing peripheral at 0x1191018C, returning 0x0.
11:32:07.6506 [WARNING] sysbus: [U74_1: 0x80022CC2] (tag: 'GPIO') WriteDoubleWord to non existing peripheral at 0x1191018C, value 0x1.
11:32:07.6506 [WARNING] sysbus: [U74_1: 0x80022CC6] (tag: 'GPIO') ReadDoubleWord from non existing peripheral at 0x1191016C, returning 0x0.
11:32:07.6506 [WARNING] sysbus: [U74_1: 0x80022CD0] (tag: 'GPIO') WriteDoubleWord to non existing peripheral at 0x1191016C, value 0x0.
11:32:07.6507 [WARNING] sysbus: [U74_1: 0x80022CD4] (tag: 'GPIO') ReadDoubleWord from non existing peripheral at 0x11910168, returning 0x0.
11:32:07.6507 [WARNING] sysbus: [U74_1: 0x80022CE2] (tag: 'GPIO') WriteDoubleWord to non existing peripheral at 0x11910168, value 0x1.
11:32:07.6507 [WARNING] sysbus: [U74_1: 0x80022CE6] (tag: 'CLKGEN_CSR') ReadDoubleWord from non existing peripheral at 0x11800250, returning 0x0.
11:32:07.6507 [WARNING] sysbus: [U74_1: 0x80022CF6] (tag: 'CLKGEN_CSR') WriteDoubleWord to non existing peripheral at 0x11800250, value 0x80000000.
11:32:07.6508 [WARNING] sysbus: [U74_1: 0x80022CFA] (tag: 'CLKGEN_CSR') ReadDoubleWord from non existing peripheral at 0x11800254, returning 0x0.
11:32:07.6508 [WARNING] sysbus: [U74_1: 0x80022D0E] (tag: 'CLKGEN_CSR') WriteDoubleWord to non existing peripheral at 0x11800254, value 0x80000000.
11:32:07.6509 [WARNING] sysbus: [U74_1: 0x80022D44] (tag: 'CLKGEN_CSR') ReadDoubleWord from non existing peripheral at 0x11800258, returning 0x0.
11:32:07.6509 [WARNING] sysbus: [U74_1: 0x80022D5C] (tag: 'CLKGEN_CSR') WriteDoubleWord to non existing peripheral at 0x11800258, value 0x80000000.
11:32:07.6509 [WARNING] sysbus: [U74_1: 0x80022D60] (tag: 'CLKGEN_CSR') ReadDoubleWord from non existing peripheral at 0x1180025C, returning 0x0.
11:32:07.6510 [WARNING] sysbus: [U74_1: 0x80022D70] (tag: 'CLKGEN_CSR') WriteDoubleWord to non existing peripheral at 0x1180025C, value 0x80000000.
11:32:07.6510 [WARNING] sysbus: [U74_1: 0x80022DAC] (tag: 'CLKGEN_CSR') ReadDoubleWord from non existing peripheral at 0x11800260, returning 0x0.
11:32:07.6511 [WARNING] sysbus: [U74_1: 0x80022DC4] (tag: 'CLKGEN_CSR') WriteDoubleWord to non existing peripheral at 0x11800260, value 0x80000000.
11:32:07.6511 [WARNING] sysbus: [U74_1: 0x80022DC8] (tag: 'CLKGEN_CSR') ReadDoubleWord from non existing peripheral at 0x11800264, returning 0x0.
11:32:07.6511 [WARNING] sysbus: [U74_1: 0x80022DD8] (tag: 'CLKGEN_CSR') WriteDoubleWord to non existing peripheral at 0x11800264, value 0x80000000.
11:32:07.6512 [WARNING] sysbus: [U74_1: 0x80022E16] (tag: 'CLKGEN_CSR') ReadDoubleWord from non existing peripheral at 0x11800268, returning 0x0.
11:32:07.6512 [WARNING] sysbus: [U74_1: 0x80022E2E] (tag: 'CLKGEN_CSR') WriteDoubleWord to non existing peripheral at 0x11800268, value 0x80000000.
11:32:07.6513 [WARNING] sysbus: [U74_1: 0x80022E32] (tag: 'CLKGEN_CSR') ReadDoubleWord from non existing peripheral at 0x1180026C, returning 0x0.
11:32:07.6513 [WARNING] sysbus: [U74_1: 0x80022E42] (tag: 'CLKGEN_CSR') WriteDoubleWord to non existing peripheral at 0x1180026C, value 0x80000000.
11:32:07.6514 [WARNING] sysbus: [U74_1: 0x80022E86] (tag: 'CLKGEN_CSR') ReadDoubleWord from non existing peripheral at 0x11800270, returning 0x0.
11:32:07.6514 [WARNING] sysbus: [U74_1: 0x80022E9E] (tag: 'CLKGEN_CSR') WriteDoubleWord to non existing peripheral at 0x11800270, value 0x80000000.
11:32:07.6514 [WARNING] sysbus: [U74_1: 0x80022EA2] (tag: 'CLKGEN_CSR') ReadDoubleWord from non existing peripheral at 0x11800274, returning 0x0.
11:32:07.6515 [WARNING] sysbus: [U74_1: 0x80022EB2] (tag: 'CLKGEN_CSR') WriteDoubleWord to non existing peripheral at 0x11800274, value 0x80000000.
11:32:07.6515 [WARNING] sysbus: [U74_1: 0x80022EF6] (tag: 'CLKGEN_CSR') ReadDoubleWord from non existing peripheral at 0x11800240, returning 0x0.
11:32:07.6516 [WARNING] sysbus: [U74_1: 0x80022F04] (tag: 'CLKGEN_CSR') WriteDoubleWord to non existing peripheral at 0x11800240, value 0x80000000.
11:32:07.6516 [WARNING] sysbus: [U74_1: 0x80022F1E] (tag: 'CLKGEN_CSR') ReadDoubleWord from non existing peripheral at 0x11800244, returning 0x0.
11:32:07.6516 [WARNING] sysbus: [U74_1: 0x80022F2C] (tag: 'CLKGEN_CSR') WriteDoubleWord to non existing peripheral at 0x11800244, value 0x80000000.
11:32:07.6517 [WARNING] sysbus: [U74_1: 0x80022F46] (tag: 'CLKGEN_CSR') ReadDoubleWord from non existing peripheral at 0x118002D0, returning 0x0.
11:32:07.6517 [WARNING] sysbus: [U74_1: 0x80022F50] (tag: 'CLKGEN_CSR') WriteDoubleWord to non existing peripheral at 0x118002D0, value 0x80000000.
11:32:07.6518 [WARNING] sysbus: [U74_1: 0x80022F74] (tag: 'CLKGEN_CSR') ReadDoubleWord from non existing peripheral at 0x1180028C, returning 0x0.
11:32:07.6518 [WARNING] sysbus: [U74_1: 0x80022F8C] (tag: 'CLKGEN_CSR') WriteDoubleWord to non existing peripheral at 0x1180028C, value 0x80000000.
11:32:07.6518 [WARNING] sysbus: [U74_1: 0x80022F90] (tag: 'CLKGEN_CSR') ReadDoubleWord from non existing peripheral at 0x11800290, returning 0x0.
11:32:07.6519 [WARNING] sysbus: [U74_1: 0x80022FA0] (tag: 'CLKGEN_CSR') WriteDoubleWord to non existing peripheral at 0x11800290, value 0x80000000.
11:32:07.6519 [WARNING] sysbus: [U74_1: 0x80022FE4] (tag: 'CLKGEN_CSR') ReadDoubleWord from non existing peripheral at 0x11800294, returning 0x0.
11:32:07.6520 [WARNING] sysbus: [U74_1: 0x80022FFC] (tag: 'CLKGEN_CSR') WriteDoubleWord to non existing peripheral at 0x11800294, value 0x80000000.
11:32:07.6520 [WARNING] sysbus: [U74_1: 0x80023000] (tag: 'CLKGEN_CSR') ReadDoubleWord from non existing peripheral at 0x11800298, returning 0x0.
11:32:07.6520 [WARNING] sysbus: [U74_1: 0x80023010] (tag: 'CLKGEN_CSR') WriteDoubleWord to non existing peripheral at 0x11800298, value 0x80000000.
11:32:07.6521 [WARNING] sysbus: [U74_1: 0x80023054] (tag: 'CLKGEN_CSR') ReadDoubleWord from non existing peripheral at 0x1180027C, returning 0x0.
11:32:07.6521 [WARNING] sysbus: [U74_1: 0x8002306C] (tag: 'CLKGEN_CSR') WriteDoubleWord to non existing peripheral at 0x1180027C, value 0x80000000.
11:32:07.6522 [WARNING] sysbus: [U74_1: 0x80023070] (tag: 'CLKGEN_CSR') ReadDoubleWord from non existing peripheral at 0x11800280, returning 0x0.
11:32:07.6522 [WARNING] sysbus: [U74_1: 0x80023080] (tag: 'CLKGEN_CSR') WriteDoubleWord to non existing peripheral at 0x11800280, value 0x80000000.
11:32:07.6523 [WARNING] sysbus: [U74_1: 0x800230C4] (tag: 'CLKGEN_CSR') ReadDoubleWord from non existing peripheral at 0x1180029C, returning 0x0.
11:32:07.6523 [WARNING] sysbus: [U74_1: 0x800230DE] (tag: 'CLKGEN_CSR') WriteDoubleWord to non existing peripheral at 0x1180029C, value 0x80000000.
11:32:07.6523 [WARNING] sysbus: [U74_1: 0x800230E2] (tag: 'CLKGEN_CSR') ReadDoubleWord from non existing peripheral at 0x118002A0, returning 0x0.
11:32:07.6524 [WARNING] sysbus: [U74_1: 0x800230F6] (tag: 'CLKGEN_CSR') WriteDoubleWord to non existing peripheral at 0x118002A0, value 0x80000000.
11:32:07.6524 [WARNING] sysbus: [U74_1: 0x80023122] (tag: 'CLKGEN_CSR') ReadDoubleWord from non existing peripheral at 0x118002A4, returning 0x0.
11:32:07.6525 [WARNING] sysbus: [U74_1: 0x8002313A] (tag: 'CLKGEN_CSR') WriteDoubleWord to non existing peripheral at 0x118002A4, value 0x80000000.
11:32:07.6525 [WARNING] sysbus: [U74_1: 0x8002313E] (tag: 'CLKGEN_CSR') ReadDoubleWord from non existing peripheral at 0x118002A8, returning 0x0.
11:32:07.6525 [WARNING] sysbus: [U74_1: 0x8002314E] (tag: 'CLKGEN_CSR') WriteDoubleWord to non existing peripheral at 0x118002A8, value 0x80000000.
11:32:07.6526 [WARNING] sysbus: [U74_1: 0x80023176] (tag: 'CLKGEN_CSR') ReadDoubleWord from non existing peripheral at 0x118001B4, returning 0x0.
11:32:07.6526 [WARNING] sysbus: [U74_1: 0x80023190] (tag: 'CLKGEN_CSR') WriteDoubleWord to non existing peripheral at 0x118001B4, value 0x80000000.
11:32:07.6527 [WARNING] sysbus: [U74_1: 0x80023194] (tag: 'CLKGEN_CSR') ReadDoubleWord from non existing peripheral at 0x118001C0, returning 0x0.
11:32:07.6527 [WARNING] sysbus: [U74_1: 0x800231A6] (tag: 'CLKGEN_CSR') WriteDoubleWord to non existing peripheral at 0x118001C0, value 0x80000000.
11:32:07.6527 [WARNING] sysbus: [U74_1: 0x800231AA] (tag: 'CLKGEN_CSR') ReadDoubleWord from non existing peripheral at 0x118001C4, returning 0x0.
11:32:07.6527 [WARNING] sysbus: [U74_1: 0x800231BC] (tag: 'CLKGEN_CSR') WriteDoubleWord to non existing peripheral at 0x118001C4, value 0x80000000.
11:32:07.6528 [WARNING] sysbus: [U74_1: 0x8002321C] (tag: 'VOUT') ReadDoubleWord from non existing peripheral at 0x12240004, returning 0x0.
11:32:07.6529 [WARNING] sysbus: [U74_1: 0x80023232] (tag: 'VOUT') WriteDoubleWord to non existing peripheral at 0x12240004, value 0x80000000.
11:32:07.6529 [WARNING] sysbus: [U74_1: 0x80023234] (tag: 'VOUT') ReadDoubleWord from non existing peripheral at 0x12240008, returning 0x0.
11:32:07.6529 [WARNING] sysbus: [U74_1: 0x80023246] (tag: 'VOUT') WriteDoubleWord to non existing peripheral at 0x12240008, value 0x80000000.
11:32:07.6530 [WARNING] sysbus: [U74_1: 0x80023248] (tag: 'VOUT') ReadDoubleWord from non existing peripheral at 0x1224000C, returning 0x0.
11:32:07.6530 [WARNING] sysbus: [U74_1: 0x80023252] (tag: 'VOUT') WriteDoubleWord to non existing peripheral at 0x1224000C, value 0x80000000.
11:32:07.6530 [WARNING] sysbus: [U74_1: 0x80023254] (tag: 'VOUT') ReadDoubleWord from non existing peripheral at 0x12240010, returning 0x0.
11:32:07.6530 [WARNING] sysbus: [U74_1: 0x8002325E] (tag: 'VOUT') WriteDoubleWord to non existing peripheral at 0x12240010, value 0x80000000.
11:32:07.6531 [WARNING] sysbus: [U74_1: 0x80023260] (tag: 'VOUT') ReadDoubleWord from non existing peripheral at 0x12240014, returning 0x0.
11:32:07.6531 [WARNING] sysbus: [U74_1: 0x8002326A] (tag: 'VOUT') WriteDoubleWord to non existing peripheral at 0x12240014, value 0x80000000.
11:32:07.6531 [WARNING] sysbus: [U74_1: 0x8002326C] (tag: 'VOUT') ReadDoubleWord from non existing peripheral at 0x12240018, returning 0x0.
11:32:07.6532 [WARNING] sysbus: [U74_1: 0x80023276] (tag: 'VOUT') WriteDoubleWord to non existing peripheral at 0x12240018, value 0x80000000.
11:32:07.6532 [WARNING] sysbus: [U74_1: 0x80023278] (tag: 'VOUT') ReadDoubleWord from non existing peripheral at 0x1224001C, returning 0x0.
11:32:07.6532 [WARNING] sysbus: [U74_1: 0x80023282] (tag: 'VOUT') WriteDoubleWord to non existing peripheral at 0x1224001C, value 0x80000000.
11:32:07.6532 [WARNING] sysbus: [U74_1: 0x80023284] (tag: 'VOUT') ReadDoubleWord from non existing peripheral at 0x12240020, returning 0x0.
11:32:07.6533 [WARNING] sysbus: [U74_1: 0x8002328E] (tag: 'VOUT') WriteDoubleWord to non existing peripheral at 0x12240020, value 0x80000000.
11:32:07.6533 [WARNING] sysbus: [U74_1: 0x80023290] (tag: 'VOUT') ReadDoubleWord from non existing peripheral at 0x12240024, returning 0x0.
11:32:07.6533 [WARNING] sysbus: [U74_1: 0x8002329A] (tag: 'VOUT') WriteDoubleWord to non existing peripheral at 0x12240024, value 0x80000000.
11:32:07.6534 [WARNING] sysbus: [U74_1: 0x8002329C] (tag: 'VOUT') ReadDoubleWord from non existing peripheral at 0x12240028, returning 0x0.
11:32:07.6534 [WARNING] sysbus: [U74_1: 0x800232A6] (tag: 'VOUT') WriteDoubleWord to non existing peripheral at 0x12240028, value 0x80000000.
11:32:07.6534 [WARNING] sysbus: [U74_1: 0x800232A8] (tag: 'VOUT') ReadDoubleWord from non existing peripheral at 0x1224002C, returning 0x0.
11:32:07.6534 [WARNING] sysbus: [U74_1: 0x800232B2] (tag: 'VOUT') WriteDoubleWord to non existing peripheral at 0x1224002C, value 0x80000000.
11:32:07.6535 [WARNING] sysbus: [U74_1: 0x800232B4] (tag: 'VOUT') ReadDoubleWord from non existing peripheral at 0x12240030, returning 0x0.
11:32:07.6535 [WARNING] sysbus: [U74_1: 0x800232BE] (tag: 'VOUT') WriteDoubleWord to non existing peripheral at 0x12240030, value 0x80000000.
11:32:07.6535 [WARNING] sysbus: [U74_1: 0x800232C0] (tag: 'VOUT') ReadDoubleWord from non existing peripheral at 0x12240034, returning 0x0.
11:32:07.6536 [WARNING] sysbus: [U74_1: 0x800232CA] (tag: 'VOUT') WriteDoubleWord to non existing peripheral at 0x12240034, value 0x80000000.
11:32:07.6536 [WARNING] sysbus: [U74_1: 0x800232CC] (tag: 'VOUT') ReadDoubleWord from non existing peripheral at 0x1224003C, returning 0x0.
11:32:07.6536 [WARNING] sysbus: [U74_1: 0x800232D6] (tag: 'VOUT') WriteDoubleWord to non existing peripheral at 0x1224003C, value 0x80000000.
11:32:07.6536 [WARNING] sysbus: [U74_1: 0x800232D8] (tag: 'VOUT') ReadDoubleWord from non existing peripheral at 0x12240038, returning 0x0.
11:32:07.6537 [WARNING] sysbus: [U74_1: 0x800232E2] (tag: 'VOUT') WriteDoubleWord to non existing peripheral at 0x12240038, value 0x80000000.
11:32:07.6537 [WARNING] sysbus: [U74_1: 0x800232E4] (tag: 'VOUT') ReadDoubleWord from non existing peripheral at 0x12240040, returning 0x0.
11:32:07.6537 [WARNING] sysbus: [U74_1: 0x800232EE] (tag: 'VOUT') WriteDoubleWord to non existing peripheral at 0x12240040, value 0x80000000.
11:32:07.9754 [INFO] uart3: [host:   1.22s (+0.43s)|virt:  0.15s (+0.11s)] ofnode_read_u32_array: ranges: ofnode_read_u32_array: ranges: ofnode_read_u32_index: timebase-frequency: (not found)
11:32:07.9760 [INFO] uart3: [host:  1.22s (+0.61ms)|virt:  0.15s (+0.1ms)] ofnode_read_u32_index: timebase-frequency: 0x5f5e10 (6250000)
11:32:07.9813 [INFO] uart3: [host:  1.23s (+5.27ms)|virt:  0.15s (+1.6ms)] ofnode_read_u32_index: timebase-frequency: (not found)
11:32:07.9818 [INFO] uart3: [host:  1.23s (+0.54ms)|virt:  0.15s (+0.1ms)] ofnode_read_u32_index: timebase-frequency: 0x5f5e10 (6250000)
11:32:07.9868 [INFO] uart3: [host:  1.23s (+4.97ms)|virt:  0.16s (+1.5ms)] MMC:   VIC DWMMC0: 0
11:32:08.0789 [INFO] uart3: [host: 1.32s (+92.13ms)|virt: 0.18s (+23.8ms)] In:    serial
11:32:08.0791 [INFO] uart3: [host:  1.33s (+0.17ms)|virt:     0.18s (+0s)] Out:   serial
11:32:08.0792 [INFO] uart3: [host:  1.33s (+0.14ms)|virt:     0.18s (+0s)] Err:   serial
11:32:08.0841 [INFO] uart3: [host:  1.33s (+4.86ms)|virt:  0.18s (+1.3ms)] Model: sifive,freedom-u74-arty
11:32:08.0929 [INFO] uart3: [host:   1.34s (+8.8ms)|virt:  0.18s (+1.9ms)] Net:   ofnode_read_prop: tick-timer: <not found>
11:32:08.0970 [WARNING] ethernet.phy: Unhandled write to offset 0x0, value 0x8000.
11:32:08.0972 [WARNING] ethernet.phy: Unhandled write to offset 0x4, value 0x1.
11:32:08.0974 [WARNING] ethernet.phy: Unhandled write to offset 0x0, value 0x1A80.
11:32:08.0979 [INFO] uart3: [host:  1.34s (+4.97ms)|virt: 0.18s (+0.73ms)] dwmac.10020000
11:32:08.1538 [INFO] uart3: [host:  1.4s (+55.96ms)|virt: 0.2s (+16.77ms)] Hit any key to stop autoboot:  0 
11:32:08.1578 [INFO] uart3: [host:   1.4s (+3.94ms)|virt:   0.2s (+0.7ms)] ## Loading kernel from FIT Image at a0000000 ...
11:32:08.1590 [INFO] uart3: [host:   1.4s (+1.21ms)|virt:   0.2s (+0.3ms)]    Using 'config-1' configuration
11:32:08.1596 [INFO] uart3: [host:  1.41s (+0.58ms)|virt:   0.2s (+0.1ms)]    Trying 'vmlinux' kernel subimage
11:32:08.1608 [INFO] uart3: [host:  1.41s (+0.31ms)|virt:   0.2s (+0.1ms)]      Description:  vmlinux
11:32:08.1611 [INFO] uart3: [host:  1.41s (+1.27ms)|virt:      0.2s (+0s)]      Type:         Kernel Image
11:32:08.1618 [INFO] uart3: [host:  1.41s (+0.61ms)|virt:   0.2s (+0.1ms)]      Compression:  uncompressed
11:32:08.1628 [INFO] uart3: [host:  1.41s (+1.05ms)|virt:   0.2s (+0.3ms)]      Data Start:   0xa00000c8
11:32:08.1631 [INFO] uart3: [host:  1.41s (+0.33ms)|virt:      0.2s (+0s)]      Data Size:    17660416 Bytes = 16.8 MiB
11:32:08.1636 [INFO] uart3: [host:  1.41s (+0.48ms)|virt:   0.2s (+0.1ms)]      Architecture: RISC-V
11:32:08.1640 [INFO] uart3: [host:  1.41s (+0.42ms)|virt:   0.2s (+0.1ms)]      OS:           Linux
11:32:08.1648 [INFO] uart3: [host:  1.41s (+0.71ms)|virt:   0.2s (+0.1ms)]      Load Address: 0x80200000
11:32:08.1656 [INFO] uart3: [host:  1.41s (+0.83ms)|virt:   0.2s (+0.1ms)]      Entry Point:  0x80200000
11:32:08.1675 [INFO] uart3: [host:  1.41s (+1.94ms)|virt:   0.2s (+0.3ms)]    Verifying Hash Integrity ... OK
11:32:08.1750 [INFO] uart3: [host:  1.42s (+7.49ms)|virt:   0.2s (+1.8ms)] ## Loading fdt from FIT Image at a0000000 ...
11:32:08.1761 [INFO] uart3: [host:  1.42s (+1.12ms)|virt:   0.2s (+0.3ms)]    Using 'config-1' configuration
11:32:08.1770 [INFO] uart3: [host:  1.42s (+0.83ms)|virt:   0.2s (+0.2ms)]    Trying 'fdt' fdt subimage
11:32:08.1775 [INFO] uart3: [host:   1.42s (+0.5ms)|virt:   0.2s (+0.1ms)]      Description:  unavailable
11:32:08.1778 [INFO] uart3: [host:  1.42s (+0.33ms)|virt:      0.2s (+0s)]      Type:         Flat Device Tree
11:32:08.1782 [INFO] uart3: [host:  1.42s (+0.45ms)|virt:   0.2s (+0.1ms)]      Compression:  uncompressed
11:32:08.1789 [INFO] uart3: [host:  1.42s (+0.67ms)|virt:   0.2s (+0.1ms)]      Data Start:   0xa4f297f8
11:32:08.1793 [INFO] uart3: [host:  1.43s (+0.42ms)|virt:   0.2s (+0.1ms)]      Data Size:    16655 Bytes = 16.3 KiB
11:32:08.1798 [INFO] uart3: [host:  1.43s (+0.49ms)|virt:      0.2s (+0s)]      Architecture: RISC-V
11:32:08.1804 [INFO] uart3: [host:  1.43s (+0.59ms)|virt:   0.2s (+0.1ms)]      Load Address: 0x86000000
11:32:08.1818 [INFO] uart3: [host:  1.43s (+1.34ms)|virt:   0.2s (+0.2ms)]    Verifying Hash Integrity ... OK
11:32:08.1837 [INFO] uart3: [host:  1.43s (+1.91ms)|virt:  0.21s (+0.3ms)]    Loading fdt from 0xa4f297f8 to 0x86000000
11:32:08.1858 [INFO] uart3: [host:  1.43s (+2.12ms)|virt:  0.21s (+0.4ms)]    Booting using the fdt blob at 0x86000000
11:32:08.1885 [INFO] uart3: [host:  1.43s (+2.68ms)|virt:  0.21s (+0.8ms)] ## Loading loadables from FIT Image at a0000000 ...
11:32:08.1896 [INFO] uart3: [host:  1.44s (+1.16ms)|virt:  0.21s (+0.1ms)]    Trying 'ramdisk' loadables subimage
11:32:08.1902 [INFO] uart3: [host:  1.44s (+0.54ms)|virt:  0.21s (+0.1ms)]      Description:  buildroot initramfs
11:32:08.1907 [INFO] uart3: [host:  1.44s (+0.57ms)|virt:     0.21s (+0s)]      Type:         RAMDisk Image
11:32:08.1915 [INFO] uart3: [host:   1.44s (+0.8ms)|virt:  0.21s (+0.1ms)]      Compression:  uncompressed
11:32:08.1929 [INFO] uart3: [host:  1.44s (+1.36ms)|virt:  0.21s (+0.3ms)]      Data Start:   0xa10d7b7c
11:32:08.1933 [INFO] uart3: [host:  1.44s (+0.36ms)|virt:     0.21s (+0s)]      Data Size:    65346560 Bytes = 62.3 MiB
11:32:08.1937 [INFO] uart3: [host:  1.44s (+0.44ms)|virt:  0.21s (+0.1ms)]      Architecture: RISC-V
11:32:08.1941 [INFO] uart3: [host:  1.44s (+0.37ms)|virt:     0.21s (+0s)]      OS:           Linux
11:32:08.1946 [INFO] uart3: [host:  1.44s (+0.53ms)|virt:  0.21s (+0.1ms)]      Load Address: 0x86100000
11:32:08.1951 [INFO] uart3: [host:  1.44s (+0.52ms)|virt:  0.21s (+0.1ms)]      Entry Point:  unavailable
11:32:08.1963 [INFO] uart3: [host:   1.44s (+1.2ms)|virt:  0.21s (+0.3ms)]    Verifying Hash Integrity ... OK
11:32:08.1985 [INFO] uart3: [host:  1.44s (+2.17ms)|virt:  0.21s (+0.6ms)]    Loading loadables from 0xa10d7b7c to 0x86100000
11:32:18.8290 [INFO] uart3: [host: 12.08s (+10.63s)|virt:  3.48s (+3.27s)]    Loading Kernel Image
11:32:19.6659 [INFO] uart3: [host:  12.91s (+0.84s)|virt:   3.6s (+0.12s)] ## Flattened Device Tree blob at 86000000
11:32:19.6663 [INFO] uart3: [host: 12.91s (+0.37ms)|virt:      3.6s (+0s)]    Booting using the fdt blob at 0x86000000
11:32:19.6969 [INFO] uart3: [host: 12.94s (+30.59ms)|virt:  3.61s (+8.4ms)]    Using Device Tree in place at 0000000086000000, end 000000008600710e
11:32:19.7342 [INFO] uart3: [host: 12.98s (+37.24ms)|virt: 3.62s (+10.2ms)] 
11:32:19.7344 [INFO] uart3: [host:  12.98s (+0.26ms)|virt:     3.62s (+0s)] Starting kernel ...
11:32:19.7344 [INFO] uart3: [host:    12.98s (+39µs)|virt:     3.62s (+0s)] 
11:32:19.8025 [INFO] uart3: [host: 13.05s (+68.04ms)|virt: 3.63s (+15.73ms)] [    0.000000] Linux version 5.10.6-g93604a0a3ecc (root@runner-7005a2b9-project-3475-concurrent-0) (riscv64-buildroot-linux-gnu-gcc.br_real (Buildroot -g2e13b6d) 10.2.0, GNU ld (GNU Binutils) 2.34) #1 SMP Mon Apr 26 09:57:54 UTC 2021
11:32:19.8068 [INFO] uart3: [host:  13.05s (+4.38ms)|virt:  3.63s (+0.29ms)] [    0.000000] OF: fdt: Ignoring memory range 0x80000000 - 0x80200000
11:32:19.8108 [INFO] uart3: [host:  13.06s (+3.93ms)|virt:  3.63s (+0.24ms)] [    0.000000] earlycon: sbi0 at I/O port 0x0 (options '')
11:32:19.8154 [INFO] uart3: [host:  13.06s (+4.57ms)|virt:  3.64s (+0.25ms)] [    0.000000] printk: bootconsole [sbi0] enabled
11:32:19.8215 [INFO] uart3: [host:  13.07s (+6.11ms)|virt:   3.64s (+0.9ms)] [    0.000000] efi: UEFI not found.
11:32:19.8261 [INFO] uart3: [host:  13.07s (+4.67ms)|virt:  3.64s (+0.33ms)] [    0.000000] Initial ramdisk at: 0x(____ptrval____) (99614720 bytes)
11:32:19.8453 [INFO] uart3: [host: 13.09s (+19.18ms)|virt:  3.64s (+3.26ms)] [    0.000000] Reserved memory: created CMA memory pool at 0x00000000a0000000, size 640 MiB
11:32:19.8518 [INFO] uart3: [host:   13.1s (+6.43ms)|virt:   3.64s (+0.4ms)] [    0.000000] OF: reserved mem: initialized node linux,cma, compatible id shared-dma-pool
11:32:20.0751 [INFO] uart3: [host:   13.32s (+0.22s)|virt:  3.65s (+6.41ms)] [    0.000000] Zone ranges:
11:32:20.0793 [INFO] uart3: [host:   13.33s (+4.2ms)|virt:  3.65s (+0.35ms)] [    0.000000]   DMA32    [mem 0x0000000080200000-0x00000000ffffffff]
11:32:20.0835 [INFO] uart3: [host:  13.33s (+4.16ms)|virt:  3.65s (+0.35ms)] [    0.000000]   Normal   [mem 0x0000000100000000-0x000000027fffffff]
11:32:20.0866 [INFO] uart3: [host:  13.33s (+3.17ms)|virt:  3.65s (+0.23ms)] [    0.000000] Movable zone start for each node
11:32:20.0903 [INFO] uart3: [host:  13.34s (+3.68ms)|virt:   3.65s (+0.2ms)] [    0.000000] Early memory node ranges
11:32:20.0953 [INFO] uart3: [host:  13.34s (+4.96ms)|virt:  3.65s (+0.33ms)] [    0.000000]   node   0: [mem 0x0000000080200000-0x000000027fffffff]
11:32:20.1000 [INFO] uart3: [host:  13.35s (+4.75ms)|virt:  3.65s (+0.37ms)] [    0.000000] Initmem setup node 0 [mem 0x0000000080200000-0x000000027fffffff]
11:32:20.1037 [INFO] uart3: [host:  13.35s (+3.69ms)|virt:  3.65s (+0.23ms)] [    0.000000] On node 0 totalpages: 2096640
11:32:20.5846 [INFO] uart3: [host:   13.83s (+0.48s)|virt:    3.8s (+0.16s)] [    0.000000]   DMA32 zone: 7161 pages used for memmap
11:32:20.5873 [INFO] uart3: [host:  13.83s (+2.76ms)|virt:   3.8s (+0.23ms)] [    0.000000]   DMA32 zone: 0 pages reserved
11:32:20.5916 [INFO] uart3: [host:  13.84s (+4.31ms)|virt:  3.81s (+0.28ms)] [    0.000000]   DMA32 zone: 523776 pages, LIFO batch:63
11:32:21.0527 [INFO] uart3: [host:    14.3s (+0.46s)|virt:   3.94s (+0.13s)] [    0.000000]   Normal zone: 21504 pages used for memmap
11:32:21.0562 [INFO] uart3: [host:   14.3s (+3.48ms)|virt:  3.94s (+0.28ms)] [    0.000000]   Normal zone: 1572864 pages, LIFO batch:63
11:32:22.7829 [INFO] uart3: [host:   16.03s (+1.73s)|virt:   4.45s (+0.52s)] [    0.000000] software IO TLB: mapped [mem 0x00000000fbfff000-0x00000000fffff000] (64MB)
11:32:22.7858 [INFO] uart3: [host:  16.03s (+2.91ms)|virt:  4.45s (+0.24ms)] [    0.000000] SBI specification v0.2 detected
11:32:22.7891 [INFO] uart3: [host:  16.04s (+3.31ms)|virt:  4.45s (+0.26ms)] [    0.000000] SBI implementation ID=0x1 Version=0x9
11:32:22.7921 [INFO] uart3: [host:  16.04s (+2.94ms)|virt:  4.45s (+0.23ms)] [    0.000000] SBI v0.2 TIME extension detected
11:32:22.7959 [INFO] uart3: [host:  16.04s (+3.84ms)|virt:  4.45s (+0.23ms)] [    0.000000] SBI v0.2 IPI extension detected
11:32:22.8005 [INFO] uart3: [host:  16.05s (+4.56ms)|virt:  4.45s (+0.24ms)] [    0.000000] SBI v0.2 RFENCE extension detected
11:32:22.8035 [INFO] uart3: [host:   16.05s (+3.1ms)|virt:  4.45s (+0.23ms)] [    0.000000] SBI v0.2 HSM extension detected
11:32:22.8072 [INFO] uart3: [host:  16.05s (+3.65ms)|virt:  4.46s (+0.39ms)] [    0.000000] riscv: ISA extensions acdfim
11:32:22.8111 [INFO] uart3: [host:  16.06s (+3.86ms)|virt:  4.46s (+0.23ms)] [    0.000000] riscv: ELF capabilities acdfim
11:32:22.8198 [INFO] uart3: [host:  16.07s (+8.71ms)|virt:  4.46s (+0.87ms)] [    0.000000] percpu: Embedded 17 pages/cpu s30888 r8192 d30552 u69632
11:32:22.8246 [INFO] uart3: [host:  16.07s (+4.86ms)|virt:  4.46s (+0.47ms)] [    0.000000] pcpu-alloc: s30888 r8192 d30552 u69632 alloc=17*4096
11:32:22.8279 [INFO] uart3: [host:   16.07s (+3.2ms)|virt:  4.46s (+0.33ms)] [    0.000000] pcpu-alloc: [0] 0 [0] 1 
11:32:22.8350 [INFO] uart3: [host:  16.08s (+7.11ms)|virt:  4.46s (+0.89ms)] [    0.000000] Built 1 zonelists, mobility grouping on.  Total pages: 2067975
11:32:22.8401 [INFO] uart3: [host:  16.09s (+5.14ms)|virt:  4.46s (+0.39ms)] [    0.000000] Kernel command line: console=ttyS0,115200  debug rootwait  earlycon=sbi
11:32:22.8870 [INFO] uart3: [host: 16.13s (+46.94ms)|virt: 4.47s (+11.96ms)] [    0.000000] Dentry cache hash table entries: 1048576 (order: 11, 8388608 bytes, linear)
11:32:22.9123 [INFO] uart3: [host:  16.16s (+25.3ms)|virt:  4.48s (+6.04ms)] [    0.000000] Inode-cache hash table entries: 524288 (order: 10, 4194304 bytes, linear)
11:32:22.9146 [INFO] uart3: [host:  16.16s (+2.34ms)|virt:  4.48s (+0.19ms)] [    0.000000] Sorting __ex_table...
11:32:22.9259 [INFO] uart3: [host: 16.17s (+11.24ms)|virt:  4.48s (+2.47ms)] [    0.000000] mem auto-init: stack:off, heap alloc:off, heap free:off
11:32:24.3912 [INFO] uart3: [host:   17.64s (+1.47s)|virt:   4.95s (+0.47s)] [    0.000000] Memory: 6735000K/8386560K available (6771K kernel code, 4266K rwdata, 4096K rodata, 230K init, 392K bss, 996200K reserved, 655360K cma-reserved)
11:32:24.3997 [INFO] uart3: [host:  17.65s (+8.45ms)|virt:   4.95s (+1.3ms)] [    0.000000] SLUB: HWalign=64, Order=0-3, MinObjects=0, CPUs=2, Nodes=1
11:32:24.4095 [INFO] uart3: [host:  17.66s (+9.79ms)|virt:  4.95s (+1.19ms)] [    0.000000] rcu: Hierarchical RCU implementation.
11:32:24.4127 [INFO] uart3: [host:  17.66s (+3.22ms)|virt:  4.95s (+0.26ms)] [    0.000000] rcu: RCU debug extended QS entry/exit.
11:32:24.4169 [INFO] uart3: [host:  17.66s (+4.24ms)|virt:  4.95s (+0.26ms)] [    0.000000] Tracing variant of Tasks RCU enabled.
11:32:24.4237 [INFO] uart3: [host:  17.67s (+6.73ms)|virt:  4.95s (+0.38ms)] [    0.000000] rcu: RCU calculated value of scheduler-enlistment delay is 10 jiffies.
11:32:24.4282 [INFO] uart3: [host:  17.67s (+4.53ms)|virt:  4.95s (+0.39ms)] [    0.000000] NR_IRQS: 64, nr_irqs: 64, preallocated irqs: 0
11:32:24.4362 [INFO] uart3: [host:  17.68s (+7.94ms)|virt:  4.95s (+1.08ms)] [    0.000000] riscv-intc: 64 local interrupts mapped
11:32:24.4656 [INFO] uart3: [host: 17.71s (+29.32ms)|virt:  4.95s (+3.99ms)] [    0.000000] plic: disable L2 cache irq 1 in plic
11:32:24.4694 [INFO] uart3: [host:  17.72s (+3.99ms)|virt:   4.96s (+0.3ms)] [    0.000000] plic: disable L2 cache irq 2 in plic
11:32:24.4730 [INFO] uart3: [host:  17.72s (+3.52ms)|virt:   4.96s (+0.3ms)] [    0.000000] plic: disable L2 cache irq 3 in plic
11:32:24.4762 [INFO] uart3: [host:  17.72s (+3.23ms)|virt:  4.96s (+0.27ms)] [    0.000000] plic: Can't get L2 cache irq(#3).
11:32:24.4906 [INFO] uart3: [host: 17.74s (+14.43ms)|virt:  4.96s (+0.84ms)] [    0.000000] plic: disable L2 cache irq 1 in plic
11:32:24.4958 [INFO] uart3: [host:  17.74s (+5.16ms)|virt:   4.96s (+0.3ms)] [    0.000000] plic: disable L2 cache irq 2 in plic
11:32:24.5003 [INFO] uart3: [host:  17.75s (+4.49ms)|virt:   4.96s (+0.3ms)] [    0.000000] plic: disable L2 cache irq 3 in plic
11:32:24.5039 [INFO] uart3: [host:  17.75s (+3.59ms)|virt:  4.96s (+0.27ms)] [    0.000000] plic: Can't get L2 cache irq(#3).
11:32:24.5041 [WARNING] plic: Unhandled write to offset 0x201000, value 0x0.
11:32:24.5092 [INFO] uart3: [host:  17.76s (+5.35ms)|virt:  4.96s (+0.42ms)] [    0.000000] plic: plic@c000000: mapped 127 interrupts with 2 handlers for 4 contexts.
11:32:24.5215 [INFO] uart3: [host: 17.77s (+12.29ms)|virt:  4.96s (+2.22ms)] [    0.000000] random: get_random_bytes called from start_kernel+0x31c/0x48e with crng_init=0
11:32:24.5265 [INFO] uart3: [host:     17.77s (+5ms)|virt:  4.96s (+0.33ms)] [    0.000000] riscv_timer_init_dt: Registering clocksource cpuid [0] hartid [0]
11:32:24.5369 [INFO] uart3: [host: 17.78s (+10.29ms)|virt:  4.96s (+0.55ms)] [    0.000000] clocksource: riscv_clocksource: mask: 0xffffffffffffffff max_cycles: 0x171024e6b, max_idle_ns: 440795202301 ns
11:32:24.5426 [INFO] uart3: [host:  17.79s (+5.82ms)|virt:  4.96s (+0.42ms)] [    0.000034] sched_clock: 64 bits at 6MHz, resolution 160ns, wraps every 4398046511040ns
11:32:24.5495 [INFO] uart3: [host:   17.8s (+6.85ms)|virt:  4.96s (+0.94ms)] [    0.001081] Console: colour dummy device 80x25
11:32:24.5567 [INFO] uart3: [host:   17.8s (+7.26ms)|virt:  4.96s (+0.63ms)] [    0.001413] Calibrating delay loop (skipped), value calculated using timer frequency.. 12.50 BogoMIPS (lpj=62500)
11:32:24.5599 [INFO] uart3: [host:  17.81s (+3.17ms)|virt:  4.96s (+0.25ms)] [    0.001930] pid_max: default: 32768 minimum: 301
11:32:24.5735 [INFO] uart3: [host:  17.82s (+13.5ms)|virt:   4.96s (+1.4ms)] [    0.003147] Mount-cache hash table entries: 16384 (order: 5, 131072 bytes, linear)
11:32:24.5798 [INFO] uart3: [host:  17.83s (+6.42ms)|virt:  4.97s (+0.62ms)] [    0.003725] Mountpoint-cache hash table entries: 16384 (order: 5, 131072 bytes, linear)
11:32:24.6169 [INFO] uart3: [host: 17.86s (+37.03ms)|virt:  4.97s (+6.55ms)] [    0.010142] rcu: Hierarchical SRCU implementation.
11:32:24.6250 [INFO] uart3: [host:   17.87s (+8.1ms)|virt:  4.97s (+0.96ms)] [    0.011074] EFI services will not be available.
11:32:24.6336 [INFO] uart3: [host:   17.88s (+8.6ms)|virt:  4.97s (+1.16ms)] [    0.012187] smp: Bringing up secondary CPUs ...
11:32:26.2910 [INFO] uart3: [host:   19.54s (+1.66s)|virt:   6.05s (+1.07s)] [    1.043304] CPU1: failed to come online
11:32:26.2990 [INFO] uart3: [host:  19.54s (+8.02ms)|virt:  6.05s (+0.35ms)] [    1.043633] smp: Brought up 1 node, 1 CPU
11:32:26.3385 [INFO] uart3: [host: 19.58s (+39.51ms)|virt:   6.05s (+5.4ms)] [    1.048848] devtmpfs: initialized
11:32:26.4296 [INFO] uart3: [host:  19.68s (+91.1ms)|virt: 6.07s (+19.46ms)] [    1.067259] clocksource: jiffies: mask: 0xffffffff max_cycles: 0xffffffff, max_idle_ns: 19112604462750000 ns
11:32:26.4341 [INFO] uart3: [host:  19.68s (+4.47ms)|virt:  6.07s (+0.38ms)] [    1.067742] futex hash table entries: 512 (order: 3, 32768 bytes, linear)
11:32:26.6217 [INFO] uart3: [host:   19.87s (+0.19s)|virt:    6.13s (+59ms)] [    1.124483] NET: Registered protocol family 16
11:32:26.8055 [INFO] uart3: [host:   20.05s (+0.18s)|virt: 6.17s (+40.74ms)] [    1.163474] OF: /soc/usb@104c0000: could not get #phy-cells for /soc/usb3-phy
11:32:26.8124 [INFO] uart3: [host:  20.06s (+6.94ms)|virt:  6.17s (+1.11ms)] [    1.164612] OF: /soc/i2c@118c0000: could not find phandle
11:32:26.8176 [INFO] uart3: [host:  20.06s (+5.18ms)|virt:  6.18s (+0.66ms)] [    1.165250] OF: /soc/i2c@12450000: could not find phandle
11:32:26.8659 [INFO] uart3: [host: 20.11s (+48.28ms)|virt: 6.19s (+10.42ms)] [    1.175180] OF: /soc/usb@104c0000: could not get #phy-cells for /soc/usb3-phy
11:32:26.8747 [INFO] uart3: [host:  20.12s (+8.88ms)|virt:   6.19s (+1.4ms)] [    1.176594] OF: /soc/i2c@118c0000: could not find phandle
11:32:26.8823 [INFO] uart3: [host:  20.13s (+7.57ms)|virt:  6.19s (+0.99ms)] [    1.177543] OF: /soc/i2c@12450000: could not find phandle
11:32:27.1388 [INFO] uart3: [host:   20.38s (+0.26s)|virt: 6.24s (+53.76ms)] [    1.229095] HugeTLB registered 1.00 GiB page size, pre-allocated 0 pages
11:32:27.1431 [INFO] uart3: [host:  20.39s (+4.33ms)|virt:  6.24s (+0.36ms)] [    1.229439] HugeTLB registered 2.00 MiB page size, pre-allocated 0 pages
11:32:27.1927 [WARNING] sysbus: [U74_1: 0xFFFFFFE00051F27C] (tag: 'GPIO') ReadDoubleWord from non existing peripheral at 0x11910054, returning 0x0.
11:32:27.1927 [WARNING] sysbus: [U74_1: 0xFFFFFFE00051F27C] (tag: 'GPIO') ReadDoubleWord from non existing peripheral at 0x1191005C, returning 0x0.
11:32:27.1928 [WARNING] sysbus: [U74_1: 0xFFFFFFE00051F27C] (tag: 'GPIO') ReadDoubleWord from non existing peripheral at 0x11910064, returning 0x0.
11:32:27.1928 [WARNING] sysbus: [U74_1: 0xFFFFFFE00051F27C] (tag: 'GPIO') ReadDoubleWord from non existing peripheral at 0x1191006C, returning 0x0.
11:32:27.1928 [WARNING] sysbus: [U74_1: 0xFFFFFFE00051F27C] (tag: 'GPIO') ReadDoubleWord from non existing peripheral at 0x11910074, returning 0x0.
11:32:27.1929 [WARNING] sysbus: [U74_1: 0xFFFFFFE00051F27C] (tag: 'GPIO') ReadDoubleWord from non existing peripheral at 0x1191007C, returning 0x0.
11:32:27.1929 [WARNING] sysbus: [U74_1: 0xFFFFFFE00051F27C] (tag: 'GPIO') ReadDoubleWord from non existing peripheral at 0x11910084, returning 0x0.
11:32:27.1929 [WARNING] sysbus: [U74_1: 0xFFFFFFE00051F27C] (tag: 'GPIO') ReadDoubleWord from non existing peripheral at 0x1191008C, returning 0x0.
11:32:27.1930 [WARNING] sysbus: [U74_1: 0xFFFFFFE00051F27C] (tag: 'GPIO') ReadDoubleWord from non existing peripheral at 0x11910094, returning 0x0.
11:32:27.1930 [WARNING] sysbus: [U74_1: 0xFFFFFFE00051F27C] (tag: 'GPIO') ReadDoubleWord from non existing peripheral at 0x1191009C, returning 0x0.
11:32:27.1930 [WARNING] sysbus: [U74_1: 0xFFFFFFE00051F27C] (tag: 'GPIO') ReadDoubleWord from non existing peripheral at 0x119100A4, returning 0x0.
11:32:27.1931 [WARNING] sysbus: [U74_1: 0xFFFFFFE00051F27C] (tag: 'GPIO') ReadDoubleWord from non existing peripheral at 0x119100AC, returning 0x0.
11:32:27.1931 [WARNING] sysbus: [U74_1: 0xFFFFFFE00051F27C] (tag: 'GPIO') ReadDoubleWord from non existing peripheral at 0x119100B4, returning 0x0.
11:32:27.1931 [WARNING] sysbus: [U74_1: 0xFFFFFFE00051F27C] (tag: 'GPIO') ReadDoubleWord from non existing peripheral at 0x119100BC, returning 0x0.
11:32:27.1932 [WARNING] sysbus: [U74_1: 0xFFFFFFE00051F27C] (tag: 'GPIO') ReadDoubleWord from non existing peripheral at 0x119100C4, returning 0x0.
11:32:27.1932 [WARNING] sysbus: [U74_1: 0xFFFFFFE00051F27C] (tag: 'GPIO') ReadDoubleWord from non existing peripheral at 0x119100CC, returning 0x0.
11:32:27.1933 [WARNING] sysbus: [U74_1: 0xFFFFFFE00051F27C] (tag: 'GPIO') ReadDoubleWord from non existing peripheral at 0x119100D4, returning 0x0.
11:32:27.1934 [WARNING] sysbus: [U74_1: 0xFFFFFFE00051F27C] (tag: 'GPIO') ReadDoubleWord from non existing peripheral at 0x119100DC, returning 0x0.
11:32:27.1934 [WARNING] sysbus: [U74_1: 0xFFFFFFE00051F27C] (tag: 'GPIO') ReadDoubleWord from non existing peripheral at 0x119100E4, returning 0x0.
11:32:27.1935 [WARNING] sysbus: [U74_1: 0xFFFFFFE00051F27C] (tag: 'GPIO') ReadDoubleWord from non existing peripheral at 0x119100EC, returning 0x0.
11:32:27.1935 [WARNING] sysbus: [U74_1: 0xFFFFFFE00051F27C] (tag: 'GPIO') ReadDoubleWord from non existing peripheral at 0x119100F4, returning 0x0.
11:32:27.1936 [WARNING] sysbus: [U74_1: 0xFFFFFFE00051F27C] (tag: 'GPIO') ReadDoubleWord from non existing peripheral at 0x119100FC, returning 0x0.
11:32:27.1936 [WARNING] sysbus: [U74_1: 0xFFFFFFE00051F27C] (tag: 'GPIO') ReadDoubleWord from non existing peripheral at 0x11910104, returning 0x0.
11:32:27.1936 [WARNING] sysbus: [U74_1: 0xFFFFFFE00051F27C] (tag: 'GPIO') ReadDoubleWord from non existing peripheral at 0x1191010C, returning 0x0.
11:32:27.1937 [WARNING] sysbus: [U74_1: 0xFFFFFFE00051F27C] (tag: 'GPIO') ReadDoubleWord from non existing peripheral at 0x11910114, returning 0x0.
11:32:27.1937 [WARNING] sysbus: [U74_1: 0xFFFFFFE00051F27C] (tag: 'GPIO') ReadDoubleWord from non existing peripheral at 0x1191011C, returning 0x0.
11:32:27.1937 [WARNING] sysbus: [U74_1: 0xFFFFFFE00051F27C] (tag: 'GPIO') ReadDoubleWord from non existing peripheral at 0x11910124, returning 0x0.
11:32:27.1938 [WARNING] sysbus: [U74_1: 0xFFFFFFE00051F27C] (tag: 'GPIO') ReadDoubleWord from non existing peripheral at 0x1191012C, returning 0x0.
11:32:27.1938 [WARNING] sysbus: [U74_1: 0xFFFFFFE00051F27C] (tag: 'GPIO') ReadDoubleWord from non existing peripheral at 0x11910134, returning 0x0.
11:32:27.1938 [WARNING] sysbus: [U74_1: 0xFFFFFFE00051F27C] (tag: 'GPIO') ReadDoubleWord from non existing peripheral at 0x1191013C, returning 0x0.
11:32:27.1939 [WARNING] sysbus: [U74_1: 0xFFFFFFE00051F27C] (tag: 'GPIO') ReadDoubleWord from non existing peripheral at 0x11910144, returning 0x0.
11:32:27.1939 [WARNING] sysbus: [U74_1: 0xFFFFFFE00051F27C] (tag: 'GPIO') ReadDoubleWord from non existing peripheral at 0x1191014C, returning 0x0.
11:32:27.1939 [WARNING] sysbus: [U74_1: 0xFFFFFFE00051F27C] (tag: 'GPIO') ReadDoubleWord from non existing peripheral at 0x11910154, returning 0x0.
11:32:27.1940 [WARNING] sysbus: [U74_1: 0xFFFFFFE00051F27C] (tag: 'GPIO') ReadDoubleWord from non existing peripheral at 0x1191015C, returning 0x0.
11:32:27.1940 [WARNING] sysbus: [U74_1: 0xFFFFFFE00051F27C] (tag: 'GPIO') ReadDoubleWord from non existing peripheral at 0x11910164, returning 0x0.
11:32:27.1940 [WARNING] sysbus: [U74_1: 0xFFFFFFE00051F27C] (tag: 'GPIO') ReadDoubleWord from non existing peripheral at 0x1191016C, returning 0x0.
11:32:27.1941 [WARNING] sysbus: [U74_1: 0xFFFFFFE00051F27C] (tag: 'GPIO') ReadDoubleWord from non existing peripheral at 0x11910174, returning 0x0.
11:32:27.1941 [WARNING] sysbus: [U74_1: 0xFFFFFFE00051F27C] (tag: 'GPIO') ReadDoubleWord from non existing peripheral at 0x1191017C, returning 0x0.
11:32:27.1942 [WARNING] sysbus: [U74_1: 0xFFFFFFE00051F27C] (tag: 'GPIO') ReadDoubleWord from non existing peripheral at 0x11910184, returning 0x0.
11:32:27.1942 [WARNING] sysbus: [U74_1: 0xFFFFFFE00051F27C] (tag: 'GPIO') ReadDoubleWord from non existing peripheral at 0x1191018C, returning 0x0.
11:32:27.1942 [WARNING] sysbus: [U74_1: 0xFFFFFFE00051F27C] (tag: 'GPIO') ReadDoubleWord from non existing peripheral at 0x11910194, returning 0x0.
11:32:27.1943 [WARNING] sysbus: [U74_1: 0xFFFFFFE00051F27C] (tag: 'GPIO') ReadDoubleWord from non existing peripheral at 0x1191019C, returning 0x0.
11:32:27.1943 [WARNING] sysbus: [U74_1: 0xFFFFFFE00051F27C] (tag: 'GPIO') ReadDoubleWord from non existing peripheral at 0x119101A4, returning 0x0.
11:32:27.1943 [WARNING] sysbus: [U74_1: 0xFFFFFFE00051F27C] (tag: 'GPIO') ReadDoubleWord from non existing peripheral at 0x119101AC, returning 0x0.
11:32:27.1944 [WARNING] sysbus: [U74_1: 0xFFFFFFE00051F27C] (tag: 'GPIO') ReadDoubleWord from non existing peripheral at 0x119101B4, returning 0x0.
11:32:27.1944 [WARNING] sysbus: [U74_1: 0xFFFFFFE00051F27C] (tag: 'GPIO') ReadDoubleWord from non existing peripheral at 0x119101BC, returning 0x0.
11:32:27.1944 [WARNING] sysbus: [U74_1: 0xFFFFFFE00051F27C] (tag: 'GPIO') ReadDoubleWord from non existing peripheral at 0x119101C4, returning 0x0.
11:32:27.1945 [WARNING] sysbus: [U74_1: 0xFFFFFFE00051F27C] (tag: 'GPIO') ReadDoubleWord from non existing peripheral at 0x119101CC, returning 0x0.
11:32:27.1945 [WARNING] sysbus: [U74_1: 0xFFFFFFE00051F27C] (tag: 'GPIO') ReadDoubleWord from non existing peripheral at 0x119101D4, returning 0x0.
11:32:27.1945 [WARNING] sysbus: [U74_1: 0xFFFFFFE00051F27C] (tag: 'GPIO') ReadDoubleWord from non existing peripheral at 0x119101DC, returning 0x0.
11:32:27.1946 [WARNING] sysbus: [U74_1: 0xFFFFFFE00051F27C] (tag: 'GPIO') ReadDoubleWord from non existing peripheral at 0x119101E4, returning 0x0.
11:32:27.1946 [WARNING] sysbus: [U74_1: 0xFFFFFFE00051F27C] (tag: 'GPIO') ReadDoubleWord from non existing peripheral at 0x119101EC, returning 0x0.
11:32:27.1946 [WARNING] sysbus: [U74_1: 0xFFFFFFE00051F27C] (tag: 'GPIO') ReadDoubleWord from non existing peripheral at 0x119101F4, returning 0x0.
11:32:27.1947 [WARNING] sysbus: [U74_1: 0xFFFFFFE00051F27C] (tag: 'GPIO') ReadDoubleWord from non existing peripheral at 0x119101FC, returning 0x0.
11:32:27.1947 [WARNING] sysbus: [U74_1: 0xFFFFFFE00051F27C] (tag: 'GPIO') ReadDoubleWord from non existing peripheral at 0x11910204, returning 0x0.
11:32:27.1947 [WARNING] sysbus: [U74_1: 0xFFFFFFE00051F27C] (tag: 'GPIO') ReadDoubleWord from non existing peripheral at 0x1191020C, returning 0x0.
11:32:27.1948 [WARNING] sysbus: [U74_1: 0xFFFFFFE00051F27C] (tag: 'GPIO') ReadDoubleWord from non existing peripheral at 0x11910214, returning 0x0.
11:32:27.1948 [WARNING] sysbus: [U74_1: 0xFFFFFFE00051F27C] (tag: 'GPIO') ReadDoubleWord from non existing peripheral at 0x1191021C, returning 0x0.
11:32:27.1948 [WARNING] sysbus: [U74_1: 0xFFFFFFE00051F27C] (tag: 'GPIO') ReadDoubleWord from non existing peripheral at 0x11910224, returning 0x0.
11:32:27.1949 [WARNING] sysbus: [U74_1: 0xFFFFFFE00051F27C] (tag: 'GPIO') ReadDoubleWord from non existing peripheral at 0x1191022C, returning 0x0.
11:32:27.1949 [WARNING] sysbus: [U74_1: 0xFFFFFFE00051F27C] (tag: 'GPIO') ReadDoubleWord from non existing peripheral at 0x11910234, returning 0x0.
11:32:27.1950 [WARNING] sysbus: [U74_1: 0xFFFFFFE00051F27C] (tag: 'GPIO') ReadDoubleWord from non existing peripheral at 0x1191023C, returning 0x0.
11:32:27.1950 [WARNING] sysbus: [U74_1: 0xFFFFFFE00051F27C] (tag: 'GPIO') ReadDoubleWord from non existing peripheral at 0x11910244, returning 0x0.
11:32:27.1950 [WARNING] sysbus: [U74_1: 0xFFFFFFE00051F27C] (tag: 'GPIO') ReadDoubleWord from non existing peripheral at 0x1191024C, returning 0x0.
11:32:27.1984 [WARNING] sysbus: [U74_1: 0xFFFFFFE00051FB5C] (tag: 'GPIO') WriteDoubleWord to non existing peripheral at 0x1191002C, value 0x0.
11:32:27.1984 [WARNING] sysbus: [U74_1: 0xFFFFFFE00051FB92] (tag: 'GPIO') WriteDoubleWord to non existing peripheral at 0x11910028, value 0x0.
11:32:27.2001 [WARNING] sysbus: [U74_1: 0xFFFFFFE00051FC10] (tag: 'GPIO') WriteDoubleWord to non existing peripheral at 0x11910000, value 0x1.
11:32:27.2050 [INFO] uart3: [host: 20.45s (+61.85ms)|virt: 6.25s (+11.19ms)] [    1.240158] starfive_gpio 11910000.gpio: SiFive GPIO chip registered 64 GPIOs
11:32:27.2209 [INFO] uart3: [host: 20.47s (+15.95ms)|virt:   6.26s (+2.7ms)] [    1.242895] SCSI subsystem initialized
11:32:27.2298 [INFO] uart3: [host:   20.48s (+8.9ms)|virt:  6.26s (+1.24ms)] [    1.244016] usbcore: registered new interface driver usbfs
11:32:27.2357 [INFO] uart3: [host:  20.48s (+5.93ms)|virt:  6.26s (+0.63ms)] [    1.244630] usbcore: registered new interface driver hub
11:32:27.2411 [INFO] uart3: [host:  20.49s (+5.28ms)|virt:  6.26s (+0.47ms)] [    1.245084] usbcore: registered new device driver usb
11:32:27.2527 [INFO] uart3: [host:  20.5s (+11.71ms)|virt:  6.26s (+1.72ms)] [    1.246644] i2c_designware 118b0000.i2c: Using the static setting value: 49500
11:32:27.2529 [WARNING] sysbus: [U74_1: 0xFFFFFFE0006B11FA] (tag: 'I2C0') ReadDoubleWord from non existing peripheral at 0x118B00FC, returning 0x0.
11:32:27.2579 [INFO] uart3: [host:   20.5s (+5.15ms)|virt:   6.26s (+0.4ms)] [    1.247013] i2c_designware 118b0000.i2c: Unknown Synopsys component type: 0x00000000
11:32:27.2668 [INFO] uart3: [host:   20.51s (+8.9ms)|virt:  6.26s (+1.32ms)] [    1.248378] OF: /soc/i2c@118c0000: could not find phandle
11:32:27.2715 [INFO] uart3: [host:  20.52s (+4.75ms)|virt:  6.26s (+0.38ms)] [    1.248681] i2c_designware 118c0000.i2c: Using 'clocks' : 49500000 / 1000
11:32:27.2717 [WARNING] sysbus: [U74_1: 0xFFFFFFE0006B11FA] (tag: 'I2C1') ReadDoubleWord from non existing peripheral at 0x118C00FC, returning 0x0.
11:32:27.2775 [INFO] uart3: [host:  20.52s (+5.96ms)|virt:   6.26s (+0.4ms)] [    1.249032] i2c_designware 118c0000.i2c: Unknown Synopsys component type: 0x00000000
11:32:27.2839 [INFO] uart3: [host:  20.53s (+6.37ms)|virt:  6.26s (+0.84ms)] [    1.249930] OF: /soc/i2c@12450000: could not find phandle
11:32:27.2885 [INFO] uart3: [host:  20.53s (+4.68ms)|virt:  6.26s (+0.38ms)] [    1.250232] i2c_designware 12450000.i2c: Using 'clocks' : 50000000 / 1000
11:32:27.2887 [WARNING] sysbus: [U74_1: 0xFFFFFFE0006B11FA] (tag: 'I2C1') ReadDoubleWord from non existing peripheral at 0x124500FC, returning 0x0.
11:32:27.2937 [INFO] uart3: [host:  20.54s (+5.21ms)|virt:   6.26s (+0.4ms)] [    1.250584] i2c_designware 12450000.i2c: Unknown Synopsys component type: 0x00000000
11:32:27.3124 [INFO] uart3: [host: 20.56s (+18.62ms)|virt:  6.27s (+3.44ms)] [    1.254063] Bluetooth: Core ver 2.22
11:32:27.3174 [INFO] uart3: [host:     20.56s (+5ms)|virt:  6.27s (+0.48ms)] [    1.254489] NET: Registered protocol family 31
11:32:27.3225 [INFO] uart3: [host:  20.57s (+5.12ms)|virt:  6.27s (+0.33ms)] [    1.254727] Bluetooth: HCI device and connection manager initialized
11:32:27.3259 [INFO] uart3: [host:  20.57s (+3.39ms)|virt:  6.27s (+0.28ms)] [    1.255055] Bluetooth: HCI socket layer initialized
11:32:27.3294 [INFO] uart3: [host:  20.58s (+3.57ms)|virt:  6.27s (+0.29ms)] [    1.255327] Bluetooth: L2CAP socket layer initialized
11:32:27.3331 [INFO] uart3: [host:  20.58s (+3.66ms)|virt:  6.27s (+0.32ms)] [    1.255638] Bluetooth: SCO socket layer initialized
11:32:27.3397 [INFO] uart3: [host:  20.59s (+6.61ms)|virt:  6.27s (+0.76ms)] [    1.256313] clocksource: Switched to clocksource riscv_clocksource
11:32:27.4934 [INFO] uart3: [host:   20.74s (+0.15s)|virt:  6.3s (+30.56ms)] [    1.285723] NET: Registered protocol family 2
11:32:27.5160 [INFO] uart3: [host: 20.76s (+22.61ms)|virt:   6.3s (+3.98ms)] [    1.289366] tcp_listen_portaddr_hash hash table entries: 4096 (order: 5, 163840 bytes, linear)
11:32:27.5257 [INFO] uart3: [host:  20.77s (+9.76ms)|virt:  6.31s (+1.68ms)] [    1.291008] TCP established hash table entries: 65536 (order: 7, 524288 bytes, linear)
11:32:27.5556 [INFO] uart3: [host:   20.8s (+29.8ms)|virt:  6.31s (+7.75ms)] [    1.298469] TCP bind hash table entries: 65536 (order: 9, 2097152 bytes, linear)
11:32:27.6251 [INFO] uart3: [host: 20.87s (+69.55ms)|virt: 6.33s (+19.44ms)] [    1.317161] TCP: Hash tables configured (established 65536 bind 65536)
11:32:27.6314 [INFO] uart3: [host:  20.88s (+6.36ms)|virt:  6.33s (+0.82ms)] [    1.317934] UDP hash table entries: 4096 (order: 6, 393216 bytes, linear)
11:32:27.6456 [INFO] uart3: [host:  20.89s (+14.2ms)|virt:  6.34s (+3.19ms)] [    1.320982] UDP-Lite hash table entries: 4096 (order: 6, 393216 bytes, linear)
11:32:27.6605 [INFO] uart3: [host: 20.91s (+14.87ms)|virt:  6.34s (+3.49ms)] [    1.324450] NET: Registered protocol family 1
11:32:27.6768 [INFO] uart3: [host: 20.92s (+16.27ms)|virt:  6.34s (+2.42ms)] [    1.326709] RPC: Registered named UNIX socket transport module.
11:32:27.6801 [INFO] uart3: [host:  20.93s (+3.29ms)|virt:  6.34s (+0.26ms)] [    1.327005] RPC: Registered udp transport module.
11:32:27.6833 [INFO] uart3: [host:  20.93s (+3.19ms)|virt:  6.34s (+0.26ms)] [    1.327251] RPC: Registered tcp transport module.
11:32:27.6876 [INFO] uart3: [host:  20.93s (+4.32ms)|virt:  6.34s (+0.33ms)] [    1.327499] RPC: Registered tcp NFSv4.1 backchannel transport module.
11:32:27.7174 [INFO] uart3: [host: 20.96s (+29.76ms)|virt:  6.35s (+6.56ms)] [    1.333925] Unpacking initramfs...
11:33:11.8456 [INFO] uart3: [host:  65.09s (+44.13s)|virt: 17.87s (+11.52s)] [   12.395305] Freeing initrd memory: 97280K
11:33:11.8596 [INFO] uart3: [host: 65.11s (+14.02ms)|virt: 17.88s (+2.17ms)] [   12.397374] Initialise system trusted keyrings
11:33:11.8697 [INFO] uart3: [host: 65.12s (+10.12ms)|virt: 17.88s (+1.12ms)] [   12.398370] workingset: timestamp_bits=62 max_order=21 bucket_order=0
11:33:12.1323 [INFO] uart3: [host:   65.38s (+0.26s)|virt: 17.93s (+55.52ms)] [   12.451723] NFS: Registering the id_resolver key type
11:33:12.1356 [INFO] uart3: [host:   65.38s (+3.3ms)|virt:  17.93s (+0.29ms)] [   12.452037] Key type id_resolver registered
11:33:12.1387 [INFO] uart3: [host:  65.38s (+3.05ms)|virt:  17.93s (+0.23ms)] [   12.452262] Key type id_legacy registered
11:33:12.1469 [INFO] uart3: [host:  65.39s (+8.24ms)|virt:  17.93s (+0.93ms)] [   12.453043] nfs4filelayout_init: NFSv4 File Layout Driver Registering...
11:33:12.1504 [INFO] uart3: [host:   65.4s (+3.54ms)|virt:  17.93s (+0.33ms)] [   12.453457] ntfs: driver 2.1.32 [Flags: R/W].
11:33:12.1640 [INFO] uart3: [host: 65.41s (+13.59ms)|virt:  17.94s (+2.51ms)] [   12.455875] fuse: init (API version 7.32)
11:33:13.3469 [INFO] uart3: [host:   66.59s (+1.18s)|virt:   18.31s (+0.38s)] [   12.818643] NET: Registered protocol family 38
11:33:13.3497 [INFO] uart3: [host:   66.6s (+2.91ms)|virt:  18.31s (+0.25ms)] [   12.818896] Key type asymmetric registered
11:33:13.3529 [INFO] uart3: [host:   66.6s (+3.19ms)|virt:  18.31s (+0.26ms)] [   12.819119] Asymmetric key parser 'x509' registered
11:33:13.3585 [INFO] uart3: [host:   66.6s (+5.53ms)|virt:  18.32s (+0.48ms)] [   12.819478] Block layer SCSI generic (bsg) driver version 0.4 loaded (major 251)
11:33:13.3615 [INFO] uart3: [host:  66.61s (+3.01ms)|virt:  18.32s (+0.25ms)] [   12.819834] io scheduler mq-deadline registered
11:33:13.3643 [INFO] uart3: [host:  66.61s (+2.84ms)|virt:  18.32s (+0.23ms)] [   12.820074] io scheduler kyber registered
11:33:13.3756 [INFO] uart3: [host: 66.62s (+11.23ms)|virt:  18.32s (+2.14ms)] [   12.822177] start plist test
11:33:13.5781 [INFO] uart3: [host:    66.82s (+0.2s)|virt: 18.39s (+67.59ms)] [   12.887069] end plist test
11:33:13.6081 [WARNING] sysbus: [U74_1: 0xFFFFFFE00053C464] (tag: 'sgdam2') ReadDoubleWord from non existing peripheral at 0x100B0010, returning 0x0.
11:33:13.6081 [WARNING] sysbus: [U74_1: 0xFFFFFFE00053C478] (tag: 'sgdam2') WriteDoubleWord to non existing peripheral at 0x100B0010, value 0x1.
11:33:13.6081 [WARNING] sysbus: [U74_1: 0xFFFFFFE00053C4A8] (tag: 'sgdam2') ReadDoubleWord from non existing peripheral at 0x100B0010, returning 0x0.
11:33:13.6082 [WARNING] sysbus: [U74_1: 0xFFFFFFE00053C4BC] (tag: 'sgdam2') WriteDoubleWord to non existing peripheral at 0x100B0010, value 0x2.
11:33:13.6082 [WARNING] sysbus: [U74_1: 0xFFFFFFE00053C55E] (tag: 'sgdam2') WriteDoubleWord to non existing peripheral at 0x100B0180, value 0x0.
11:33:13.6083 [WARNING] sysbus: [U74_1: 0xFFFFFFE00053C590] (tag: 'sgdam2') ReadDoubleWord from non existing peripheral at 0x100B0018, returning 0x0.
11:33:13.6083 [WARNING] sysbus: [U74_1: 0xFFFFFFE00053C51C] (tag: 'sgdam2') WriteDoubleWord to non existing peripheral at 0x100B0018, value 0x100.
11:33:13.6083 [WARNING] sysbus: [U74_1: 0xFFFFFFE00053C55E] (tag: 'sgdam2') WriteDoubleWord to non existing peripheral at 0x100B0280, value 0x0.
11:33:13.6084 [WARNING] sysbus: [U74_1: 0xFFFFFFE00053C590] (tag: 'sgdam2') ReadDoubleWord from non existing peripheral at 0x100B0018, returning 0x0.
11:33:13.6084 [WARNING] sysbus: [U74_1: 0xFFFFFFE00053C51C] (tag: 'sgdam2') WriteDoubleWord to non existing peripheral at 0x100B0018, value 0x200.
11:33:13.6084 [WARNING] sysbus: [U74_1: 0xFFFFFFE00053C55E] (tag: 'sgdam2') WriteDoubleWord to non existing peripheral at 0x100B0380, value 0x0.
11:33:13.6085 [WARNING] sysbus: [U74_1: 0xFFFFFFE00053C590] (tag: 'sgdam2') ReadDoubleWord from non existing peripheral at 0x100B0018, returning 0x0.
11:33:13.6085 [WARNING] sysbus: [U74_1: 0xFFFFFFE00053C51C] (tag: 'sgdam2') WriteDoubleWord to non existing peripheral at 0x100B0018, value 0x400.
11:33:13.6085 [WARNING] sysbus: [U74_1: 0xFFFFFFE00053C55E] (tag: 'sgdam2') WriteDoubleWord to non existing peripheral at 0x100B0480, value 0x0.
11:33:13.6086 [WARNING] sysbus: [U74_1: 0xFFFFFFE00053C590] (tag: 'sgdam2') ReadDoubleWord from non existing peripheral at 0x100B0018, returning 0x0.
11:33:13.6086 [WARNING] sysbus: [U74_1: 0xFFFFFFE00053C51C] (tag: 'sgdam2') WriteDoubleWord to non existing peripheral at 0x100B0018, value 0x800.
11:33:13.6196 [INFO] uart3: [host: 66.87s (+41.58ms)|virt:  18.39s (+8.32ms)] [   12.894817] dw_axi_dmac_platform 100b0000.sgdma2p: DesignWare AXI DMA Controller, 4 channels
11:33:13.6268 [WARNING] sysbus: [U74_1: 0xFFFFFFE00053C464] (tag: 'sgdam1') ReadDoubleWord from non existing peripheral at 0x10500010, returning 0x0.
11:33:13.6268 [WARNING] sysbus: [U74_1: 0xFFFFFFE00053C478] (tag: 'sgdam1') WriteDoubleWord to non existing peripheral at 0x10500010, value 0x1.
11:33:13.6269 [WARNING] sysbus: [U74_1: 0xFFFFFFE00053C4A8] (tag: 'sgdam1') ReadDoubleWord from non existing peripheral at 0x10500010, returning 0x0.
11:33:13.6269 [WARNING] sysbus: [U74_1: 0xFFFFFFE00053C4BC] (tag: 'sgdam1') WriteDoubleWord to non existing peripheral at 0x10500010, value 0x2.
11:33:13.6269 [WARNING] sysbus: [U74_1: 0xFFFFFFE00053C55E] (tag: 'sgdam1') WriteDoubleWord to non existing peripheral at 0x10500180, value 0x0.
11:33:13.6270 [WARNING] sysbus: [U74_1: 0xFFFFFFE00053C4EE] (tag: 'sgdam1') ReadDoubleWord from non existing peripheral at 0x10500018, returning 0x0.
11:33:13.6270 [WARNING] sysbus: [U74_1: 0xFFFFFFE00053C51C] (tag: 'sgdam1') WriteDoubleWord to non existing peripheral at 0x10500018, value 0x10000.
11:33:13.6270 [WARNING] sysbus: [U74_1: 0xFFFFFFE00053C55E] (tag: 'sgdam1') WriteDoubleWord to non existing peripheral at 0x10500280, value 0x0.
11:33:13.6271 [WARNING] sysbus: [U74_1: 0xFFFFFFE00053C4EE] (tag: 'sgdam1') ReadDoubleWord from non existing peripheral at 0x10500018, returning 0x0.
11:33:13.6271 [WARNING] sysbus: [U74_1: 0xFFFFFFE00053C51C] (tag: 'sgdam1') WriteDoubleWord to non existing peripheral at 0x10500018, value 0x20000.
11:33:13.6271 [WARNING] sysbus: [U74_1: 0xFFFFFFE00053C55E] (tag: 'sgdam1') WriteDoubleWord to non existing peripheral at 0x10500380, value 0x0.
11:33:13.6272 [WARNING] sysbus: [U74_1: 0xFFFFFFE00053C4EE] (tag: 'sgdam1') ReadDoubleWord from non existing peripheral at 0x10500018, returning 0x0.
11:33:13.6272 [WARNING] sysbus: [U74_1: 0xFFFFFFE00053C51C] (tag: 'sgdam1') WriteDoubleWord to non existing peripheral at 0x10500018, value 0x40000.
11:33:13.6272 [WARNING] sysbus: [U74_1: 0xFFFFFFE00053C55E] (tag: 'sgdam1') WriteDoubleWord to non existing peripheral at 0x10500480, value 0x0.
11:33:13.6273 [WARNING] sysbus: [U74_1: 0xFFFFFFE00053C4EE] (tag: 'sgdam1') ReadDoubleWord from non existing peripheral at 0x10500018, returning 0x0.
11:33:13.6273 [WARNING] sysbus: [U74_1: 0xFFFFFFE00053C51C] (tag: 'sgdam1') WriteDoubleWord to non existing peripheral at 0x10500018, value 0x80000.
11:33:13.6273 [WARNING] sysbus: [U74_1: 0xFFFFFFE00053C55E] (tag: 'sgdam1') WriteDoubleWord to non existing peripheral at 0x10500580, value 0x0.
11:33:13.6274 [WARNING] sysbus: [U74_1: 0xFFFFFFE00053C4EE] (tag: 'sgdam1') ReadDoubleWord from non existing peripheral at 0x10500018, returning 0x0.
11:33:13.6274 [WARNING] sysbus: [U74_1: 0xFFFFFFE00053C51C] (tag: 'sgdam1') WriteDoubleWord to non existing peripheral at 0x10500018, value 0x100000.
11:33:13.6274 [WARNING] sysbus: [U74_1: 0xFFFFFFE00053C55E] (tag: 'sgdam1') WriteDoubleWord to non existing peripheral at 0x10500680, value 0x0.
11:33:13.6275 [WARNING] sysbus: [U74_1: 0xFFFFFFE00053C4EE] (tag: 'sgdam1') ReadDoubleWord from non existing peripheral at 0x10500018, returning 0x0.
11:33:13.6275 [WARNING] sysbus: [U74_1: 0xFFFFFFE00053C51C] (tag: 'sgdam1') WriteDoubleWord to non existing peripheral at 0x10500018, value 0x200000.
11:33:13.6275 [WARNING] sysbus: [U74_1: 0xFFFFFFE00053C55E] (tag: 'sgdam1') WriteDoubleWord to non existing peripheral at 0x10500780, value 0x0.
11:33:13.6276 [WARNING] sysbus: [U74_1: 0xFFFFFFE00053C4EE] (tag: 'sgdam1') ReadDoubleWord from non existing peripheral at 0x10500018, returning 0x0.
11:33:13.6276 [WARNING] sysbus: [U74_1: 0xFFFFFFE00053C51C] (tag: 'sgdam1') WriteDoubleWord to non existing peripheral at 0x10500018, value 0x400000.
11:33:13.6276 [WARNING] sysbus: [U74_1: 0xFFFFFFE00053C55E] (tag: 'sgdam1') WriteDoubleWord to non existing peripheral at 0x10500880, value 0x0.
11:33:13.6277 [WARNING] sysbus: [U74_1: 0xFFFFFFE00053C4EE] (tag: 'sgdam1') ReadDoubleWord from non existing peripheral at 0x10500018, returning 0x0.
11:33:13.6277 [WARNING] sysbus: [U74_1: 0xFFFFFFE00053C51C] (tag: 'sgdam1') WriteDoubleWord to non existing peripheral at 0x10500018, value 0x800000.
11:33:13.6277 [WARNING] sysbus: [U74_1: 0xFFFFFFE00053C55E] (tag: 'sgdam1') WriteDoubleWord to non existing peripheral at 0x10500980, value 0x0.
11:33:13.6277 [WARNING] sysbus: [U74_1: 0xFFFFFFE00053C4EE] (tag: 'sgdam1') ReadDoubleWord from non existing peripheral at 0x10500018, returning 0x0.
11:33:13.6278 [WARNING] sysbus: [U74_1: 0xFFFFFFE00053C51C] (tag: 'sgdam1') WriteDoubleWord to non existing peripheral at 0x10500018, value 0x1000000.
11:33:13.6278 [WARNING] sysbus: [U74_1: 0xFFFFFFE00053C55E] (tag: 'sgdam1') WriteDoubleWord to non existing peripheral at 0x10500A80, value 0x0.
11:33:13.6278 [WARNING] sysbus: [U74_1: 0xFFFFFFE00053C4EE] (tag: 'sgdam1') ReadDoubleWord from non existing peripheral at 0x10500018, returning 0x0.
11:33:13.6279 [WARNING] sysbus: [U74_1: 0xFFFFFFE00053C51C] (tag: 'sgdam1') WriteDoubleWord to non existing peripheral at 0x10500018, value 0x2000000.
11:33:13.6279 [WARNING] sysbus: [U74_1: 0xFFFFFFE00053C55E] (tag: 'sgdam1') WriteDoubleWord to non existing peripheral at 0x10500B80, value 0x0.
11:33:13.6279 [WARNING] sysbus: [U74_1: 0xFFFFFFE00053C4EE] (tag: 'sgdam1') ReadDoubleWord from non existing peripheral at 0x10500018, returning 0x0.
11:33:13.6280 [WARNING] sysbus: [U74_1: 0xFFFFFFE00053C51C] (tag: 'sgdam1') WriteDoubleWord to non existing peripheral at 0x10500018, value 0x4000000.
11:33:13.6280 [WARNING] sysbus: [U74_1: 0xFFFFFFE00053C55E] (tag: 'sgdam1') WriteDoubleWord to non existing peripheral at 0x10500C80, value 0x0.
11:33:13.6280 [WARNING] sysbus: [U74_1: 0xFFFFFFE00053C4EE] (tag: 'sgdam1') ReadDoubleWord from non existing peripheral at 0x10500018, returning 0x0.
11:33:13.6281 [WARNING] sysbus: [U74_1: 0xFFFFFFE00053C51C] (tag: 'sgdam1') WriteDoubleWord to non existing peripheral at 0x10500018, value 0x8000000.
11:33:13.6281 [WARNING] sysbus: [U74_1: 0xFFFFFFE00053C55E] (tag: 'sgdam1') WriteDoubleWord to non existing peripheral at 0x10500D80, value 0x0.
11:33:13.6281 [WARNING] sysbus: [U74_1: 0xFFFFFFE00053C4EE] (tag: 'sgdam1') ReadDoubleWord from non existing peripheral at 0x10500018, returning 0x0.
11:33:13.6282 [WARNING] sysbus: [U74_1: 0xFFFFFFE00053C51C] (tag: 'sgdam1') WriteDoubleWord to non existing peripheral at 0x10500018, value 0x10000000.
11:33:13.6282 [WARNING] sysbus: [U74_1: 0xFFFFFFE00053C55E] (tag: 'sgdam1') WriteDoubleWord to non existing peripheral at 0x10500E80, value 0x0.
11:33:13.6282 [WARNING] sysbus: [U74_1: 0xFFFFFFE00053C4EE] (tag: 'sgdam1') ReadDoubleWord from non existing peripheral at 0x10500018, returning 0x0.
11:33:13.6283 [WARNING] sysbus: [U74_1: 0xFFFFFFE00053C51C] (tag: 'sgdam1') WriteDoubleWord to non existing peripheral at 0x10500018, value 0x20000000.
11:33:13.6283 [WARNING] sysbus: [U74_1: 0xFFFFFFE00053C55E] (tag: 'sgdam1') WriteDoubleWord to non existing peripheral at 0x10500F80, value 0x0.
11:33:13.6283 [WARNING] sysbus: [U74_1: 0xFFFFFFE00053C4EE] (tag: 'sgdam1') ReadDoubleWord from non existing peripheral at 0x10500018, returning 0x0.
11:33:13.6284 [WARNING] sysbus: [U74_1: 0xFFFFFFE00053C51C] (tag: 'sgdam1') WriteDoubleWord to non existing peripheral at 0x10500018, value 0x40000000.
11:33:13.6284 [WARNING] sysbus: [U74_1: 0xFFFFFFE00053C55E] (tag: 'sgdam1') WriteDoubleWord to non existing peripheral at 0x10501080, value 0x0.
11:33:13.6285 [WARNING] sysbus: [U74_1: 0xFFFFFFE00053C4EE] (tag: 'sgdam1') ReadDoubleWord from non existing peripheral at 0x10500018, returning 0x0.
11:33:13.6286 [WARNING] sysbus: [U74_1: 0xFFFFFFE00053C51C] (tag: 'sgdam1') WriteDoubleWord to non existing peripheral at 0x10500018, value 0x80000000.
11:33:13.6547 [INFO] uart3: [host:  66.9s (+35.07ms)|virt:   18.4s (+5.91ms)] [   12.900483] dw_axi_dmac_platform 10500000.sgdma1p: DesignWare AXI DMA Controller, 16 channels
11:33:13.6659 [INFO] uart3: [host: 66.91s (+11.21ms)|virt:   18.4s (+1.78ms)] [   12.902356] L2CACHE: No. of Banks in the cache: 0
11:33:13.6689 [INFO] uart3: [host:  66.91s (+2.98ms)|virt:   18.4s (+0.24ms)] [   12.902600] L2CACHE: No. of ways per bank: 0
11:33:13.6715 [INFO] uart3: [host:   66.92s (+2.6ms)|virt:   18.4s (+0.21ms)] [   12.902825] L2CACHE: Sets per bank: 1
11:33:13.6744 [INFO] uart3: [host:  66.92s (+2.97ms)|virt:   18.4s (+0.24ms)] [   12.903027] L2CACHE: Bytes per cache block: 1
11:33:13.6790 [INFO] uart3: [host:  66.93s (+4.58ms)|virt:   18.4s (+0.28ms)] [   12.903259] L2CACHE: Index of the largest way enabled: 0
11:33:14.6220 [INFO] uart3: [host:   67.87s (+0.94s)|virt:   18.58s (+0.18s)] [   13.075933] Serial: 8250/16550 driver, 4 ports, IRQ sharing disabled
11:33:14.6419 [WARNING] uart3: Unhandled read from offset 0xF8.
11:33:14.6539 [INFO] uart3: [host:  67.9s (+31.96ms)|virt:  18.59s (+5.87ms)] [   13.081656] printk: console [ttyS0] disabled
11:33:14.7207 [INFO] uart3: [host: 67.97s (+66.81ms)|virt:  18.59s (+3.79ms)] [   13.085106] 12440000.serial: ttyS0 at MMIO 0x12440000 (irq = 6, base_baud = 6250000) is a 16550A
11:33:14.7620 [INFO] uart3: [host: 68.01s (+41.21ms)|virt:  18.59s (+2.19ms)] [   13.087548] printk: console [ttyS0] enabled
11:33:14.7646 [INFO] uart3: [host:  68.01s (+2.62ms)|virt:  18.59s (+0.21ms)] [   13.087548] printk: console [ttyS0] enabled
11:33:14.7657 [INFO] uart3: [host:  68.01s (+1.14ms)|virt:    18.59s (+92µs)] [   13.087826] printk: bootconsole [sbi0] disabled
11:33:14.7685 [INFO] uart3: [host:  68.01s (+2.77ms)|virt:  18.59s (+0.22ms)] [   13.087826] printk: bootconsole [sbi0] disabled
11:33:14.7778 [WARNING] uart1: Unhandled read from offset 0xF8.
11:33:14.8456 [INFO] uart3: [host:  68.09s (+77.1ms)|virt:   18.6s (+7.28ms)] [   13.095013] 11880000.hs_serial: ttyS1 at MMIO 0x11880000 (irq = 8, base_baud = 4640625) is a 16550A
11:33:14.8550 [WARNING] uart0: Unhandled read from offset 0xF8.
11:33:14.9225 [INFO] uart3: [host: 68.17s (+76.92ms)|virt:   18.61s (+7.1ms)] [   13.101813] 11870000.hs_serial: ttyS2 at MMIO 0x11870000 (irq = 10, base_baud = 4640625) is a 16550A
11:33:14.9562 [WARNING] sysbus: [U74_1: 0xFFFFFFE00056D7DC] (tag: 'TRNG') ReadDoubleWord from non existing peripheral at 0x118D0014, returning 0x0.
11:33:14.9562 [WARNING] sysbus: [U74_1: 0xFFFFFFE00056D7EC] (tag: 'TRNG') WriteDoubleWord to non existing peripheral at 0x118D0014, value 0x0.
11:33:14.9562 [WARNING] sysbus: [U74_1: 0xFFFFFFE00056D822] (tag: 'TRNG') WriteDoubleWord to non existing peripheral at 0x118D0018, value 0x0.
11:33:14.9563 [WARNING] sysbus: [U74_1: 0xFFFFFFE00056D84A] (tag: 'TRNG') WriteDoubleWord to non existing peripheral at 0x118D0008, value 0x2.
11:33:14.9563 [WARNING] sysbus: [U74_1: 0xFFFFFFE00056D86A] (tag: 'TRNG') ReadDoubleWord from non existing peripheral at 0x118D000C, returning 0x0.
11:33:14.9563 [WARNING] sysbus: [U74_1: 0xFFFFFFE00056D880] (tag: 'TRNG') WriteDoubleWord to non existing peripheral at 0x118D0000, value 0x1.
11:33:14.9564 [WARNING] sysbus: [U74_1: 0xFFFFFFE00056D8A0] (tag: 'TRNG') ReadDoubleWord from non existing peripheral at 0x118D000C, returning 0x0.
11:33:14.9564 [WARNING] sysbus: [U74_1: 0xFFFFFFE00056D8BE] (tag: 'TRNG') WriteDoubleWord to non existing peripheral at 0x118D0010, value 0x8000001F.
11:33:14.9564 [WARNING] sysbus: [U74_1: 0xFFFFFFE00056D8DE] (tag: 'TRNG') ReadDoubleWord from non existing peripheral at 0x118D000C, returning 0x0.
11:33:14.9565 [WARNING] sysbus: [U74_1: 0xFFFFFFE00056D8F4] (tag: 'TRNG') WriteDoubleWord to non existing peripheral at 0x118D0000, value 0xF.
11:33:14.9565 [WARNING] sysbus: [U74_1: 0xFFFFFFE00056D912] (tag: 'TRNG') ReadDoubleWord from non existing peripheral at 0x118D000C, returning 0x0.
11:33:14.9565 [WARNING] sysbus: [U74_1: 0xFFFFFFE00056D942] (tag: 'TRNG') ReadDoubleWord from non existing peripheral at 0x118D000C, returning 0x0.
11:33:14.9566 [WARNING] sysbus: [U74_1: 0xFFFFFFE00056D958] (tag: 'TRNG') WriteDoubleWord to non existing peripheral at 0x118D0000, value 0xF.
11:33:14.9566 [WARNING] sysbus: [U74_1: 0xFFFFFFE00056D988] (tag: 'TRNG') ReadDoubleWord from non existing peripheral at 0x118D000C, returning 0x0.
11:33:14.9566 [WARNING] sysbus: [U74_1: 0xFFFFFFE00056D99E] (tag: 'TRNG') WriteDoubleWord to non existing peripheral at 0x118D0000, value 0x1.
11:33:14.9567 [WARNING] sysbus: [U74_1: 0xFFFFFFE00056D9BE] (tag: 'TRNG') ReadDoubleWord from non existing peripheral at 0x118D000C, returning 0x0.
11:33:14.9567 [WARNING] sysbus: [U74_1: 0xFFFFFFE00056D9D4] (tag: 'TRNG') WriteDoubleWord to non existing peripheral at 0x118D0000, value 0x3.
11:33:14.9567 [WARNING] sysbus: [U74_1: 0xFFFFFFE00056D9F4] (tag: 'TRNG') ReadDoubleWord from non existing peripheral at 0x118D000C, returning 0x0.
11:33:14.9568 [WARNING] sysbus: [U74_1: 0xFFFFFFE00056DA16] (tag: 'TRNG') WriteDoubleWord to non existing peripheral at 0x118D0004, value 0x0.
11:33:14.9568 [WARNING] sysbus: [U74_1: 0xFFFFFFE00056DA36] (tag: 'TRNG') ReadDoubleWord from non existing peripheral at 0x118D000C, returning 0x0.
11:33:14.9568 [WARNING] sysbus: [U74_1: 0xFFFFFFE00056DA4C] (tag: 'TRNG') WriteDoubleWord to non existing peripheral at 0x118D0000, value 0x6.
11:33:14.9569 [WARNING] sysbus: [U74_1: 0xFFFFFFE00056DA6C] (tag: 'TRNG') ReadDoubleWord from non existing peripheral at 0x118D000C, returning 0x0.
11:33:14.9569 [WARNING] sysbus: [U74_1: 0xFFFFFFE000514368] (tag: 'TRNG') ReadDoubleWord from non existing peripheral at 0x118D0024, returning 0x0.
11:33:14.9569 [WARNING] sysbus: [U74_1: 0xFFFFFFE000514368] (tag: 'TRNG') ReadDoubleWord from non existing peripheral at 0x118D0028, returning 0x0.
11:33:14.9570 [WARNING] sysbus: [U74_1: 0xFFFFFFE000514368] (tag: 'TRNG') ReadDoubleWord from non existing peripheral at 0x118D002C, returning 0x0.
11:33:14.9570 [WARNING] sysbus: [U74_1: 0xFFFFFFE000514368] (tag: 'TRNG') ReadDoubleWord from non existing peripheral at 0x118D0030, returning 0x0.
11:33:14.9570 [WARNING] sysbus: [U74_1: 0xFFFFFFE00056DA8C] (tag: 'TRNG') ReadDoubleWord from non existing peripheral at 0x118D000C, returning 0x0.
11:33:14.9571 [WARNING] sysbus: [U74_1: 0xFFFFFFE00056DAA2] (tag: 'TRNG') WriteDoubleWord to non existing peripheral at 0x118D0000, value 0xF.
11:33:14.9571 [WARNING] sysbus: [U74_1: 0xFFFFFFE00056DAC2] (tag: 'TRNG') ReadDoubleWord from non existing peripheral at 0x118D000C, returning 0x0.
11:33:14.9584 [INFO] uart3: [host:  68.2s (+35.89ms)|virt:   18.62s (+7.2ms)] [   13.108724] vic-rng 118d0000.trng: Initialized
11:33:15.1473 [INFO] uart3: [host:   68.39s (+0.19s)|virt:  18.66s (+40.5ms)] [   13.147663] loop: module loaded
11:33:15.1686 [INFO] uart3: [host:  68.41s (+21.3ms)|virt:  18.66s (+4.51ms)] [   13.152011] libphy: Fixed MDIO Bus: probed
11:33:15.2027 [INFO] uart3: [host: 68.45s (+34.08ms)|virt:  18.67s (+7.19ms)] [   13.158837] stmmaceth 10020000.gmac: IRQ eth_lpi not found
11:33:15.2061 [INFO] uart3: [host:  68.45s (+3.49ms)|virt:   18.67s (+0.6ms)] [   13.159360] stmmaceth 10020000.gmac: force_sf_dma_mode is ignored if force_thresh_dma_mode is set.
11:33:15.2079 [INFO] uart3: [host:  68.45s (+1.79ms)|virt:   18.67s (+0.2ms)] [   13.159672] stmmaceth 10020000.gmac: PTP uses main clock
11:33:15.2092 [INFO] uart3: [host:  68.46s (+1.34ms)|virt:   18.67s (+0.2ms)] [   13.159817] stmmaceth 10020000.gmac: no reset control found
11:33:15.2120 [WARNING] ethernet: Unhandled read from offset 0x20.
11:33:15.2132 [INFO] uart3: [host:  68.46s (+3.94ms)|virt:   18.67s (+0.6ms)] [   13.160417] stmmaceth 10020000.gmac: Version ID not available
11:33:15.2144 [INFO] uart3: [host:   68.46s (+1.2ms)|virt:   18.67s (+0.2ms)] [   13.160564] stmmaceth 10020000.gmac: DWMAC1000
11:33:15.2145 [WARNING] ethernet: Unhandled read from offset 0x1058.
11:33:15.2159 [INFO] uart3: [host:  68.46s (+1.49ms)|virt:   18.67s (+0.1ms)] [   13.160694] stmmaceth 10020000.gmac: DMA HW capability register supported
11:33:15.2172 [INFO] uart3: [host:  68.46s (+1.28ms)|virt:   18.67s (+0.2ms)] [   13.160849] stmmaceth 10020000.gmac: Normal descriptors
11:33:15.2183 [INFO] uart3: [host:  68.46s (+1.13ms)|virt:   18.67s (+0.1ms)] [   13.160983] stmmaceth 10020000.gmac: Ring mode enabled
11:33:15.2198 [INFO] uart3: [host:  68.47s (+1.53ms)|virt:   18.67s (+0.2ms)] [   13.161124] stmmaceth 10020000.gmac: device MAC address 66:34:b0:6c:de:ad
11:33:15.2320 [WARNING] ethernet: Access to unknown phy 0 (3)
11:33:15.3672 [WARNING] ethernet: Access to unknown phy 1 (2)
11:33:15.4462 [WARNING] ethernet: Access to unknown phy 2 (2)
11:33:15.5333 [WARNING] ethernet: Access to unknown phy 3 (2)
11:33:15.6212 [WARNING] ethernet: Access to unknown phy 4 (2)
11:33:15.6998 [WARNING] ethernet: Access to unknown phy 5 (2)
11:33:15.7841 [WARNING] ethernet: Access to unknown phy 6 (2)
11:33:15.9507 [WARNING] ethernet: Access to unknown phy 8 (2)
11:33:16.0343 [WARNING] ethernet: Access to unknown phy 9 (2)
11:33:16.1234 [WARNING] ethernet: Access to unknown phy 10 (2)
11:33:16.2112 [WARNING] ethernet: Access to unknown phy 11 (2)
11:33:16.2957 [WARNING] ethernet: Access to unknown phy 12 (2)
11:33:16.3761 [WARNING] ethernet: Access to unknown phy 13 (2)
11:33:16.4544 [WARNING] ethernet: Access to unknown phy 14 (2)
11:33:16.5403 [WARNING] ethernet: Access to unknown phy 15 (2)
11:33:16.6257 [WARNING] ethernet: Access to unknown phy 16 (2)
11:33:16.7172 [WARNING] ethernet: Access to unknown phy 17 (2)
11:33:16.8036 [WARNING] ethernet: Access to unknown phy 18 (2)
11:33:16.8870 [WARNING] ethernet: Access to unknown phy 19 (2)
11:33:16.9755 [WARNING] ethernet: Access to unknown phy 20 (2)
11:33:17.0649 [WARNING] ethernet: Access to unknown phy 21 (2)
11:33:17.1533 [WARNING] ethernet: Access to unknown phy 22 (2)
11:33:17.2324 [WARNING] ethernet: Access to unknown phy 23 (2)
11:33:17.3170 [WARNING] ethernet: Access to unknown phy 24 (2)
11:33:17.4052 [WARNING] ethernet: Access to unknown phy 25 (2)
11:33:17.4862 [WARNING] ethernet: Access to unknown phy 26 (2)
11:33:17.5708 [WARNING] ethernet: Access to unknown phy 27 (2)
11:33:17.6518 [WARNING] ethernet: Access to unknown phy 28 (2)
11:33:17.7325 [WARNING] ethernet: Access to unknown phy 29 (2)
11:33:17.8137 [WARNING] ethernet: Access to unknown phy 30 (2)
11:33:17.8932 [WARNING] ethernet: Access to unknown phy 31 (2)
11:33:17.9779 [INFO] uart3: [host:   71.22s (+2.76s)|virt:   19.02s (+0.34s)] [   13.491520] libphy: stmmac: probed
11:33:17.9798 [INFO] uart3: [host:  71.23s (+1.93ms)|virt:   19.02s (+0.2ms)] [   13.491649] mdio_bus stmmac-0:00: attached PHY driver [unbound] (mii_bus:phy_addr=stmmac-0:00, irq=POLL)
11:33:17.9818 [INFO] uart3: [host:  71.23s (+1.91ms)|virt:   19.02s (+0.2ms)] [   13.491854] mdio_bus stmmac-0:01: attached PHY driver [unbound] (mii_bus:phy_addr=stmmac-0:01, irq=POLL)
11:33:17.9837 [INFO] uart3: [host:  71.23s (+1.95ms)|virt:   19.02s (+0.2ms)] [   13.492058] mdio_bus stmmac-0:02: attached PHY driver [unbound] (mii_bus:phy_addr=stmmac-0:02, irq=POLL)
11:33:17.9856 [INFO] uart3: [host:  71.23s (+1.87ms)|virt:   19.02s (+0.2ms)] [   13.492263] mdio_bus stmmac-0:03: attached PHY driver [unbound] (mii_bus:phy_addr=stmmac-0:03, irq=POLL)
11:33:17.9875 [INFO] uart3: [host:   71.23s (+1.9ms)|virt:   19.02s (+0.3ms)] [   13.492468] mdio_bus stmmac-0:04: attached PHY driver [unbound] (mii_bus:phy_addr=stmmac-0:04, irq=POLL)
11:33:17.9894 [INFO] uart3: [host:  71.24s (+1.88ms)|virt:   19.02s (+0.2ms)] [   13.492672] mdio_bus stmmac-0:05: attached PHY driver [unbound] (mii_bus:phy_addr=stmmac-0:05, irq=POLL)
11:33:17.9912 [INFO] uart3: [host:  71.24s (+1.89ms)|virt:   19.02s (+0.2ms)] [   13.492877] mdio_bus stmmac-0:06: attached PHY driver [unbound] (mii_bus:phy_addr=stmmac-0:06, irq=POLL)
11:33:17.9936 [INFO] uart3: [host:  71.24s (+2.35ms)|virt:   19.02s (+0.2ms)] [   13.493083] Micrel KSZ9031 Gigabit PHY stmmac-0:07: attached PHY driver [Micrel KSZ9031 Gigabit PHY] (mii_bus:phy_addr=stmmac-0:07, irq=POLL)
11:33:17.9956 [INFO] uart3: [host:  71.24s (+1.97ms)|virt:   19.02s (+0.3ms)] [   13.493327] mdio_bus stmmac-0:08: attached PHY driver [unbound] (mii_bus:phy_addr=stmmac-0:08, irq=POLL)
11:33:17.9975 [INFO] uart3: [host:  71.24s (+1.89ms)|virt:   19.02s (+0.2ms)] [   13.493532] mdio_bus stmmac-0:09: attached PHY driver [unbound] (mii_bus:phy_addr=stmmac-0:09, irq=POLL)
11:33:17.9994 [INFO] uart3: [host:  71.25s (+1.92ms)|virt:   19.02s (+0.2ms)] [   13.493736] mdio_bus stmmac-0:0a: attached PHY driver [unbound] (mii_bus:phy_addr=stmmac-0:0a, irq=POLL)
11:33:18.0013 [INFO] uart3: [host:   71.25s (+1.9ms)|virt:   19.02s (+0.2ms)] [   13.493941] mdio_bus stmmac-0:0b: attached PHY driver [unbound] (mii_bus:phy_addr=stmmac-0:0b, irq=POLL)
11:33:18.0037 [INFO] uart3: [host:  71.25s (+2.43ms)|virt:   19.02s (+0.2ms)] [   13.494146] mdio_bus stmmac-0:0c: attached PHY driver [unbound] (mii_bus:phy_addr=stmmac-0:0c, irq=POLL)
11:33:18.0056 [INFO] uart3: [host:  71.25s (+1.89ms)|virt:   19.02s (+0.2ms)] [   13.494351] mdio_bus stmmac-0:0d: attached PHY driver [unbound] (mii_bus:phy_addr=stmmac-0:0d, irq=POLL)
11:33:18.0075 [INFO] uart3: [host:  71.25s (+1.87ms)|virt:   19.02s (+0.2ms)] [   13.494555] mdio_bus stmmac-0:0e: attached PHY driver [unbound] (mii_bus:phy_addr=stmmac-0:0e, irq=POLL)
11:33:18.0094 [INFO] uart3: [host:  71.26s (+1.91ms)|virt:   19.02s (+0.2ms)] [   13.494760] mdio_bus stmmac-0:0f: attached PHY driver [unbound] (mii_bus:phy_addr=stmmac-0:0f, irq=POLL)
11:33:18.0114 [INFO] uart3: [host:     71.26s (+2ms)|virt:   19.02s (+0.3ms)] [   13.494964] mdio_bus stmmac-0:10: attached PHY driver [unbound] (mii_bus:phy_addr=stmmac-0:10, irq=POLL)
11:33:18.0134 [INFO] uart3: [host:  71.26s (+1.97ms)|virt:   19.02s (+0.2ms)] [   13.495168] mdio_bus stmmac-0:11: attached PHY driver [unbound] (mii_bus:phy_addr=stmmac-0:11, irq=POLL)
11:33:18.0165 [INFO] uart3: [host:  71.26s (+3.14ms)|virt:   19.02s (+0.2ms)] [   13.495374] mdio_bus stmmac-0:12: attached PHY driver [unbound] (mii_bus:phy_addr=stmmac-0:12, irq=POLL)
11:33:18.0188 [INFO] uart3: [host:  71.26s (+2.22ms)|virt:   19.02s (+0.2ms)] [   13.495578] mdio_bus stmmac-0:13: attached PHY driver [unbound] (mii_bus:phy_addr=stmmac-0:13, irq=POLL)
11:33:18.0210 [INFO] uart3: [host:  71.27s (+2.28ms)|virt:   19.02s (+0.2ms)] [   13.495783] mdio_bus stmmac-0:14: attached PHY driver [unbound] (mii_bus:phy_addr=stmmac-0:14, irq=POLL)
11:33:18.0231 [INFO] uart3: [host:  71.27s (+2.04ms)|virt:   19.02s (+0.2ms)] [   13.495987] mdio_bus stmmac-0:15: attached PHY driver [unbound] (mii_bus:phy_addr=stmmac-0:15, irq=POLL)
11:33:18.0260 [INFO] uart3: [host:  71.27s (+2.97ms)|virt:   19.02s (+0.3ms)] [   13.496297] mdio_bus stmmac-0:16: attached PHY driver [unbound] (mii_bus:phy_addr=stmmac-0:16, irq=POLL)
11:33:18.0280 [INFO] uart3: [host:  71.27s (+1.94ms)|virt:   19.02s (+0.3ms)] [   13.496503] mdio_bus stmmac-0:17: attached PHY driver [unbound] (mii_bus:phy_addr=stmmac-0:17, irq=POLL)
11:33:18.0298 [INFO] uart3: [host:  71.28s (+1.84ms)|virt:   19.02s (+0.2ms)] [   13.496707] mdio_bus stmmac-0:18: attached PHY driver [unbound] (mii_bus:phy_addr=stmmac-0:18, irq=POLL)
11:33:18.0317 [INFO] uart3: [host:  71.28s (+1.86ms)|virt:   19.02s (+0.2ms)] [   13.496912] mdio_bus stmmac-0:19: attached PHY driver [unbound] (mii_bus:phy_addr=stmmac-0:19, irq=POLL)
11:33:18.0335 [INFO] uart3: [host:  71.28s (+1.86ms)|virt:   19.02s (+0.2ms)] [   13.497116] mdio_bus stmmac-0:1a: attached PHY driver [unbound] (mii_bus:phy_addr=stmmac-0:1a, irq=POLL)
11:33:18.0354 [INFO] uart3: [host:  71.28s (+1.84ms)|virt:   19.02s (+0.2ms)] [   13.497320] mdio_bus stmmac-0:1b: attached PHY driver [unbound] (mii_bus:phy_addr=stmmac-0:1b, irq=POLL)
11:33:18.0372 [INFO] uart3: [host:  71.28s (+1.83ms)|virt:   19.02s (+0.2ms)] [   13.497525] mdio_bus stmmac-0:1c: attached PHY driver [unbound] (mii_bus:phy_addr=stmmac-0:1c, irq=POLL)
11:33:18.0390 [INFO] uart3: [host:  71.29s (+1.83ms)|virt:   19.02s (+0.2ms)] [   13.497730] mdio_bus stmmac-0:1d: attached PHY driver [unbound] (mii_bus:phy_addr=stmmac-0:1d, irq=POLL)
11:33:18.0409 [INFO] uart3: [host:   71.29s (+1.9ms)|virt:   19.02s (+0.3ms)] [   13.497935] mdio_bus stmmac-0:1e: attached PHY driver [unbound] (mii_bus:phy_addr=stmmac-0:1e, irq=POLL)
11:33:18.0427 [INFO] uart3: [host:   71.29s (+1.8ms)|virt:   19.02s (+0.2ms)] [   13.498139] mdio_bus stmmac-0:1f: attached PHY driver [unbound] (mii_bus:phy_addr=stmmac-0:1f, irq=POLL)
11:33:18.0742 [WARNING] sysbus: [U74_1: 0xFFFFFFE000688766] (tag: 'USB30') ReadDoubleWord from non existing peripheral at 0x104C0000, returning 0x0.
11:33:18.0743 [WARNING] sysbus: [U74_1: 0xFFFFFFE00068878E] (tag: 'USB30') WriteDoubleWord to non existing peripheral at 0x104C0040, value 0x1.
11:33:18.0743 [WARNING] sysbus: [U74_1: 0xFFFFFFE0006887BC] (tag: 'USB30') ReadDoubleWord from non existing peripheral at 0x104C0004, returning 0x0.
11:33:18.0784 [WARNING] sysbus: [U74_1: 0xFFFFFFE00068880C] (tag: 'USB30') ReadDoubleWord from non existing peripheral at 0x104C0004, returning 0x0.
11:33:18.0786 [WARNING] sysbus: [U74_1: 0xFFFFFFE000688374] (tag: 'USB30') WriteDoubleWord to non existing peripheral at 0x104C0000, value 0xA.
11:33:18.0787 [WARNING] sysbus: [U74_1: 0xFFFFFFE0006883B6] (tag: 'USB30') ReadDoubleWord from non existing peripheral at 0x104C0004, returning 0x0.
11:33:23.8943 [WARNING] sysbus: [U74_1: 0xFFFFFFE0006883E4] (tag: 'USB30') ReadDoubleWord from non existing peripheral at 0x104C0004, returning 0x0. (51831)
11:33:23.8943 [WARNING] sysbus: [U74_1: 0xFFFFFFE000688406] (tag: 'USB30') ReadDoubleWord from non existing peripheral at 0x104C0004, returning 0x0.
11:33:23.8957 [INFO] uart3: [host:   77.14s (+5.85s)|virt:   19.13s (+0.11s)] [   13.605408] cdns-usb3 104c0000.usb: timeout waiting for xhci_ready
11:33:23.9105 [INFO] uart3: [host: 77.16s (+14.84ms)|virt:   19.14s (+3.1ms)] [   13.608430] xhci-hcd xhci-hcd.0.auto: xHCI Host Controller
11:33:23.9125 [INFO] uart3: [host:  77.16s (+1.98ms)|virt:   19.14s (+0.3ms)] [   13.608640] xhci-hcd xhci-hcd.0.auto: new USB bus registered, assigned bus number 1
11:33:23.9127 [WARNING] sysbus: [U74_1: 0xFFFFFFE00068A7A2] (tag: 'USB30') ReadDoubleWord from non existing peripheral at 0x104D0000, returning 0x0.
11:33:23.9128 [WARNING] sysbus: [U74_1: 0xFFFFFFE00068A7BC] (tag: 'USB30') ReadDoubleWord from non existing peripheral at 0x104D0018, returning 0x0.
11:33:23.9128 [WARNING] sysbus: [U74_1: 0xFFFFFFE00068A7D6] (tag: 'USB30') ReadDoubleWord from non existing peripheral at 0x104D0004, returning 0x0.
11:33:23.9128 [WARNING] sysbus: [U74_1: 0xFFFFFFE00068A7E6] (tag: 'USB30') ReadDoubleWord from non existing peripheral at 0x104D0008, returning 0x0.
11:33:23.9129 [WARNING] sysbus: [U74_1: 0xFFFFFFE00068A7F6] (tag: 'USB30') ReadDoubleWord from non existing peripheral at 0x104D000C, returning 0x0.
11:33:23.9129 [WARNING] sysbus: [U74_1: 0xFFFFFFE00068A804] (tag: 'USB30') ReadDoubleWord from non existing peripheral at 0x104D0000, returning 0x0.
11:33:23.9129 [WARNING] sysbus: [U74_1: 0xFFFFFFE00068A81C] (tag: 'USB30') ReadDoubleWord from non existing peripheral at 0x104D0010, returning 0x0.
11:33:23.9130 [WARNING] sysbus: [U74_1: 0xFFFFFFE00068A1B0] (tag: 'USB30') ReadDoubleWord from non existing peripheral at 0x104D0004, returning 0x0.
11:33:23.9130 [WARNING] sysbus: [U74_1: 0xFFFFFFE00068A1B8] (tag: 'USB30') ReadDoubleWord from non existing peripheral at 0x104D0000, returning 0x0.
11:33:23.9130 [WARNING] sysbus: [U74_1: 0xFFFFFFE00068A1CC] (tag: 'USB30') WriteDoubleWord to non existing peripheral at 0x104D0000, value 0x0.
11:33:23.9131 [WARNING] sysbus: [U74_1: 0xFFFFFFE00068A0A4] (tag: 'USB30') ReadDoubleWord from non existing peripheral at 0x104D0004, returning 0x0.
11:33:24.8681 [WARNING] sysbus: [U74_1: 0xFFFFFFE00068A0DA] (tag: 'USB30') ReadDoubleWord from non existing peripheral at 0x104D0004, returning 0x0. (8312)
11:33:24.8682 [WARNING] sysbus: [U74_1: 0xFFFFFFE00068A0F6] (tag: 'USB30') ReadDoubleWord from non existing peripheral at 0x104D0004, returning 0x0.
11:33:24.8697 [INFO] uart3: [host:   78.12s (+0.96s)|virt:  19.15s (+16.8ms)] [   13.624834] xhci-hcd xhci-hcd.0.auto: Host halt failed, -110
11:33:24.8708 [INFO] uart3: [host:  78.12s (+1.17ms)|virt:   19.15s (+0.1ms)] [   13.624976] xhci-hcd xhci-hcd.0.auto: can't setup: -110
11:33:24.8722 [INFO] uart3: [host:  78.12s (+1.33ms)|virt:   19.15s (+0.2ms)] [   13.625120] xhci-hcd xhci-hcd.0.auto: USB bus 1 deregistered
11:33:24.8757 [INFO] uart3: [host:  78.12s (+3.57ms)|virt:   19.15s (+0.5ms)] [   13.625613] xhci-hcd: probe of xhci-hcd.0.auto failed with error -110
11:33:24.8814 [INFO] uart3: [host:  78.13s (+5.62ms)|virt:   19.16s (+0.9ms)] [   13.626467] usbcore: registered new interface driver uas
11:33:24.8838 [INFO] uart3: [host:  78.13s (+2.43ms)|virt:   19.16s (+0.4ms)] [   13.626817] usbcore: registered new interface driver usb-storage
11:33:24.8868 [INFO] uart3: [host:  78.13s (+3.04ms)|virt:  19.16s (+0.51ms)] [   13.627395] i2c /dev entries driver
11:33:24.8924 [INFO] uart3: [host:   78.14s (+5.6ms)|virt:  19.16s (+1.19ms)] [   13.628455] Bluetooth: HCI UART driver ver 2.3
11:33:24.8936 [INFO] uart3: [host:  78.14s (+1.15ms)|virt:   19.16s (+0.1ms)] [   13.628571] Bluetooth: HCI UART protocol H4 registered
11:33:24.9007 [INFO] uart3: [host:  78.15s (+7.11ms)|virt:   19.16s (+1.3ms)] [   13.629840] sdhci: Secure Digital Host Controller Interface driver
11:33:24.9017 [INFO] uart3: [host:  78.15s (+0.98ms)|virt:   19.16s (+0.1ms)] [   13.629967] sdhci: Copyright(c) Pierre Ossman
11:33:24.9036 [INFO] uart3: [host:  78.15s (+1.89ms)|virt:   19.16s (+0.3ms)] [   13.630201] Synopsys Designware Multimedia Card Interface Driver
11:33:24.9078 [INFO] uart3: [host:  78.15s (+4.27ms)|virt:   19.16s (+0.8ms)] [   13.631030] sdhci-pltfm: SDHCI platform and OF driver helper
11:33:24.9148 [INFO] uart3: [host:  78.16s (+6.98ms)|virt:   19.16s (+1.4ms)] [   13.632317] usbcore: registered new interface driver usbhid
11:33:24.9157 [INFO] uart3: [host:  78.16s (+0.88ms)|virt:   19.16s (+0.1ms)] [   13.632438] usbhid: USB HID core driver
11:33:24.9491 [INFO] uart3: [host:  78.2s (+33.35ms)|virt:   19.17s (+9.2ms)] [   13.641298] NET: Registered protocol family 17
11:33:24.9537 [INFO] uart3: [host:   78.2s (+4.66ms)|virt:   19.17s (+0.8ms)] [   13.642050] Bluetooth: RFCOMM TTY layer initialized
11:33:24.9549 [INFO] uart3: [host:   78.2s (+1.24ms)|virt:   19.17s (+0.2ms)] [   13.642184] Bluetooth: RFCOMM socket layer initialized
11:33:24.9561 [INFO] uart3: [host:   78.2s (+1.12ms)|virt:   19.17s (+0.1ms)] [   13.642337] Bluetooth: RFCOMM ver 1.11
11:33:24.9575 [INFO] uart3: [host:    78.2s (+1.4ms)|virt:   19.17s (+0.2ms)] [   13.642479] Bluetooth: BNEP (Ethernet Emulation) ver 1.3
11:33:24.9589 [INFO] uart3: [host:    78.2s (+1.4ms)|virt:   19.17s (+0.1ms)] [   13.642601] Bluetooth: BNEP filters: protocol multicast
11:33:24.9604 [INFO] uart3: [host:  78.21s (+1.43ms)|virt:   19.17s (+0.1ms)] [   13.642740] Bluetooth: BNEP socket layer initialized
11:33:24.9618 [INFO] uart3: [host:  78.21s (+1.46ms)|virt:   19.17s (+0.2ms)] [   13.642862] Bluetooth: HIDP (Human Interface Emulation) ver 1.2
11:33:24.9629 [INFO] uart3: [host:  78.21s (+1.12ms)|virt:   19.17s (+0.1ms)] [   13.643008] Bluetooth: HIDP socket layer initialized
11:33:24.9681 [INFO] uart3: [host:  78.21s (+5.18ms)|virt:   19.17s (+1.2ms)] [   13.644158] 9pnet: Installing 9P2000 support
11:33:24.9700 [INFO] uart3: [host:  78.22s (+1.92ms)|virt:   19.17s (+0.3ms)] [   13.644448] Key type dns_resolver registered
11:33:24.9727 [INFO] uart3: [host:  78.22s (+2.72ms)|virt:   19.17s (+0.5ms)] [   13.644917] Loading compiled-in X.509 certificates
11:33:25.0112 [INFO] uart3: [host: 78.26s (+38.48ms)|virt:   19.18s (+7.8ms)] [   13.652334] [dhd] dhd_module_init: in Dongle Host Driver, version 100.10.545.13 (r826445-20200914-2)
11:33:25.0124 [INFO] uart3: [host:  78.26s (+1.22ms)|virt:   19.18s (+0.1ms)] [   13.652505] [dhd] ======== dhd_wlan_init_plat_data ========
11:33:25.0126 [WARNING] sysbus: [U74_1: 0xFFFFFFE00051F27C] (tag: 'GPIO') ReadDoubleWord from non existing peripheral at 0x1191017C, returning 0x0.
11:33:25.0135 [INFO] uart3: [host:  78.26s (+1.15ms)|virt:  19.18s (+0.11ms)] [   13.652639] [dhd] dhd_wlan_init_gpio: WL_REG_ON=37
11:33:25.0146 [INFO] uart3: [host:  78.26s (+1.06ms)|virt:  19.18s (+0.19ms)] [   13.652753] [dhd] dhd_wifi_platform_load: Enter
11:33:25.0157 [INFO] uart3: [host:  78.26s (+1.12ms)|virt:   19.18s (+0.1ms)] [   13.652864] [dhd] Power-up adapter 'DHD generic adapter'
11:33:25.0176 [INFO] uart3: [host:  78.26s (+1.83ms)|virt:   19.18s (+0.2ms)] [   13.653104] [dhd] wifi_platform_set_power = 1, delay: 200 msec
11:33:25.0187 [INFO] uart3: [host:   78.26s (+1.2ms)|virt:   19.18s (+0.2ms)] [   13.653232] [dhd] ======== PULL WL_REG_ON(37) HIGH! ========
11:33:25.0189 [WARNING] sysbus: [U74_1: 0xFFFFFFE00051F2D0] (tag: 'GPIO') WriteDoubleWord to non existing peripheral at 0x1191017C, value 0x0.
11:33:25.0189 [WARNING] sysbus: [U74_1: 0xFFFFFFE00051F2DC] (tag: 'GPIO') WriteDoubleWord to non existing peripheral at 0x11910178, value 0x1.
11:33:29.2034 [INFO] uart3: [host:   82.45s (+4.18s)|virt:   19.51s (+0.33s)] [   13.966158] [dhd] wifi_platform_bus_enumerate device present 1
11:33:29.2054 [INFO] uart3: [host:     82.45s (+2ms)|virt:   19.51s (+0.1ms)] [   13.966284] [dhd] ======== Card detection to detect SDIO card! ========
11:33:29.2071 [INFO] uart3: [host:   82.45s (+1.7ms)|virt:   19.51s (+0.1ms)] [   13.966421] sdio: host isn't  initialization successfully.
11:33:33.0849 [INFO] uart3: [host:   86.33s (+3.88s)|virt:   21.63s (+2.12s)] [   16.006156] [dhd] failed to power up DHD generic adapter, 0 retry left
11:33:33.1180 [INFO] uart3: [host: 86.36s (+33.11ms)|virt:  21.65s (+16.9ms)] [   16.022457] [dhd] wifi_platform_set_power = 0, delay: 0 msec
11:33:33.1198 [INFO] uart3: [host:  86.37s (+1.83ms)|virt:   21.65s (+0.2ms)] [   16.022582] [dhd] ======== PULL WL_REG_ON(37) LOW! ========
11:33:33.1200 [WARNING] sysbus: [U74_1: 0xFFFFFFE00051F2D0] (tag: 'GPIO') WriteDoubleWord to non existing peripheral at 0x1191017C, value 0x0.
11:33:33.1201 [WARNING] sysbus: [U74_1: 0xFFFFFFE00051F2DC] (tag: 'GPIO') WriteDoubleWord to non existing peripheral at 0x11910178, value 0x0.
11:33:33.1221 [INFO] uart3: [host:  86.37s (+2.28ms)|virt:   21.65s (+0.1ms)] [   16.022716] [dhd] wifi_platform_bus_enumerate device present 0
11:33:33.1250 [INFO] uart3: [host:  86.37s (+2.94ms)|virt:   21.65s (+0.1ms)] [   16.022841] [dhd] ======== Card detection to remove SDIO card! ========
11:33:33.1273 [INFO] uart3: [host:  86.37s (+2.33ms)|virt:   21.65s (+0.2ms)] [   16.022979] sdio: host isn't  initialization successfully.
11:33:33.1293 [INFO] uart3: [host:  86.38s (+1.97ms)|virt:   21.65s (+0.1ms)] [   16.023105] [dhd] failed to power up DHD generic adapter, max retry reached**
11:33:33.1307 [INFO] uart3: [host:  86.38s (+1.36ms)|virt:   21.65s (+0.1ms)] [   16.023248] [dhd] unregister wifi platform drivers
11:33:33.1334 [INFO] uart3: [host:  86.38s (+2.72ms)|virt:   21.65s (+0.2ms)] [   16.023367] [dhd] wifi_platform_bus_enumerate device present 0
11:33:33.1350 [INFO] uart3: [host:   86.38s (+1.6ms)|virt:   21.65s (+0.1ms)] [   16.023493] [dhd] ======== Card detection to remove SDIO card! ========
11:33:33.1365 [INFO] uart3: [host:   86.38s (+1.5ms)|virt:   21.65s (+0.1ms)] [   16.023631] sdio: host isn't  initialization successfully.
11:33:33.1390 [INFO] uart3: [host:   86.38s (+2.4ms)|virt:   21.65s (+0.2ms)] [   16.023754] [dhd] ======== dhd_wlan_deinit_plat_data ========
11:33:33.1405 [INFO] uart3: [host:   86.39s (+1.6ms)|virt:   21.65s (+0.1ms)] [   16.023886] [dhd] dhd_wlan_deinit_gpio: gpio_free(WL_REG_ON 37)
11:33:33.1422 [INFO] uart3: [host:  86.39s (+1.74ms)|virt:   21.65s (+0.2ms)] [   16.024029] [dhd] dhd_module_init: Failed to load the driver, try cnt 0
11:33:33.1460 [INFO] uart3: [host:  86.39s (+3.73ms)|virt:   21.65s (+0.4ms)] [   16.024434] [dhd] dhd_module_init: Failed to load driver max retry reached**
11:33:33.1474 [INFO] uart3: [host:  86.39s (+1.42ms)|virt:   21.65s (+0.1ms)] [   16.024577] [dhd] dhd_module_init: Exit err=-19
11:33:33.1539 [INFO] uart3: [host:   86.4s (+6.51ms)|virt:  21.66s (+1.52ms)] [   16.025931] cfg80211: Loading compiled-in X.509 certificates for regulatory database
11:33:33.3661 [INFO] uart3: [host:   86.61s (+0.21s)|virt: 21.69s (+31.98ms)] [   16.056724] cfg80211: Loaded X.509 cert 'sforshee: 00b28ddf47aef9cea7'
11:33:33.3790 [INFO] uart3: [host: 86.63s (+12.93ms)|virt:   21.69s (+1.9ms)] [   16.058522] platform regulatory.0: Direct firmware load for regulatory.db failed with error -2
11:33:33.3811 [INFO] uart3: [host:  86.63s (+2.04ms)|virt:   21.69s (+0.2ms)] [   16.058691] cfg80211: failed to load regulatory.db
11:33:33.4310 [INFO] uart3: [host: 86.68s (+49.97ms)|virt:   21.69s (+3.2ms)] [   16.061784] Freeing unused kernel memory: 228K
11:33:33.4848 [INFO] uart3: [host: 86.73s (+53.76ms)|virt:  21.72s (+27.9ms)] [   16.088553] Run /init as init process
11:33:33.4856 [INFO] uart3: [host:  86.73s (+0.78ms)|virt:    21.72s (+27µs)] [   16.088647]   with arguments:
11:33:33.4863 [INFO] uart3: [host:  86.73s (+0.71ms)|virt:    21.72s (+91µs)] [   16.088735]     /init
11:33:33.4870 [INFO] uart3: [host:  86.73s (+0.77ms)|virt:    21.72s (+82µs)] [   16.088811]   with environment:
11:33:33.4880 [INFO] uart3: [host:  86.73s (+0.96ms)|virt:   21.72s (+0.1ms)] [   16.088901]     HOME=/
11:33:33.4892 [INFO] uart3: [host:  86.74s (+1.14ms)|virt:   21.72s (+0.1ms)] [   16.088981]     TERM=linux
11:33:33.8365 [INFO] uart3: [host:   87.08s (+0.35s)|virt: 21.76s (+42.02ms)] abcd
11:33:35.1559 [INFO] uart3: [host:    88.4s (+1.32s)|virt:   21.93s (+0.17s)] Starting syslogd: OK
11:33:35.4706 [INFO] uart3: [host:   88.72s (+0.31s)|virt:  21.97s (+40.7ms)] Starting klogd: OK
11:33:36.7649 [INFO] uart3: [host:   90.01s (+1.29s)|virt:   22.14s (+0.17s)] Running sysctl: OK
11:33:37.0560 [INFO] uart3: [host:    90.3s (+0.29s)|virt: 22.18s (+39.26ms)] Starting mdev... OK
11:34:05.3517 [INFO] uart3: [host:   0.12ks (+28.3s)|virt:   25.82s (+3.65s)] modprobe: can't change directory to '/lib/modules': No such file or directory
11:34:05.8687 [INFO] uart3: [host:   0.12ks (+0.52s)|virt: 25.89s (+67.12ms)] Saving random seed: [   20.091952] random: dd: uninitialized urandom read (512 bytes read)
11:34:05.8893 [INFO] uart3: [host: 0.12ks (+20.65ms)|virt:  25.89s (+3.18ms)] OK
11:34:06.4301 [INFO] uart3: [host:   0.12ks (+0.54s)|virt: 25.96s (+69.12ms)] Starting system message bus: [   20.161287] random: dbus-uuidgen: uninitialized urandom read (12 bytes read)
11:34:06.4331 [INFO] uart3: [host:  0.12ks (+3.07ms)|virt:   25.96s (+0.4ms)] [   20.161660] random: dbus-uuidgen: uninitialized urandom read (8 bytes read)
11:34:06.6875 [INFO] uart3: [host:   0.12ks (+0.25s)|virt:    26s (+36.31ms)] done
11:34:08.4811 [WARNING] ethernet: Access to unknown phy 0 (2)
11:34:08.4839 [INFO] uart3: [host:    0.12ks (+1.8s)|virt:   26.23s (+0.23s)] Starting network: [   20.420445] stmmaceth 10020000.gmac eth0: validation of rgmii-txid with support 0000000,00000000,00006280 and advertisement 0000000,00000000,00006280 failed: -22
11:34:08.4844 [WARNING] ethernet: Access to unknown phy 0 (2)
11:34:08.4866 [INFO] uart3: [host:  0.12ks (+2.76ms)|virt:   26.23s (+0.4ms)] [   20.420878] stmmaceth 10020000.gmac eth0: stmmac_open: Cannot attach to PHY (error: -22)
11:34:08.4985 [INFO] uart3: [host: 0.12ks (+11.85ms)|virt:  26.24s (+1.67ms)] ip: SIOCSIFFLAGS: Invalid argument
11:34:08.5351 [INFO] uart3: [host: 0.12ks (+36.56ms)|virt:  26.24s (+5.73ms)] FAIL
11:34:09.3157 [INFO] uart3: [host:   0.12ks (+0.78s)|virt:    26.34s (+0.1s)] Starting dropbear sshd: OK
11:34:10.8269 [INFO] uart3: [host:   0.12ks (+1.51s)|virt:   26.57s (+0.23s)] Starting DHCP server: FAIL
11:34:11.1582 [INFO] uart3: [host:   0.12ks (+0.33s)|virt:   26.69s (+0.12s)] 
11:34:11.1683 [INFO] uart3: [host: 0.12ks (+10.19ms)|virt:  26.69s (+0.29ms)] Welcome to Buildroot